"Preferred Logistics Group Inc","Kevin9824 Flair Dr El Mote Ca9173 11-6268419039Kevin@Aknien Net, Kevin 9824 Flair Dr El Mote Ca917311-6268419039 Kevin@Aknien Net","aknien.net","Phone Numbers:  --- Emails: Ca9173 11-6268419039Kevin@Aknien Net, Ca917311-6268419039 Kevin@Aknien Net","United States","6","Los Angeles, Ca, Long Beach, Ca","Ningpo, Shanghai","732393","Stainless Kitchen Supplies, Plastic Kitchen Supplies Stainless Kitchen Supplies, Stainless Kitchen Supplies Plastic Kitchen Supplies","6","78708","Preferred Logistics Group Inc","Kevin9824 Flair Dr El Mote Ca9173 11-6268419039Kevin@Aknien Net"
"Schnell Inc","230 26Th St Denver Co 80205 Us Attn Alvin Tel 626 330 5594, 230 26Th St Denver Co 80205 Us Attn: Alvin Tel:626 330 5594 Email: Lina@Lkcustomsbroker Com, 230 26Th St Denver Co 80205 Us Attn:Alvin Tel:626 330 5594 Email: Lina@Lkcustomsbroker Com","lkcustomsbroker.com","Phone Numbers: 6263305594 --- Emails: Lina@Lkcustomsbroker Com","United States","6","Los Angeles, Ca","Yantian","732393","Stainless Steel Kitchen Faucet, Cookie Cutter Mould, Kitchen Drain Rack","7","89430","Lk Customs Brokerage","19300 S Hamilton Ave Ste 140 Gardena Ca 90248 Tel: 310-328-0988 Fax: 310-328-0968"
"Shang Hai Jiu Yao Trade Co Ltd","9560 Buffalo Ave Suite 100 Rancho Cucamonga Ca 91730 Email:Jiaoluxie@Gmail Com, 9560 Buffalo Ave Suite 100 Rancho Cucamonga Ca 91730 Email:Vicki Nb@Krakenlogistics Net Etebroker@Yahoo Com","krakenlogistics.net.etebroker","Phone Numbers:  --- Emails: Jiaoluxie@Gmail Com, Vicki Nb@Krakenlogistics Net Etebroker","United States","6","Los Angeles, Ca","Ningpo","732393","Cup Cup Broom Dustpan Mop Toilet Brush Mop Stairs Flannel Blanket Mop Bucket Mop Bucket Cleaning Cloth Umbrella, Stainless Steel Cup Stainless Steel Cup Cleaning White Board Lug Nuts Tic Tac Toe Game Incandescent Bulb Vicki Krakenlogistics Jason Krakenlogistics, Stainless Steel Cup Stainless Steel Cup Heater Mop Vicki Krakenlogistics Jason Krakenlogistics","7","78430","Edward Transit Broker Inc, Shang Hai Jiu Yao Trade Co Ltd","11671 Dayton Dr Rancho Cucamonga Ca 91730 Tel:626-392-8731 Fax:310-965-0205 Email:@@@, 9560 Buffalo Ave Suite 100 Rancho Cucamonga Ca 91730 Email:Vicki Nb@Krakenlogistics Net Etebroker@Yahoo Com"
"Vtop International Inc","1910 Thomes Ave Cheyenne Wy 82001 E: Vtopint@163 Com C: +86 18060973389","163.com","Phone Numbers: +8618060973389 --- Emails: Vtopint@163 Com C","United States","6","Los Angeles, Ca","Ningpo","732393","Blanket Blanket Water Bottle Pet Mat Province Xmn Tplsupplychain, Water Bottle Blanket Water Bottle Vacuum Bottle Floor Stand Fujian Province Xmntplsupplychain, Water Bottle Mini Tripod Water Bottle Mini Tripod Background Vacuum Bottle Blanket Curtain Province Xmn Tplsupplychain","7","82661","Vtop International Inc","1910 Thomes Ave Cheyenne Wy 82001 E: Vtopint@163 Com C: +86 18060973389"
"Alcast Technologies","328 Lake Aven Hamilton On L8E3A2 A Ttn:Mr Andrew Doesborgh Tel:905-719-5076, 328 Lake Aven Hamilton On L8E 3A2 Attn:Mr Andrew Doesborgh Tel:905-719-5076, 328 Lake Aven Hamilton On L8E3A2 Attn:Mr Andrew Doesborgh Tel:905-719-5076","","Phone Numbers: 9057195076 --- Emails: ","United States","5","Long Beach, Ca, Seattle, Wa","Qingdao, Pusan","732393","Stainless Steel Fitting Casting","5","7119","",""
"Best Choice Best Buy Best Value Inc","613 Hope Chapel Rdlakewood Nj 08701Tel 1 732 534 2504","","Phone Numbers: 17325342504 --- Emails: ","United States","5","New York/Newark Area, Newark, Nj","Shanghai","761510","Aluminum Foil Containerh","5","36418","Best Choice Best Buy Best Value Inc","613 Hope Chapel Rdlakewood Nj 08701Tel 1 732 534 2504"
"Breden Incorporated","660 N Diamond Bar Blvd Unit 100 Di Amond Bar Ca 91765 Usa909-861-6188, 660 N Diamond Bar Bivd Unit 100 Di Amond Bar Ca 91765 Usa909-861-6188","","Phone Numbers: 9098616188 --- Emails: ","United States","5","Long Beach, Ca","Pusan","732393","Steel Kitchen Racks Wide, Steel Kitchen Racks, Steel Kitchen Racks Steel Kitchen Racks Wide","5","58634","Global Freight Services Usa Llc Chicago Branch, Lf Logistics Chicago Branch","1200 N Arlington He Ights Rd Suite 140 Itasca Il 6014 3 Usa630-860-7280, 1200 N Arlington Heights Rd Suite 140 Itasca Il 60143 Usa630-860-728 0"
"Dongguan Aoli Network Technology Co Ltd","C/O Amazon Services Llc Add:410 Terrry Ave N Seattle Wa 98109 Attn:Mr Lai Email:Link-Trans@Hotmail Com, C/O Amazon Services Llc Add:410 Terrry Ave N Seattle Wa 98109 Ken Tel:909-481-8999, C/O Amazon Services Llc Add:410 Terry Ave N Seattle Wa 98109 Attn:Marlboro Lee Email:Op-Emc@Hotmail Com","","Phone Numbers: 9094818999 --- Emails: Link-Trans@Hotmail Com, Op-Emc@Hotmail Com","United States","5","Los Angeles, Ca, New York/Newark Area, Newark, Nj","Yantian","732393","Dongguan Aoli Network Technology Stainless Steamer Basket Basketball Night Light Bread Basket Storage Bags Declaration Does Any Solid Wood, Dongguan Aoli Network Technology Stainless Steel Coffee Machine Cup Oven Mitt Bowl Does Any Solid Wood, Dongguan Aoli Network Technology Storage Rack Pet Playpen Solid Wooden","5","61693","Jaak Transport Inc, Arbor International Llc, Jjs Customs Service","16044 Augusta Dr Chino Hills Ca 91709 951-520-7695 Email:Info@Jtichb Com Jimmy@Jtichb Com, 240 S Garfield Ave Suite 302 Alhambra Ca 91801 Tel: 626 281-3638 Attn: Showpan Ng, 755 Port America Place Suite 343 Grapevine Tx 76051 Direct: 972 586 7405"
"Eko North America Inc","4205 Sw High Meadows Ave Palm City Fl 34990 Attn:Mary Ohrn Email:Maryo@Ekonorthamerica Com, 4205 Sw High Meadows Ave Palm City Fl 34990 Attn:Mary Ohrn Maryo@Ekon Orthamerica Com, 4205 Sw High Meadows Ave Palm City Fl 34990 Attn:Mary Ohrn Email:Maryo@Ekonorthamerica Com;","ekonorthamerica.com, ekon.orthamerica.com","Phone Numbers:  --- Emails: Maryo@Ekonorthamerica Com, Ohrn Maryo@Ekon Orthamerica Com","United States","5","Los Angeles, Ca, Long Beach, Ca","Yantian","732393","Trash Can, Trash Can Trash Can, Trash Cantrash Can Trash Can Trash Can","8","35757","Eko North America Inc","16 Longitude Way Corona Ca 92881 Email: John@Translinkgloballlc Com Tel/Fax: 909-610-0386, 16 Longitude Way Corona Ca 92881 Email:John@Translinkgloballlc Com; Fei@Eko Com Cn Tel/Fax:909-610-0386 626-316-0807, 16 Longitude Way Corona Ca 92881 John@Pedge Co;Fei@Pedge Co Tel/Fax:909-610-0386 626-316-0807"
"Favored Team Inc","7901 4Th St N Ste 300 St Petersburg Fl 33702 Phone Number: +1-909-481-8999 Ein:84-3995673, 7901 4Th St N Ste 300 St Petersburg Fl 33702 Us Ein:84-3995673 Doc04@Link-Trans Com, 7901 4Th St N Ste 300 St Petersburg Fl 33702 Us Ein:84-3995673 Operation02@Link-Trans Com","link-trans.com","Phone Numbers: +19094818999 --- Emails: 84-3995673 Doc04@Link-Trans Com, 84-3995673 Operation02@Link-Trans Com","United States","5","Los Angeles, Ca, New York/Newark","Yantian, Xiamen","732393","Bbq Grill Ash Pan Bbq Grill Ash Pan Solid Wooden, Kitchen Knife Solid Wooden, Kitchen Storage Rack Kitchen Storage Rack Tuner Solid Wooden Infojtichb Operation Link Trans Operation Link Trans","7","71708","Jl Cusoms Servive Llc, Jl Customs Service Llc, Zall Foreign Trade Service Hong Kong Co Ltd","9570 Santa Anita Ave #A Rancho Cucamonga Ca 91730 Attn:Jacky Tel:626-290-7687, 9570 Santa Anita Ave #Arancho C Ucamonga Ca 91730 Jacky 626-290-7687 Info@Jl-Customservice Com, Suit 2101 Two Exchange Square 8 Connaught Place Central Hong"
"Fellow Industries Inc","560 Alabama St San Francisco Ca 94110 Usa Tel 6126009012 Attn Jake, 560 Alabama St San Francisco Ca 94110 Usa Tel: 6126009012 Attn : Jake, Attn Jake Miller 560 Alabama St San Francisco Ca 94110 Tel 1 612 600 9012","","Phone Numbers: 6126009012, 16126009012 --- Emails: ","United States","5","Los Angeles, Ca, Long Beach, Ca, Oakland, Ca","Kao Hsiung, Xiamen, Taipei","732393","Kitchenware Houseware Atmos Canister Matte Black Atmos Canister Matte Black Atmos Canister Matte White, Kitchenware Houseware Atmos Canister Matte White Atmos Canister Clear Glass Atmos Canister Clear Glass Atmos Canister Clear Glass Atmos Canister Clear Glass, Kitchenware Houseware Clyde Stovetop Kettle Kettle Stagg Ekg Stagg Ekg Shpt Solid Wood","8","32826","Fellow Industries Inc","560 Alabama St San Francisco Ca 94110 Usa Tel 6126009012 Attn Jake, 560 Alabama St San Francisco Ca 94110 Usa Tel: 6126009012 Attn : Jake, Attn Jake Miller 560 Alabama St San Francisco Ca 94110 Tel 1 612 600 9012"
"Freshstor Inc","43084 Rancho Way Suite B Temecula Ca92596 U S A Attn Gary Swanson Tel 800 574 5456, 43084 Rancho Way Suite B Temecula Ca92596 U S A Attn Gary Swanson Tel800 574 5456, 43084 Rancho Way Suite B Temecula Ca92596 U S A Tel:800 574 5456","","Phone Numbers: 8005745456 --- Emails: ","United States","5","Los Angeles, Ca, Long Beach, Ca","Pusan","732393","Stainless Steel Holloware Stainless Steel Holloware Aisi, Stainless Steel Holloware Stainless Steel Holloware Aisi Price Term Fob, Stainless Steel Kitchen Utensils","5","26683","Freshstor Inc","43084 Rancho Way Suite B Temecula Ca92596 U S A Attn Gary Swanson Tel 800 574 5456, 43084 Rancho Way Suite B Temecula Ca92596 U S A Attn Gary Swanson Tel800 574 5456, 43084 Rancho Way Suite B Temecula Ca92596 U S A Tel:800 574 5456"
"Grafoos Inc","16 W Cedar St Walsenburg Co 81089-1426 Us Tel:6267233822 Email:Dnohchb@Gmail Com, 16 W Cedar St Walsenburg Co 810891426 Us Tel:6267233822 Email:Dnohchb@Gmail Com, 16 W Cedar St Walsenburg Co 810891426 Us Tel:6267233822 Email:Dnohchb@Gmail Com ; Info@","","Phone Numbers: 6267233822 --- Emails: Dnohchb@Gmail Com","United States","5","Los Angeles, Ca","Yantian","732393","Stainless Steel Cups, Funnel, Stainless Steel Baking Tray","8","88847","David Noh Chb","2400 W Carson St Ste # 220 Torrance Ca 90501 Tel:310-774-0919;626 372 5111 E-Mail:Dnohchb@Gmail Com, 2400 W Carson St Ste # 220 Torrance Ca 90501 Tel:310-774-0919;626 372 5111 E-Mail:Dnohchb@Gmail Com ;"
"Kitchenware Craft Inc","4200 Charter St Vernon Ca 90058 Tel:323-582-7799 Fax:323-582-7070 Email:Kitchenware77@Gmail Com, 4200 Charter St Vernon Ca Usa 90058 Tel : 323-582-7799 Fax : 323-582-7070, 4200 Charter St Vernon Ca Usa 90058 Tel: 1-323-582-7799 Fax :1-323-582-7070","","Phone Numbers: 3235827070, 3235827799, 13235827070 --- Emails: Kitchenware77@Gmail Com","United States","5","Long Beach, Ca, Los Angeles, Ca","Pusan, Ningpo","761510","Aluminium Stick Cookware Aluminium Stick Cookware Import Great Way, Aluminum Die Cast Cookware Aluminum Die Cast Cookware, Aluminum Die Casting Cookware Aluminum Die Casting Cookware","5","61045","Kitchenware Craft Inc, Great Way Trade & Transportation Inc, Homage Commodity Procurement Limited","32550 Central Avenue Union City Ca 94587 Tel: 510 896-2818@@@, 4200 Charter St Vernon Ca Usa 90058 Tel : 323-582-7799 Fax : 323-582-7070, 4200 Charter St Vernon Ca Usa 90058 Tel: 1-323-582-7799 Fax:1-323-582-7070"
"L&H Internation Co Ltd","12825 E 37Th Ave Denver Co 80239 Attn:Ken Ken Lw@Hotmail Com Op-Emc@Hotmail Com, 12825 E 37Th Ave Denver Co 80239 E-Mail:Ken Lw@Hotmail Com Op-Emc@Hotmail Com Kokop34@Link-Trans Com, 12825 E 37Th Ave Denver Co 80239 E-Mail:Ken Lw@Hotmail Com Op-Emc@Hotmail Com Kokop38@Link-Trans Com","","Phone Numbers:  --- Emails: Ken Lw@Hotmail Com Op-Emc","United States","5","Los Angeles, Ca, Long Beach, Ca","Yantian","732393","Commodity Shelf Commodity Shelf Velvet Storage Solid Wooden Customservice Customservice Customservice, Storage Rack Ethernet Cable Thermal Printer Solid Wooden Agent Destination Zim Ameri Can Integrated Shipping Services Company East Ocean Blvd Suite Long Beach Phone, Storage Rack Headphones Tent Solid Wooden","6","56504","Jl Cusoms Service Llc, Jaak Transport Inc","Add: 661 Brea Canyon Rd Suite 7 Walnut Ca 91789 Phone#562- 477- 0077 Fax#562- 477- 0321, Add:9570 Santa Anita Ave # A Rancho Cucamonga Ca 91730 Attn:Jacky Tel:626-290-7687, Add:9570 Santa Anita Ave # A Rancho Cucamonga Ca 91730 Attn:Jacky Tel:626-290-7687@"
"Lg Sourcing Inc","1000 Lowes Boulevard Mooresville Nc 28117 Usa Importdocslowes Com Phone 704-758-1000, 1000 Lowe S Boulevard Mooresville Nc 28117 Usa Importdocs Lowes Com Phone 704-758-1000","","Phone Numbers: 7047581000 --- Emails: ","United States","5","Norfolk, Va, Los Angeles, Ca, Savannah, Ga","Mundra, Singapore","732393","Stainless Steel Sink Three Hundred Nine Only Stainless Steel Sink Desc Project Source Con Tract Sink Dated Shipping Bill Dated Value Usd Pan Iec, Stainless Steel Sink Two Hundred Eighty Three Only Stainless Steel Sink Desc Project Source Con Tract Sink Nohlxu Nohlg Nobolt Noe Dated Shipping Bill Dated Value Usd Pan Noiec, Three Hundred Nine Only Stainless Steel Sink Desc Project Source Con Tract Sink Hscode Dated Shipping Bill Dated Value Usd Pan Iec Purchase Main Carriage Cma Cgm Thalassa Tujje Pkgs","5","23162","Ups Supply Chain Solutions Inc","2031 S Centennial Ave Aiken Sc 29803 Email Upsusaknlowesdocsups Com Ph 1-803-502-6755 F 1-502-374-7424, 2031 S Centennial Ave Aiken Sc 29803 Email : Upsusaknlowesdocs Ups Com"
"Lollicup Usa Inc","6185 Kimball Ave Chino Ca 91708 Tel:001-626-965-8882 Ein#954781960, 6185 Kimball Ave Chino Ca91708 Tel:626 965 8882-110 Fax: 626 965 8729 Import Docs@Lollicup Com","lollicup.com","Phone Numbers: 0016269658882, 6269658729, 6269658882110 --- Emails: Import Docs@Lollicup Com","United States","5","Los Angeles, Ca","Ningpo, Qingdao","761510, 732393","Kitchen Ware Plastic Kitchen Ware Solid Wood Product Essential Supermarket Food Manufacturing Distribution, Household Tableware Household Tableware Product Essential Supermarket Food Manufacturing Distribution, Household Tableware Household Tableware Product Essential Supermarket Food Manufacturing Distribution Household Tableware","9","84077","Lollicup Usa Inc","6185 Kimball Ave Chino Ca 91708 Tel:001-626-965-8882 Ein#954781960, 6185 Kimball Ave Chino Ca91708 Tel:626 965 8882-110 Fax: 626 965 8729 Import Docs@Lollicup Com, Add:6185 Kimball Ave Chino Ca 91708 Tel:001-626-965-8882 Ein#954781960"
"Miir Holdings Llc","316 Florentia St Unit B Seattle Wa 98109 Usa Per Miller 2062345306 Per@Miir Com, 4000 156Th St Ne Suite 100 Marysville Attn: Mike Brady Phone Number:+1 425 501-4916 Wa Usa 98271, 4000 156Th St Ne Suite 100 Marysville Attn:Mike Brady Phone Number:+1 425 501-4916 Wa Usa 98271","miir.com","Phone Numbers: +14255014916 --- Emails: 2062345306 Per@Miir Com","United States","5","Los Angeles, Ca, Seattle, Wa, Oakland, Ca","Ningpo","732393","Stainless Steel Mug, Stainless Cup, Stainless Cup Vacuum Flask","5","20291","Miir Holdings Llc","316 Florentia St Unit B Seattle Wa 98109 Usa Per Miller 2062345306 Per@Miir Com, 4000 156Th St Ne Suite 100 Marysville Attn: Mike Brady Phone Number:+1 425 501-4916 Wa Usa 98271, 4000 156Th St Ne Suite 100 Marysville Attn:Mike Brady Phone Number:+1 425 501-4916 Wa Usa 98271"
"Natural Life Collections Inc","820 A1A North Suite W-4 Ponte Vedra Beach Fl 32082 Usa Tel: 904 2410370 Attn: Eve Chien, 820 A1A North Suite W-4 Ponte Vedra Beach Fl 32082 Tel : 904 2410370 Attn : Eve Chien & Ally Schultz, 820 A1A North Suite W-4 Ponte Vedra Beach Fl 32082 Tel : 904 2410370 Attn: Eve Chien","","Phone Numbers: 9042410370 --- Emails: ","United States","5","Jacksonville, Fl, Savannah, Ga, Tampa, Fl","Ningpo, Yantian, Pusan","732393","Drinkware Wine Tumbler Drinkware Coffee Tumbler Water Bottle Water Tumbler Stainless Steel Bowl Nowood, Giftware Camp Chair Coffee Tumbler Stainless Steel Bowl Water Tumbler Wood, Giftware Stainless Steel Dog Bowl Camp Chair Coffee Tumbler Water Bottle Wood","6","43128","Sheltered International","1 South 3Rd Street Amelia Island Fl 32034 Usa Ops@Siships Com Tel: +1-904-432-8866"
"Norpro Inc","2215 Merrill Creek Parkway Everett Wa 98203 Usa Tel425 261 1000 Fax425 561 1001, Add2215 Merrill Creek Parkway Everett Wa 98203-5899 U S A Tel 002-1-4252611000","","Phone Numbers: 4252611000, 4255611001, 0021425261100 --- Emails: ","United States","5","Tacoma, Wa, Seattle, Wa","Shanghai, Ningpo","732393","Table Kitchen Etc Articles Pts Stainless Stainless Steel Cookware, Table Kitchen Etc Articles Pts Stainless Stainless Steel Pots, Table Kitchen Etc Articles Pts Stainless Stainless Steel Strainer Nut Cracker Bakeware Stainless Steel Mesh Colander","5","43414","Norpro Inc","2215 Merrill Creek Parkway Everett Wa 98203 Usa Tel425 261 1000 Fax425 561 1001, Add2215 Merrill Creek Parkway Everett Wa 98203-5899 U S A Tel 002-1-4252611000"
"Quinton International Inc","4451 Eucalyptus Ave Suite 310 Chi No Ca 91710 T= 909-597-8886 F= 909 -597-8111","","Phone Numbers: 9095978111, 9095978886 --- Emails: ","United States","5","Long Beach, Ca","Yantian","761510, 732393","Alu Tools Solid Wood, Peeler Plastic Tools Alu Tools Metal Tools Kitchen Knife Thi Solid Wood, Smart Burner Alu Tools Solid Wood","5","44790","Quinton International Inc","4451 Eucalyptus Ave Suite 310 Chi No Ca 91710 T= 909-597-8886 F= 909 -597-8111"
"Risen King Limited","6547 N Academy Blvd 2266 Colorado Springs Co 80918 Tel:031-6581959 Ocean@Guardiancustoms Com","guardiancustoms.com","Phone Numbers:  --- Emails: 031-6581959 Ocean@Guardiancustoms Com","United States","5","Los Angeles, Ca, Oakland, Ca","Yantian","732393","Stainless Steel Kitchen Appliances Stainless Steel Kitchen Appliances Liqingju Shu Foxmail, Stainless Steel Kitchen Supplies Stainless Steel Kitchen Supplies Liqingju Shu Foxmail, Stainless Steel Kitchen Utensils Stainless Steel Kitchen Utensils Liqingju Shu Foxmail","5","47516","Shenzhen Jia King Import & Export Co Ltd","Rm2705-2707 Building A Lushan Hotel Chungfeng Road Luohu District, Rm2705-2707 Building A Lushan Hotel Chungfeng Road Luohu Districtshenzhen China"
"T Pac Enterprises Ltd","Po Box 99900 Rt 133 504 Pro Blundell Centre Richmond Bc Canada V7C 0A8 Tel:+1 604 716 6137 Contact:Emily Ma, Po Box 99900 Rt 133 504 Pro Blundell Centre Richmond Bc Canada V7C 0A8 Attn: Emily Ma Tel:+1604 716 6137, Po Box 99900 Rt 133 504 Pro Blundell Centre Richmond Bc Canada V7C 0A8 Attn:Emily Ma Tel:+1 604 716 6137","","Phone Numbers: +16047166137 --- Emails: Ma Tpacenterprises@Gmail Com","United States","5","Tacoma, Wa","Kao Hsiung","732393","Household Ware","5","32087","T Pac Enterprises Ltd","Po Box 99900 Rt 133 504 Pro Blundell Centre Richmond Bc Canada V7C 0A8 Tel:+1 604 716 6137 Contact:Emily Ma, Po Box 99900 Rt 133 504 Pro Blundell Centre Richmond Bc Canada V7C 0A8 Attn: Emily Ma Tel:+1604 716 6137, Po Box 99900 Rt 133 504 Pro Blundell Centre Richmond Bc Canada V7C 0A8 Attn:Emily Ma Tel:+1 604 716 6137"
"Tabletops Unlimited","Inc 23000 S Av 90745 310 549-6000, Inc 23000 S Avalon Blvd Carson Ca 90745 Tel: 310 549-6000, Inc 23000 S Avalon Blvd Carson Ca 90745 Tel: 310 549-6000 Fax: 310 549-3700","","Phone Numbers: 90745310549600, 3105496000, 3105493700 --- Emails: ","United States","5","Long Beach, Ca, Los Angeles, Ca","Ningpo, Kajang","761510, 732393","Aluminum Cookware Wood Also, Aluminium Cookware Aluminium Cookware, Aluminum Cookware Solid Wood Alsoshipper","9","57851","Tabletops Unlimited","Inc 23000 S Av 90745 310 549-6000, Inc 23000 S Avalon Blvd Carson Ca 90745 Tel: 310 549-6000, Inc 23000 S Avalon Blvd Carson Ca 90745 Tel: 310 549-6000 Fax: 310 549-3700"
"Tar Hong Texas","10702 Cash Road Stafford Tx 77477 Attn: Brian Chieu 713-690-0111, 10702 Cash Road Stafford Tx 77477 Attn:Brian Chieu 713-690-0111 Ext 309","","Phone Numbers: 7136900111 --- Emails: ","United States","5","Houston, Tx","Yantian, Pusan","732393, 761510","Aluminum Baking Pan Aluminum Baking Pan, Stainless Steel Cookware Stainless Steel Cookware, Stainless Steel Cookware Stainless Steel Cookware Stainless Steel Cookware","9","75848","Thunder Group Inc, Consignee And Success System Service","780 South Nogales Street City Of Industry Ca 91748 Email : Fionl@Thundergroup Com 626-935-1605, 780 South Nogales Street City Of Industry Ca 91748 E-Mail:Fionl@Thundergroup Com Tel:626-935-1605, 923 E Valley Blvd No 108 San Gabriel Ca 91776 Atten: Julie Wang"
"The Coleman Company Inc","180 North Lasalle St Suite 700 Chicago Il 60601 Attn: Erin Nicholas Fax: 316 219 5205, 180 North Lasalle St Suite 700 Chicago Il 60601 Attn: Erin Nicholas Fax:316 219 5205, 3600 N Hydraulic Wichita Ks 67219- 3598 Attn: Erin Nicholas Fax: 316 219 5205 Email:","","Phone Numbers: 3162195205, 9517273969 --- Emails: ","United States","5","Los Angeles, Ca, Long Beach, Ca","Yantian","732393, 761510","Mess Kit Person Aluminum Coffee Pot Cup Aluminum Mess Kit Person Aluminum Coffee Pot Cup Aluminum Canteen Cvr Belt Also Party Geodis Attn Charles Evenson Avenue South Suite Seatac Phone Colemanseattle Geodis Isf Gtn, Percolator Cup Newell Brands Distribution Llc Merritt Floor Norwalk Attentithe Coleman Company Phone Newellbrandsftz Newellco, Table Kitchen Other Househ Table Kitchen Other Househ Percolator Cup Kilograms Cubic Meters Oven Camp Oven Camp Kilograms Cubic Meters Powell Company Wando Park Bmt Pleasant Robin Elsmore Nrimports Chpowell Isf Gtn","7","72112","Ch Powell Company, Newell Brands Distribution Llc, The Coleman Company Inc","478 Wando Park Blvd Mt Pleasant Sc29464 Robin Elsmore Tel 843-856-2484, 301 Merritt 7 5Th Floor Norwalk C 06851 Attention: The Coleman Company Inc Phone: 203-845-5300, 478 Wando Park Blvd Mt Pleasant Sc 29464 Robin Elsmore Tel 843-856-2484"
"Topda Inc","7901 4Th St N Ste 300 St Petersburg Fl 33702 Us Ein:84-3809496 Operation02@Link-Trans Com, 7901 4Th St N Ste 300 St Petersburg Fl 33702 Us Operation02@Link-Trans Com, 7901 4Th St N Ste 300 St Petersburg Fl 33702 Us Email: Operation02@Link-Trans Com Tle:909-481-8999","link-trans.com","Phone Numbers: 9094818999 --- Emails: 84-3809496 Operation02@Link-Trans Com, Us Operation02@Link-Trans Com, Operation02@Link-Trans Com Tle","United States","5","Los Angeles, Ca, Long Beach, Ca, New York/Newark Area, Newark, Nj","Yantian, Shekou","732393","Kitchen Stents Shower Head Solid Wooden, Sink Caddy Pvc Cover Solid Wooden, Soap Dispenser Soap Dispenser Solid Wooden Info Customservice Ein","6","79718","Jl Cusoms Service Llc, Jl Cusoms Servive Llc, Jl Customs Service Llc","Add:9570 Santa Anita Ave #A Rancho Cucamonga Ca 91730 Attn:Jacky Tel:626-290-7687, 20418 East Walnut Drive North Units 1B & 1C Diamond Bar Ca 91789 Attn:Jacky"
"Town Food Service Equip Co Inc","72 Beadel Street Brooklyn Ny 1122 Tel: +1-718-388-5650 Fax: +1-718-388-5860, 72 Beadel Street Brooklyn Ny 11222 U S A Tel: +1-718-388-5650 Fax: +1-718-388-5860, 72 Beadel Street Brooklyn Ny 11222 U S A Tel: 718-388-5650","","Phone Numbers: +17183885650, +17183885860, 7183885650 --- Emails: ","United States","5","New York/Newark Area, Newark, Nj","Port Qasim","761510","Ddc Alloy Metal Alum Kitchenware Items Pgi Dated Jun Form Mbl Dated Jun, Ddc Alloy Metal Alum Kitchenware Items Pgi Dated Nov Form Mbl Dated Nov, Ddc Alloy Metal Alum Kitchenware Items Pgi Dated Oct Form Mbl Dated Oct","5","32240","Pan Link International Corp, Town Food Service Equip Co Inc","300 Merrick Road Suite 307 Lynbroo Tel: 516-561-3958 Ext: 202 Fax: 516E-Mail: Import@Panlink Com / Franci, 300 Merrick Road Suite 307 Lynbrook Ny 11563 Usa Tel: 516-561-3958 Ext: 202, 300 Merrick Road Suite 307 Lynbrook Ny 11563 Usa Tel: 516-561-3958 Ext:202"
"Zoey Global Sourcing Inc","815 Brazos St Austin Tx 78701 Jack Yang68@126 Com604-900-3093","126.com604-900-3093","Phone Numbers: 6049003093 --- Emails: Jack Yang68@126 Com604-900-3093","United States","5","Seattle, Wa, Tacoma, Wa","Yantian","732393","Kitchen Ware","5","64140","Canada Brightway International Logistics Ltd","270-4611 Viking Way Richmond Bc V6V2K9604-207-9922"
"Allmilmo Inc","795 S Cherokee St Littleton Co 801202338 Us Tel:6267233822 Email:Info@Mmanorinc Com;, 795 S Cherokee St Littleton Co 80120-2338 Ustel:6267233822Email:D Nohchb@Gmail Com ; Info@ Mmanorinc","mmanorinc.com","Phone Numbers: 6267233822 --- Emails: Info@Mmanorinc Com, D Nohchb@Gmail Com","United States","4","Los Angeles, Ca, Long Beach, Ca","Yantian, Shanghai","732393","Cup Wood, Stainless Steel Cup Wood, Stainless Steel Cupshs Ail Dnohchb Gmail Info Mmanorinc","5","62086","Jaak Transport Inc, David Noh Chb","661 Brea Canyon Rd Suite 7 Walnut Ca 91789 Tel:562- 477- 0077 Email:Info@Mmanorinc Com;, 2400 W Carson St Ste # 220 Torran Ce Ca 90501 Tel:310-774-0919;626 372 5111+"
"Ally Network Inc","1710 W Cameron Ave Ste # 200 West Covina Ca 91790 Tel: 626 705-9799, 1710 W Cameron Ave Ste # 200 West Covina Ca 91790 Tel: 626 705-9799 Email:@@, 1710 W Cameron Ave Ste # 200 West Covina Ca 91790 West Covina Tel: 626 705-9799","nqplainc.com","Phone Numbers: 6267059799 --- Emails: Derek@Nqplainc Com","United States","4","Long Beach, Ca, Los Angeles, Ca","Ningpo, Shanghai","732393","Stainless Steel Cup, Stainless Steel Kettle Wireless Keyboard, Stainless Steel Tumbler","4","52496","Ally Network Inc, Feidi Supply Chain Management Corp","1710 W Cameron Ave Ste # 200 West Covina Ca 91790 Tel: 626 705-9799 2531757496@Qq Com, 1710 W Cameron Ave Ste # 200 West Covina Ca 91790 Tel: 626 705-9799 Email:@@@, 1710 W Cameron Ave Ste # 200 West Covina Ca 91790 West Covina Tel: 626 705-9799"
"Amico Patient Care Corp","122 East Beaver Creek Road Richmondhill On L4B 1G6 Canada Phone: 90 5 764-0800 Ext, 122 East Beaver Creek Road Richmondhill On L4B 1G6 Canada Phone: 905 764-0800 Ext, 122 East Beaver Creek Road Richmondhill On L4B 1G6 Canada Phone:905 747 5029 Ext Fax:905 764 0643","","Phone Numbers: 9057640800, 9057475029, 9057640643 --- Emails: ","United States","4","Seattle, Wa, Tacoma, Wa","Pusan, Qingdao","732393","Brass Apc Apc Apc Apc Apc Apc Stainless Steel Apc Medical Use, Brass Apc Apc Apc Apc Apc Stainless Steel Apc Apc Medical Use, Brass Apc Apc Apc Stainless Steel Apc Apc Apc","4","9300","",""
