"Guangzhou Rui Kai Trade Co Ltd","1449 W Industrial Park St Covina Ca 91722 Contact Person: Jack 6266885363/6268262725","","Phone Numbers: 6266885363, 6268262725 --- Emails: ","United States","1","Los Angeles, Ca","Ningpo","761510","Hot Pot Hot Pot Wheel Spacer Step Ladder Mirror Leaf Rake Trailer Lock Elliptical Trainer Baixi Amassfreight Ganjiajun Amassfreight Etebroker Yahoo","1","15140","Daniel Liang Edward Transit Broker Inc","11671 Dayton Dr Rancho Cucamonga Ca 91730 Tel:626-392-8731 @@@"
"Gurudev Import Inc","18- Spruce Meadows Dr Monroe Nj 08817 Usa Tel:+17326498023","","Phone Numbers: +17326498023 --- Emails: ","United States","1","New York/Newark Area, Newark, Nj","Colombo Harbor","761510","Alloy Utensils Brass Copper Alloy Utensils Ctd","1","4317","Gurudev Import Inc","18- Spruce Meadows Dr Monroe Nj 08817 Usa Tel:+17326498023"
"Guyana Pawnbroking & Trade Compan","306 Peter Rose Street Queenstown G Georgetown Guyana Tel: +592 225 3860 Fax: +592 225 3","","Phone Numbers: +5922253860 --- Emails: ","United States","1","New York/Newark Area, Newark, Nj","Algeciras","761510","Fcl Hawkins Futu Pressure Cookers Hawkins Ressure Cookers Steel Futu Hard Anodised Aluminium Coo Kware Futura Stick Alumini Cookware Hawkins Stainless Steel Cookware","1","3603","Guyana Pawnbroking & Trade Compan","306 Peter Rose Street Queenstown G Georgetown Guyana Tel: +592 225 3860 Fax: +592 225 3"
"H&O Wholesale Corp","33 Court Street Brooklyn Ny 11231 U S A Tel:718-875-6116 Cel:247-277-6363 Fax:718-923-0237","","Phone Numbers: 2472776363, 7188756116, 7189230237 --- Emails: ","United States","1","New York/Newark Area, Newark, Nj","Hong Kong","761510","Aluminium Foil","1","9220","H&O Wholesale Corp","33 Court Street Brooklyn Ny 11231 U S A Tel:718-875-6116 Cel:247-277-6363 Fax:718-923-0237"
"Handlowy Llc","24300 Nandina Ave Moreno Valley Ca 925551-9534 Usa","","Phone Numbers: 9255519534 --- Emails: ","United States","1","New York/Newark Area, Newark, Nj","Yantian","732393","Bread Holder Toilet Brush Holder Chrome Color Saver Roll Paper Holder Containsno Solid Wood","1","12892","Handlowy Llc","24300 Nandina Ave Moreno Valley Ca 925551-9534 Usa"
"Hans Mill Corp","5406 West 1St Street Jacksonville Fl 32254 Usa Toddbeasley@Hans- Mill Com Joyennis@Hans-Mill Com","hans-mill.com","Phone Numbers:  --- Emails: Com Joyennis@Hans-Mill Com","United States","1","Savannah, Ga","Shekou","732393","Round Trash Bin Does Solid Wood","3","6432","Hans Mill Corp","5406 West 1St Street Jacksonville Fl 32254 Usa Toddbeasley@Hans- Mill Com Joyennis@Hans-Mill Com"
"Happy Forest Co Ltd","17008 Evergreen Pl City Of Industry Ca91745-1824 Tel: 626-234-9220 Email:Candy85921@Hotmail Com","","Phone Numbers: 6262349220 --- Emails: Candy85921@Hotmail Com","United States","1","Los Angeles, Ca","Yantian","732393","Vase Kitchen Ware Vase Kitchen Ware Ceramic Bowl Opener Mug Candle Holder Mirror Socks Notebook Keyring","1","3467","Jitong Freight Co Ltd","1960 S Carlos Ave Ontario Ca 91761 Tel: 626-768-9418 Ivywang@Jitongfreight Com"
"Harvest Grande Intl Llc","Ba Arc Import Corp 11271 Leo Ln Dallas Tx 75229 Tel: +1 972 406-0885 Tx 75229 Us","","Phone Numbers: +19724060885 --- Emails: ","United States","1","Houston, Tx","Yantian","761510","Aluminum Tamale Steamer Purchase Wood","1","7275","",""
"Haygrove Inc","230 Cross St Darlington South Carolina 29532 Usa 1-717-492-4955","","Phone Numbers: 17174924955 --- Emails: ","United States","1","Seattle, Wa","Hamble","732393","Steel Coil Steel Table Top Legs Haygrove Substrate Growing Systemssteel Coil Steel Table Top Legs Haygrove Substrate Growing Systemssteel Coil Steel Table Top Legs Haygrove Substrate Growing Systems Exporter Stacy Avilafracht","3","51620","Fracht Fwo Inc","16701 Greenspoint Park Drive Suite 300 Houston Texas 77060 Usax"
"Hefei Ranju Trade Co Ltd","Amazon 3550 Placentia Ct Chino Ca 91710 Email:Zhaoyun@Mz56Work Com Pre-Alert@Mz56Work Com","mz56work.com","Phone Numbers:  --- Emails: Zhaoyun@Mz56Work Com Pre-Alert","United States","1","Long Beach, Ca","Shanghai","732393","Backdrop Kettle Slippers","1","12109","Edward Transit Broker Inc","15000 Staff Ct Gardena Ca 90248 Em Ail:Zhaoyun@Mz56Work Com Pre-Alert@Mz56Work Com"
"Henry The E Commerce Expert Inc","Ein38-4229898 923 S Vermont Ave Los","","Phone Numbers: 384229898923 --- Emails: ","United States","1","Long Beach, Ca","Ningpo","732393","Luandry Hamper Wooden Decor Glass Decor Glassdecor Ceramic Ware Ceramic Ware Polyresin Tal Decor Wind Lantern Fitted Sheet Toddler Nap Pad Baby Carrier Art Easel Stand Climbing Hold Stainless Steel Cup","1","13931","Henry The E Commerce Expert Inc","Ein38-4229898 923 S Vermont Ave Los"
"Hestia Trade Inc","1624 Market St Ste 226 No78258 Denver Co 80202 710475948 Rm0001","","Phone Numbers: 80202710475948 --- Emails: ","United States","1","Tacoma, Wa","Yantian","732393","Storage Shelf Power Bank","1","14134","",""
"Hey Stone Inc","756 Port America Pl Ste 800 Grapevine Tx 76051 Tel: 626 336-2829 Fax: 626 336-2894","","Phone Numbers: 6263362829, 6263362894 --- Emails: ","United States","1","Los Angeles, Ca","Yantian","732393","Bowl Bowl Brawstring Cutting Mat Dish Drying Mat Eyelet Pliers Hanger Headphones Kitchen Holder Kitchenware Light Emitting Diode Led Lamps Paper Cutter Pizza Cutter Stainless Steel Cup Sets Stainless Steel Tamper Tabletop Accessories Trainig Equipment Solid Wood Kevin","1","9580","Jl Customs Service Llc","9570 Santa Anita Ave Suite A Rancho Cucamonga Ca 91730 Tel: 626 290-7687 Email: Op1@Jl-Customservice Com"
"Home Essentials & Beyond Inc","200 Theodore Conrad Drive Jersey City Nj 07305 Email:Mratuszniak@Homeess Comtel 732 590-3600 Ext 252","homeess.comtel.732","Phone Numbers: 7325903600 --- Emails: Mratuszniak@Homeess Comtel 732","United States","1","New York/Newark Area, Newark, Nj","Yantian","732393","Ceramic Ware Tuc Top Collection Xpd Ceramic Ware","1","13634","Allways Forwarding Of Ny Inc","161-15 Rockaway Blvd Suite 300Jamaica Ny 11434 Nancy Ng@Shipallways Com"
"Home Expressions Inc","195 Raritan Center Parkway Edison Nj 08837 Ac@Hmexpress Com Phone - 732-692-5000 Ext 5189","hmexpress.com","Phone Numbers: 7326925000 --- Emails: 08837 Ac@Hmexpress Com Phone","United States","1","New York/Newark Area, Newark, Nj","Yantian","732393","Step Bin Powder Coated Ilet Brush Powder Coated Dis Rack Helper Shelf Declaration Solid Wood From Shippe Attached Hereto Retro Step Bin Retro Step Bin Dish Rack Helper Shelf Declar Ation Solid Wood From Tached Hereto","3","14170","Gemini Shippers Association","137 West 25Th Street 3Rd Floor New York Ny 10001"
"Home Hardware Stores Limited","34 Henry Street W St Jacobs On N0B 2N0 Canada Phone: +1 519-664-2252Fax: +1 @@","","Phone Numbers: +15196642252 --- Emails: ","United States","1","Tacoma, Wa","Ningpo","761510","Aluminum Cookware Aluminum Cookware Phone","1","5904","Home Hardware Stores Limited","34 Henry Street W St Jacobs On N0B 2N0 Canada Phone: +1 519-664-2252Fax: +1 @@@"
"Home Hardware Stores Ltd","34 Henry Street West St Jacobs Ontario Canada N0B 2N0 Tel: 519-664-4716 Fax: 519-664-9971","","Phone Numbers: 5196644716, 5196649971 --- Emails: ","United States","1","Tacoma, Wa","Ningpo","761510","Forged Aluminium Frypan Forged Aluminium Frypan Solid Wood Jackie Hamilton Homehardware Katie Boodhoo Homehardware","1","4259","Home Hardware Stores Ltd","34 Henry Street West St Jacobs Ontario Canada N0B 2N0 Attn: Jackie Hamilton / Katie Boodhoo@@@"
"Hong Kong Ceiling International Trade Co Ltd","6380 Northwest Dr Mississauga On L4V 1J7 Yong Lu Tel:6478226883/ @","","Phone Numbers: 6478226883 --- Emails: ","United States","1","Seattle, Wa","Yantian","732393","Stainless Steel Trash Cans Stainless Steel Trash Cans Storage Info Fyinternationalgroup Operations Prestigeworld","1","9710","Prestige World","6500 Silver Dart Drive Mississauga On L5P 1B2 Tel 905-677-9993 Email Customs@Prestigeworld Ca"
"Hong Kong Tongtong International Trade Co","Limted Address:101A-11471 Blacksmith Place Richmond Bc Canada V7A 4T7 Tel:1 236 866-0305","","Phone Numbers: 12368660305 --- Emails: ","United States","1","Seattle, Wa","Yantian","732393","Bathroom Shelf Bathroom Shelf Shower Base Solid Wood","1","10060","M E C Express Ltd","1705 Meyerside Drive Mississauga On L5T 1B9 Tel:416 717 8855 Fax:905 670 8024 Info@Mec-Express On Ca"
"Hoopnet Inc","4130 Cahuenga Blvd Ste 310 Toluca Lake Ca 91602 Employer Identificati On Number: 92-2510440 1207945997@Qqcom 171112533@Qq Com Email: Justi","qqcom.171112533","Phone Numbers:  --- Emails: 92-2510440 1207945997@Qqcom 171112533","United States","1","Los Angeles, Ca","Ningpo","732393","Kettle","1","12293","Hoopnet Inc","4130 Cahuenga Blvd Ste 310 Toluca Lake Ca 91602 Employer Identificati On Number: 92-2510440 1207945997@Qqcom 171112533@Qq Com Email: Justi"
"Hot Topic Inc","18305 E San Jose Avenue City Of In Dustry Ca 91748 Tel:626 - 839 - 46 81 Imports Department","","Phone Numbers: 6268394681 --- Emails: ","United States","1","Long Beach, Ca","Shanghai","732393","Slow Cooker Pokemon","1","12779","",""
"Huahui International Import Inc","515 Hickory Stbarnett Mo 65011 3006040863@Qq Com","qq.com","Phone Numbers:  --- Emails: 65011 3006040863@Qq Com","United States","1","Los Angeles, Ca","Shanghai","732393","Key Chain Guangdong","1","9830","Uqi Shipping Inc","21450 Golden Springs Dr Unit 220 Diamond Bar Ca 91789Tel: 626-620 -65803006040863@Qq Com"
"Hudson Home Group Llc","85 Fulton Street Boonton Nj 07005 Usa Tel 973-402-8888 Fax973-334-2383","","Phone Numbers: 9733342383, 9734028888 --- Emails: ","United States","1","Los Angeles, Ca","Yantian","732393","Table Kitchen Oth Household Art Pts Alu Kitchenware Hud Stainless Steel Cookware","6","38558","Oceanland Services Inc","15241 Don Julian Rd City Of Industry Ca 91754 Tel626-573-8429 Fax626-573-1200"
"Huizhou Services Inc","Add:248 Route 25A 2019 East Setauket Ny 11733 Attn:Huizhou Email: 294 0228623@Qq Com Email: Zjhuizhou@Hotmail Com Tel:631633-0889 Ein:93-288","qq.com","Phone Numbers: 6316330889 --- Emails: 294 0228623@Qq Com Email","United States","1","Savannah, Ga","Ningpo","732393","Kitchen Ware","1","10384","Huizhou Services Inc","Add:248 Route 25A 2019 East Setauket Ny 11733 Attn:Huizhou Email: 294 0228623@Qq Com Email: Zjhuizhou@Hotmail Com Tel:631633-0889 Ein:93-288"
"Hyungje Joomooluck Restaurant","636 Sheridan St Honolulu Hi 96814T El 808 591 1827","","Phone Numbers: 8085911827 --- Emails: ","United States","1","Honolulu, Hi","Pusan","732393","Table Kitchen Stainless Steel","1","167","Hyungje Joomooluck Restaurant","636 Sheridan St Honolulu Hi 96814T El 808 591 1827"
"Imco Llc","11145 Inland Avenue Mira Loma Ca 91752 Ph: 800 777 4366 Fax: 972-624-7767","","Phone Numbers: 8007774366, 9726247767 --- Emails: ","United States","1","Los Angeles, Ca","Vung Tau","732393","Stainless Steel Kitchenware Shippi Terms Fob Chi Minh Port","1","13517","Imco Llc","11145 Inland Avenue Mira Loma Ca 91752 Ph: 800 777 4366 Fax: 972-624-7767"
"Impact Images Inc","22600 Temescal Canyon Road Corona Usa Ca 92883 Tel 951 674 1441","","Phone Numbers: 9516741441 --- Emails: ","United States","1","Los Angeles, Ca","Yantian","732393","Custom Top Polyester Tlf Steel Wood Mat Erials","1","15761","Impact Images Inc","22600 Temescal Canyon Road Corona Usa Ca 92883 Tel 951 674 1441"
"Imusa Usa Llcgroup","E Seb6000 Nw 97Th Avenue Unit 2633178 Doral Miami-Usa305-640-3000 Ext 3026","","Phone Numbers: 3056403000 --- Emails: ","United States","1","Port Everglades, Fl","Puerto Manzanillo","761510","Cookware Dae","1","3762","Imusa Usa Llcgroup","E Seb6000 Nw 97Th Avenue Unit 2633178 Doral Miami-Usa305-640-3000 Ext 3026"
"Indigo Inc","600 Prospect Ave Bldg G Piscataway Nj 08854 Ph:732-424-1302 Fax:732-424-1305 Tax Id#22-3380451","","Phone Numbers: 7324241302, 7324241305 --- Emails: ","United States","1","New York/Newark Area, Newark, Nj","","761510","Household Aluminium Foil Trays Household Aluminium Foil Trays","1","8215","Falcon Sound & Lighting","1824 Atlantic Ave Brooklyn Ny 11233Usa Tel:718-604-2299"
"International Pet Supplies &","Distribution 10850 Via Frontera San Diego Ca 92127 Atn:Jacquelyn Islava T:858-453-7845Email:Jacquelyn Islava@Petco Com","petco.com","Phone Numbers: 8584537845 --- Emails: Jacquelyn Islava@Petco Com","United States","1","Los Angeles, Ca","Kao Hsiung","732393","Table Kitchen Table Kitchen Other Articles Circle Thickness Stainless Steel Circles Magnetic Magnetic Declared That Wood Please Issue Sets Rated Seaway Bill Arjan Impex Pvt Yus Dal Pet Yusen Logistics Martinez Victor Castillo Petco","1","8621","International Pet Supplies & Distribution","654 Richland Hills Drive San Antonio Tx 78245 Attn: Victor Castillo & Liz @@@"
"International Pet Supplies & Distri","10850 Via Frontera San Diego Ca 92127 Attn:Jacquelyn Islava Tel:858-453-7845 ++","","Phone Numbers: 8584537845 --- Emails: ","United States","1","Savannah, Ga","Shanghai","761510","Soph Comfort Grip Metal Scoop Braselton Regional Wlgd Soft Fngr Toothbrush Braselton Regional Soph Leak Guard Pads Braselton Reg Ional Soph Leak Guard Pads Braselton Reg Ional Soph Leak Guard Pads Braselton Regional Soph Dog Odor Cntl Pads Braselton Regional Soph Scntd Leak Grd Pads Braselton Regional","1","14183","Yusen Logistics Americas Inc","-Inte 749 Port America Place Suite 200 Grapevine Tx 76051 Attn:Miho Mchaffie Tel#:817-481-8411 ++"
"International Process Solutions","Inc Six Club Rd Suite Three Baltimore Maryland 21210-2227 Usa Tel:+1-410-889-2544","","Phone Numbers: +14108892544 --- Emails: ","United States","1","New York/Newark Area, Newark, Nj","Kao Hsiung","732393","Pedals Thereof Aluminum Rubber Stainless Steel Steel Machined","1","1903","International Process Solutions Inc","Six Club Rd Suite Three Baltimore Maryland 21210-2227 Usa Tel:+1-410-889-2544"
"International Sales & Marketing","500 Carr 869 Ste 1315 Cantano Puerto Rico 00962-2019 787 287-8208 Mrn No 0079889-0011","","Phone Numbers: 00798890011, 009622019787287 --- Emails: ","United States","1","San Juan, Puerto Rico","Port Bustamante","732393","Aluminium Kitchen Ware","1","15945","Lanca Sales Inc","1235 Central Ave Hillside Nj 07205 Ein:22-347521700"
"Ivrose Inc","6369 Bluestone Way Fontana Ca 92336 Contact:Mr Chen Number:310-999-8395","","Phone Numbers: 3109998395 --- Emails: ","United States","1","Los Angeles, Ca","Yantian","732393","Kettle Household Necessities Kettle Household Necessities Hunan Province","1","11928","Lisa Business Co Ltd","Rm 1202 12/F Tung Chun Commercial Centre 438-444 Shanghai Street Kowloon Hongkong Tel:852-22678666 Fax:852-21375270"
"J Z Trade Corp","4030-E Pleasantdale Rd Suite E Doraville Ga 30340 Usa Tel:770-409-3988 Fax:770-263-5375","","Phone Numbers: 7702635375, 7704093988 --- Emails: ","United States","1","Savannah, Ga","Ningpo","732393","Stainless Steel Basket Stainless Steel Basket Wastebasket Sprayer Dish Racks Dog Leash Spoons Forks Garden Shoes Paper Fan Rope Dog Squeaky Toy Plastic Dog Bowl Pick Tools Caster Wheel Walking Stick Straw Hat Picture Frame Umbrella Screwdriver Heads Scissors Label Gun Dish Sponge Solar Lights Machete Gloves","1","13617","Smart Customs Solutions","5261 West Jones Bridge Rd Norcross Ga 30092 T:770-542-9855 Email:Amy Smartcustoms@Gmail Com"
"Jiaa International Logistics Ltd","310-8988 Fraserton Court Burnaby British Columbia V5J 5H8 Canada E-Mail:Anubhav@Jiaalogistics Ca@","jiaalogistics.ca","Phone Numbers:  --- Emails: Anubhav@Jiaalogistics Ca","United States","1","Tacoma, Wa","Shanghai","761510","Cumin Alsi Darati Handle Etc Cumin Alsi Darati Handle Etc Bill Rsli Codes Hbl","1","10380","Jiaa International Logistics Ltd","310-8988 Fraserton Court Burnaby British Columbia V5J 5H8 Canada E-Mail:Anubhav@Jiaalogistics Ca@"
"Jinrong Trade Inc","915 129Th St College Point Ny 11356 Water@Oopston Com Tel:917-862-5104","oopston.com","Phone Numbers: 9178625104 --- Emails: 11356 Water@Oopston Com Tel","United States","1","Long Beach, Ca","Yantian","732393","Stainless Steel Dining Stove Stainless Steel Dining Stove","1","10030","Jinrong Trade Inc","915 129Th St College Point Ny 11356 Water@Oopston Com Tel:917-862-5104"
"Jm Rodgers Co Inc","As Agents For Horizon 1975 Linden Blvd 3Rd Floor Elmonty Ny 11003 Tel:516-872-5570@@@@","","Phone Numbers: 5168725570 --- Emails: ","United States","1","New York/Newark Area, Newark, Nj","Ningpo","761510","Aluminum Bottle Aluminum Bottle Cnt Wood Aluminum Bottle","4","15567","Jm Rodgers Co Inc","As Agents For Horizon 1975 Linden Blvd 3Rd Floor Elmonty Ny 11003 Tel:516-872-5570@@@@"
"Jon Akiba Antiques Llc","3 North Federal Highway Dania Beach Fl 33004 Tel +1-305-632-5563 Jonathan@Akibaantiques Com","akibaantiques.com","Phone Numbers:  --- Emails: +1-305-632-5563 Jonathan@Akibaantiques Com","United States","1","New York/Newark Area, Newark, Nj","Le Havre","732393","Kitchen Ware Size Poa Letter Reference Term Kitchen Ware Marble Bookcase Poa Ddu","1","2800","Jon Akiba Antiques Llc","3 North Federal Highway Dania Beach Fl 33004 Tel +1-305-632-5563 Jonathan@Akibaantiques Com"
"Jsu Inc","382 Ne 191St 79525 Miami Fl 33179 Tel:7147496980 E-Mail:Kdsyoung@163 Com","163.com","Phone Numbers: 7147496980 --- Emails: Kdsyoung@163 Com","United States","1","Los Angeles, Ca","Yantian","732393","Shelf Solid Wood","1","17020","Jsu Inc","382 Ne 191St 79525 Miami Fl 33179 Tel:7147496980 E-Mail:Kdsyoung@163 Com"
"Juli Llc","4278 N Harbor Blvd Bldg 2 Fullerton Ca 92835 8189876180 Booking@Logistar Vip Kin Li","logistar.vip.kin","Phone Numbers:  --- Emails: 8189876180 Booking@Logistar Vip Kin","United States","1","Los Angeles, Ca","Yantian","732393","Storage Basket Didn Shown","1","9780","Juli Llc","4278 N Harbor Blvd Bldg 2 Fullerton Ca 92835 8189876180 Booking@Logistar Vip Kin Li"
"K Restaurant Group Inc","3885 Venture Dr Duluth Ga30096Tel 1-770-232-8881Attn Woongki Lee","","Phone Numbers: 17702328881 --- Emails: ","United States","1","Savannah, Ga","Pusan","732393","Household Articles Stainless Steel Ordinar","1","887","Same As Consignee","3885 Venture Dr Duluth Ga30096Tel 1-770-232-8881Attn Woongki Lee"
"Kam Kuo Trade Corp","Canada 74 Howden Rd Scarborough Ontario M1R 3E4 Canada Tel: 1-416-701-1997 Fax:1- 416-701-9544","","Phone Numbers: 14167011997, 14167019544 --- Emails: ","United States","1","Tacoma, Wa","Yantian","732393","Plastic Ware Plastic Ware Stainless Steel Ware Kitchen Ware","1","12402","Kam Kuo Trade Corp","Canada 74 Howden Rd Scarborough Ontario M1R 3E4 Canada Tel: 1-416-701-1997 Fax:1- 416-701-9544"
"Kaya Usa Co Ltd","14800 E 35Th Pl Aurora Co 80011 <Info@Smartsupplychaininc Com-","smartsupplychaininc.com","Phone Numbers:  --- Emails: Info@Smartsupplychaininc Com","United States","1","Oakland, Ca","Yantian","732393","Shelf Hangers Pull Out Cabinet Organizer Thermal Kettle Kitchen Tongs Photographic Lamp","2","17900","Edward Transit Broker Inc","15000 Staff Ct Gardena Ca 90248 Tel:626-392-8731 Fax:310-965-0205 Attn: Smart <Info@Smartsupplychaininc Com-"
"Kdy International Trade Inc","382 Ne 191St St 79525 Miami Fl 331 79 Ein:88-1493245 E-Mail:Kdsyoung@ 163 Com Tina@Qchlkj Com Tel 714749","qchlkj.com","Phone Numbers:  --- Emails: Com Tina@Qchlkj Com Tel","United States","1","Long Beach, Ca","Shanghai","732393","Stainless Steel Kitchen Sink","1","14855","Kdy International Trade Inc","382 Ne 191St St 79525 Miami Fl 331 79 Ein:88-1493245 E-Mail:Kdsyoung@ 163 Com Tina@Qchlkj Com Tel 714749"
"Keending Inc","Dd: 13918 E Mississippi Ave Num 60260 Aurora Co 80012 Attn:Rachel Email: Zhangweiniubi8@Gmail Com","","Phone Numbers:  --- Emails: Zhangweiniubi8@Gmail Com","United States","1","Los Angeles, Ca","Ningpo","732393","Cup","1","13210","Keending Inc","Dd: 13918 E Mississippi Ave Num 60260 Aurora Co 80012 Attn:Rachel Email: Zhangweiniubi8@Gmail Com"
"Kingstar Trade Inc","18351 Colima Road Ste 277 Rowland Heights Ca 91748626420-7715","","Phone Numbers: 917486264207715 --- Emails: ","United States","1","Long Beach, Ca","Yantian","732393","Piece Stainless Steel Bakeware","1","15140","Kingstar Trade Inc","18351 Colima Road Ste 277 Rowland Heights Ca 91748626420-7715"
"Kiss That Frog Inc","2310 4Th Street Ph 510 524-7611 Fax 510 524-7612 Berkely Ca 97410 Us","","Phone Numbers: 5105247611, 5105247612 --- Emails: ","United States","1","Oakland, Ca","Le Havre","732393","House Decoration","1","73","",""
"Kitchen Diamond Inc","241 E 4Th Street La Ca 90013 Usa Tel: 213 6265216 Fax: 213 6173652","","Phone Numbers: 2136173652, 2136265216 --- Emails: ","United States","1","Los Angeles, Ca","Kao Hsiung","732393","Stainless Steel Kitchenware Stainless Steel Kitchenware Zebra Brand Name Kitchen World","1","8294","Kitchen Diamond Inc","241 E 4Th Street La Ca 90013 Usa Tel: 213 6265216 Fax: 213 6173652"
"Klick Innovations Inc","Bartosz Markiewicz115 Cape Martin Circle Hendersonville North Caroli Na 28791Cel: 905-483-7494","","Phone Numbers: 9054837494 --- Emails: ","United States","1","New York/Newark Area, Newark, Nj","Ningpo","732393","Outdoor Stainless Steel Kitchen Cabinet","1","748","Klick Innovations Inc","Bartosz Markiewicz115 Cape Martin Circle Hendersonville North Caroli Na 28791Cel: 905-483-7494"
"Knape & Vogt Manufacturing Co","2700 Oak Industrial Dr Ne Grand Rapids Mi 49505-6081 Tel 616-459-3311 Fax 616-459-7787","","Phone Numbers: 6164593311, 6164597787 --- Emails: ","United States","1","Tacoma, Wa","Yantian","732393","Stainless Steel Cabinet Waste Bin Stainless Steel Cabinet Waste Bin Cabinet Waste Bin Bsc Snap Handle Bsc Snphndl Scb Snphndl Scb Snphndl Bsc Dbl Lock Bsc Dbllock Ecw Slide Clip Ecw Rsclip Wood Remark Dont Show Issue Seaway Bill Ams Local Charge Arranged Szx Rmb Payer Name Beijing Kang Jie Kong Intl Cargo Agent Shenzhen Branch","1","9160","Knape & Vogt Manufacturing Co","2700 Oak Industrial Dr Ne Grand Rapids Mi 49505-6081 Tel 616-459-3311 Fax 616-459-7787"
"Kombucha Now Llc","2542 Advance Rd Madison Wi 53718 U S A Attn:Kate Field Tel: 6023217806","","Phone Numbers: 6023217806 --- Emails: ","United States","1","Long Beach, Ca","Yantian","732393","Funnel Coce Oes Any Solid Wood","1","696","Kombucha Now Llc","2542 Advance Rd Madison Wi 53718 U S A Attn:Kate Field Tel: 6023217806"
"Kuhn Rikon Corp","C/O Javelin 7091 Central Ave 1-800-577-1060 Option 2","","Phone Numbers: 18005771060 --- Emails: ","United States","1","Oakland, Ca","Yantian","732393","Stainless Steel Cookware","1","4122","",""
"Kworld Trade Inc","83 Gyrfalcon Ct Windsor Co 80550 Tutu@Kjeclub Com Tel:6264064913","kjeclub.com","Phone Numbers: 6264064913 --- Emails: 80550 Tutu@Kjeclub Com Tel","United States","1","Los Angeles, Ca","Ningpo","732393","Tissue Holder Window Film Tissue Holder Window Film","1","13381","Loginet Inc","Add: 719 Nogales St City Of Industry Ca 91748 Tutu@Kjeclub Com Tel:6264064913"
"Lagom Kitchen Company","Dba Our Place 3924 Tuller Ave Culver City Ca 90230 United States Amir Tehrani Null Amir@Pramir Net","pramir.net","Phone Numbers:  --- Emails: Null Amir@Pramir Net","United States","1","Los Angeles, Ca","Ningpo","761510","Perfect Pot Roasting Rack","3","21021","Lagom Kitchen Company","Dba Our Place 3924 Tuller Ave Culver City Ca 90230 United States Amir Tehrani Null Amir@Pramir Net"
"Lake Industries Company","7735 Commercial Way Suite 100 Henderson Nv 89011 Usa Tel: 800 261-4501","","Phone Numbers: 8002614501 --- Emails: ","United States","1","Long Beach, Ca","Yantian","732393","Stainless Steel Cookware Declaration Does Any Solid Wood","1","10082","Lake Industries Company","7735 Commercial Way Suite 100 Henderson Nv 89011 Usa Tel: 800 261-4501"
"Lam S International Group","Usa Corp 229 Robbins Lane Syosset Ny 11791 Tel:516-261-9521 Fax:516-261-9522","","Phone Numbers: 5162619521, 5162619522 --- Emails: ","United States","1","New York/Newark Area, Newark, Nj","Kao Hsiung","732393","Kitchen Ware","1","11912","Lam S International Group","Usa Corp 229 Robbins Lane Syosset Ny 11791 Tel:516-261-9521 Fax:516-261-9522"
"Lanca Sales Inc","1235 Central Ave Hillside Nj 07205 Tel 973/326-8000 Email Tim@Lancasales Com","lancasales.com","Phone Numbers:  --- Emails: Email Tim@Lancasales Com","United States","1","New York/Newark Area, Newark, Nj","Ningpo","761510","Aluminum Tray Disposable Kitchen Supplies Aluminum Tray","1","16169","J M Rodgers Co Inc","245 Woodport Road Sparta Nj 07871 Office: 973 230-5615 Jmr-Docs@Jmrodgers Com"
"Langfan Snok Inc","942 Broadway Street Ste 314C Boulder Co 80302 United States Ein:30-1278398 Tel:909-270-1905","","Phone Numbers: 9092701905 --- Emails: ","United States","1","Los Angeles, Ca","Yantian","732393","Stainless Steel Cup Household Supplies","1","10020","Langfan Snok Inc","942 Broadway Street Ste 314C Boulder Co 80302 United States Ein:30-1278398 Tel:909-270-1905"
"Le Creuset Of Americainc 114 Bob Gifford","South Carolina 29916 Usa Contacts:E Dwina Wyman Ewyman@Lecreuset Com","lecreuset.com","Phone Numbers:  --- Emails: Wyman Ewyman@Lecreuset Com","United States","1","Charleston, Sc","Yantian","732393","Stainless Steel Mixing Bowls Lcg","1","4462","",""
"Leadership Freight De Colombia Ltda","Nit 900 218 858-4 Av Calle 26 96 J Atn Sandra Vasquez Movil 312 3103762 / Phone: 60 1 8","","Phone Numbers: 3123103762 --- Emails: ","United States","1","New York/Newark Area, Newark, Nj","Algeciras","732393","Packag Thousand Nine Hundred Fifty Two Only Sta Inless Steel Utensils Bill Iec Cod Inox June","1","7656","Leadership Freight De Colombia Ltda","Nit 900 218 858-4 Av Calle 26 96 J Atn Sandra Vasquez Movil 312 3103762 / Phone: 60 1 8"
"Leisure Living","180 Beaver Rd Churchville Ny 14428 Attn: Justin Josker Tel 716 773 7500 Ny 14150 Us","","Phone Numbers: 7167737500 --- Emails: ","United States","1","Tacoma, Wa","Ningpo","732393","Ladder Leaf Skimmer Pool Brush Thermometer Pool Stainless Steel Spare Pool Plasticspare Pool Cover Reel","2","9820","Leisure Living","180 Beaver Rd Churchville Ny 14428 Attn: Justin Josker Tel 716 773 7500 Ny 14150 Us"
