"Marigold Enterprises","Usa Llc 15402 Sw 144Th Ter Portland Or 97224 U S A Contact: Dwayne K Boyce Phone: 503-984-8004 E-","","Phone Numbers: 5039848004 --- Emails: ","United States","2","Seattle, Wa","Yantian","732393","Stainless Steel Quart Stockpot Stainless Steel Stick Skillets Cookware Pomrmn Stainless Steel Cookware Pomrmn Solid Ood Stainless Steel Quart Stockpot Stainless Steel Stick Skillets Cookware Pomrmn Stainless Steel Cookware Pomrmn Solid Ood, Stainless Steel Stick Skillest Cookware Pomrmn Lid Wood","4","28272","Marigold Enterprises","Usa Llc 15402 Sw 144Th Ter Portland Or 97224 U S A Contact: Dwayne K Boyce Phone: 503-984-8004 E-"
"Market Solutions Group Inc","125 Broad Ave Suite C18 North Ber Gen Nj 07047 Contact: Alexandra T El # 201-696-5004 Alexandra@Zavoram, 125 Broad Ave Suite C18 North Berg En Nj 07047Contact: Leslie Tel # 2 01-298-3086 Bergen 07047 Us","","Phone Numbers: 2012983086, 2016965004 --- Emails: ","United States","2","New York/Newark, New York/Newark Area, Newark, Nj","Ningpo, Shanghai","732393","Crunch Air Fryer Oven Spare Crunch Air Fryer Oven Gift, Stainless Steel Pressure Cooker Spare","2","18717","Fulfillment America Inc C/O Lapine Market Solutions Group, Market Solutions Group Inc","125 Broad Ave Suite C18 North Berg En Nj 07047Contact: Leslie Tel # 2 01-298-3086 Bergen Us, Enterprise Road Billerica Ma 01 821 Us Phone:+1-978-642-0430 Em"
"Maxplus International Inc","1839 Yeager Ave La Verne Ca 91750 Usa Tel909 596 2888 Fax909 596 5 596 Attn David Chen, 1839 Yeager Ave La Verne Ca 91750 Usa Tel:909 596 2888 Fax:909 596 5596 Attn :David Chen","","Phone Numbers: 9095962888, 9095965596 --- Emails: ","United States","2","Los Angeles, Ca","Yantian","732393","Steaming Pitcher, Steaming Pitcher Steaming Pitcher Cjl Oeigroup Cjl Oeigroup","2","20646","Clay Foon Wong Chb","10012 Norwalk Blvd Suite#100 Sant A Fe Springs Ca 90670 Tel 310-90 0-4477 Fax 562 906 7900, 10012 Norwalk Blvd Suite#100 Santa Fe Springs Ca 90670 Tel 310-900-4477 Fax 562 906 7900"
"Maxway Import Inc","4063 Temple City Blvd #A El Monte Ca 91731 Toll Free:1-866-886-7728","","Phone Numbers: 18668867728 --- Emails: ","United States","2","Long Beach, Ca","Yantian","732393","Stainless Steel Cookware Spare Wood, Stainless Steel Cookware Steamer Woks Stainless Steel Lid Woks Glass Lid Wood","2","24715","",""
"Merchsource Llc","7755 Irvine Center Drive Suite 100 Irvine Ca 92618 Attn: Ron Van Bave L Email: Rvb@Innovage Net, 7755 Irvine Center Drive Suite 100 Irvine Ca 92618 Tel: 949 609 5047 Attn: Ron Van Bavel","innovage.net","Phone Numbers: 9496095047 --- Emails: Rvb@Innovage Net","United States","2","Long Beach, Ca, Los Angeles, Ca","Jawaharlal Nehru, Kao Hsiung","732393","Stainless Steel Utensils Copper Mug Shot Cups Threesixty Release Customer Customer Release Iec Dtd Shipping Bill Dtd, Stainless Steel Utensils Copper Mug Shot Cups Threesixty Release Msl Customer Customer Release Threesixty Release Msl Customer Customer Release Dtd","2","3170","Merchsource Llc","7755 Irvine Center Drive Suite 100 Irvine Ca 92618 Attn: Ron Van Bave L Email: Rvb@Innovage Net, 7755 Irvine Center Drive Suite 100 Irvine Ca 92618 Tel: 949 609 5047 Attn: Ron Van Bavel"
"Mixpresso Llc","128 West 36Th Street 4Th Floor Ne W York Ny10018Tel 212 938 4333 Fa, 128 West 36Th Street 4Th Floor New York Ny10018 Tel: 212 938 4333 Fax ;212 938 4332","","Phone Numbers: 2129384333, 2129384332 --- Emails: ","United States","2","New York/Newark Area, Newark, Nj","Ningpo","732393","Espresso Capsule Coffee Machine Cup Mini Prep Food Processor Liter Electric Stainless Steel Kettle Cookware, Liter Electric Stainless Steel Kettle Ele","2","21201","Mixpresso Llc, Primary Freight Services Inc","128 West 36Th Street 4Th Floor Ne W York Ny10018Tel 212 938 4333 Fa, 644 Supreme Drive Bensenville Il 60106 Telephone: 630-332-3632 Contact : Liz Farr"
"Multipet International Inc","55 Madison Circle Drive East Rutherford Nj 07073 Usa 201 438-6600, 55 Madison Circle Drive East Rutherford Nj 07073 Usa Tel: 201-438-6600 Fax: 201-438-2990","","Phone Numbers: 2014386600, 2014382990 --- Emails: ","United States","2","New York/Newark Area, Newark, Nj","Colombo Harbor","732393","Pet Supplies Pet Supplies Iec Cin Ptc Corp Office Sanjay Gandhi Transport Nagar Delhi India Prealerts Nyc Mallorygroup, Pet Supplies Pet Supplies Iec Corp Office Sanjay Gandhi Transport Nagar Delhi India Arrivalnotices Nyc Mallorygro Note Mallory Alexander Will Payer Charges","2","7605","Mallory Alexander International Logistics Ny Llc, Multipet International Inc","55 Madison Circle Drive East Rutherford Nj 07073 Usa Tel: 201-438-6600 Fax: 201-438-2990Attn : Carolyn Pennino, 777 Sunrise Hwy Suite 310 Lynbrook Ny 11563 T: 516-371-1700 F: 516-371-1709@@"
"Neway International Inc","415 South 7Th Ave City Of Industry Ca 91746 Usa Contact Name John Tel 626-513-2830, 915 South Azusa Ave City Of Industry Ca 91748 Usa Contact Name: Serenatel:626-839-2650","","Phone Numbers: 6265132830, 6268392650 --- Emails: ","United States","2","Long Beach, Ca, Los Angeles, Ca","Yantian","732393","Stainless Steel Cookware Cordierite Pizza Stone, Stainless Steel Cookware Turkey Roaster Rack Lazy Susan Stainless Steel Roaster Pan Aluminum Cookware Bamboo Drawer Knife Block Stainless Steel Spoon Rest Xcell Mail Meilingunitedsunfine","4","35957","Neway International Inc, United Sunfine Logistics Inc","17870 Castleton Street Suite 208 City Of Industry California 91748 Puente Hills Business Center Tel 909-839-2860 Fax 909-839-0108X, 915 South Azusa Ave City Of Industry Ca 91748 Usa Contact Name: Serenatel:626-839-2650"
"Newton Buying Corp","770 Cochituate Ma 01701 Usa Fax508 390 5 846","","Phone Numbers: 5083905846 --- Emails: ","United States","2","Long Beach, Ca","Ningpo","761510","Aluminium Cookwaere","2","17103","Expeditors Los Angeles","19701 Hamilton Avenue Suite 100 Torrance Ca 90502 310-343-6200"
"Next Products Usa Llc","14101 Rosecrans Avenue Unit #J La Mirada Ca 90638 Attn:Mike Mohnani Tel:323-268-1888 @@","","Phone Numbers: 3232681888 --- Emails: ","United States","2","Los Angeles, Ca","Ningpo","761510","Bakeware Bakeware Alluminum Cookware, Cookware Alluminum Cookware Cookware Cookware Skillet","2","22155","Next Products Usa Llc","14101 Rosecrans Avenue Unit #J La Mirada Ca 90638 Attn:Mike Mohnani Tel:323-268-1888 @@@"
"Nomad Grills Llc","111 N Bishop Ave Suite A Dallas Tx 75208 Tax Id:82-1344699 Tel: +1-214-674-5905, 111 N Bishop Ave Suite A Dallas Tx 75208 Tax Id:82-1344699 Tel:+1-214-674-5905","","Phone Numbers: +12146745905 --- Emails: ","United States","2","Houston, Tx, Long Beach, Ca","Yantian","761510","Nomad Grill Without Stat Does Any Solid Wood","2","12621","Nomad Grills Llc","111 N Bishop Ave Suite A Dallas Tx 75208 Tax Id:82-1344699 Tel: +1-214-674-5905, 111 N Bishop Ave Suite A Dallas Tx 75208 Tax Id:82-1344699 Tel:+1-214-674-5905"
"Ocean Crossing Usa Corp","1 40 Ethel Road West Unite I Piscataway Nj 08854 Tel:732-6509688 Fax:732-6501998, 140 Ethel Road West Unit L Piscataway Nj 08854 Tel:732-6509688 Fax:732-6501998","","Phone Numbers: 7326501998, 7326509688 --- Emails: ","United States","2","Charleston, Sc, Tacoma, Wa","Ningpo","732393","Advertising Banner Advertising Banner Streamer Banner Pole Steel Stand Plastic Top Plastic Stand Flag Pole Bracket Screw Stainless Steel Clip, Flag Pole Flag Pole Banner Pole Plastic Ring Stainless Steel Strap Plastic Top","2","26398","Rga Logistics","29 Leinback Drive Bldg D-3 Charleston Sc 29407 Tel:843-7233868 Fax:843-7233859"
"Perfect 85 Degrees C Inc","20722 Currier Rd City Of Industry Ca 91789 Ms Lea Lee Tel: 510-2827970","","Phone Numbers: 5102827970 --- Emails: ","United States","2","Los Angeles, Ca","Yantian","761510","Baking Cups, Baking Cups Declaration Does Any Solid Wood","2","6832","Alfa International Logistics Inc, Perfect 85 Degrees C Inc","139 Mitchell Ave Suite 201 South San Francisco Ca 94080 U S A Tel: 650 8728886 Fax: 650 8728885, 20722 Currier Rd City Of Industry Ca 91789 Ms Lea Lee Tel: 510-2827970"
"Perfect Way Trade Llc","1405 Dewar Dr Rock Springs Wy 82901 E-Mai:Pwatllc@Yahoo Com","","Phone Numbers:  --- Emails: Pwatllc@Yahoo Com","United States","2","Los Angeles, Ca","Yantian","732393","Retail Store Fixtures Declaration Does Any Solid Wood, Retail Store Fixtures Does Wood","2","26110","Accurate Cargo Services","10725 Springdale Ave Unit 3 Santa Fe Springs Ca 90670 Tel: 323-303-3400 Fax: 323-303-3544, 10725 Springdale Ave Unit 3 Santa Fe Springs Ca 90670 Tel: 323-303-3400 Fax: 323-303-3544Email:Op@Accuservicesusa Com"
"Providence International Corp","425 S Pine St San Gabriel Ca 91776 Attn: Anitac Anitac@Oeigorup Com&Oeiecdox@, 425 S Pine St San Gabriel Ca 91776 Attn: Anitac Anitac@Oeigorup Com&Oeiecdox@Oeigro","oeigorup.com","Phone Numbers:  --- Emails: Anitac Anitac@Oeigorup Com","United States","2","Los Angeles, Ca","Yantian","732393","Glass Kettle Stainless Steel Thermos Cup Ceramic Stand Charger, Show Bill Glass Kettle Stainless Steel Thermos Cup Ceramic Stand Charger Declaration Does Any Solid Wood","3","32463","Oei International Inc","425 S Pine St San Gabriel Ca 91776 Attn: Anitac Anitac@Oeigorup Com&Oeiecdox@, 425 S Pine St San Gabriel Ca 91776 Attn: Anitac Anitac@Oeigorup Com&Oeiecdox@Oeigro"
"Quiedan Company","15400 Meridian Road Salinas Ca 93907 Tel:1-831-663-0770","","Phone Numbers: 18316630770 --- Emails: ","United States","2","Oakland, Ca","Kao Hsiung, Ningpo","732393","Steel Top Notch Stake, Steel Top Notch Stakesteel Top Notch Stake","8","107000","Gramter International Usa Co Ltd","863 North Douglas Street Suite 100 2Nd Floor El Segundo Ca 90245 Tel:1-3106068888 Fax:1-3106068886 El Segundo Ca 90245 Us"
"R And B Import Corp","208 E Boyd St Los Angeles Ca 90013 Los Angeles/Usa Phone 213-680-3680","","Phone Numbers: 2136803680 --- Emails: ","United States","2","Long Beach, Ca","Barcelona, Valencia","732393","Kitchen Wares Tea Pot Milkpan Casserole Frypan, Kitchenwares Casserole Tea Pot Coffee Pot Codes","2","14878","R And B Import Corp, Same As Consignee","208 E Boyd St Los Angeles Ca 90013 Los Angeles/Usa Phone 213-680-3680, Same As Cnee"
"Runheng Llc","Add:229 Se Douglas St Ste 210 Lees Summit Mo 64063 Attn:Armer E-Mail:Armer@Runhengllc Com","runhengllc.com","Phone Numbers:  --- Emails: Armer@Runhengllc Com","United States","2","Los Angeles, Ca","Ningpo, Yantian","732393","Stainless Steel Bottle Stainless Steel Bottle Rope Skipping Ningbo City Zhejiang Province, Teakettles Teakettles Yoga Mat Nancy","2","24826","Guang Dong Elyata Electric Equipment Co Ltd, Runheng Llc","Add:229 Se Douglas St Ste 210 Lees Summit Mo 64063 Attn:Armer E-Mail:Armer@Runhengllc Com, Flat C 9/F Winning House 72-76 Wing Lok Street Sheung Wan Hk Email: Alicia_3@163 Com"
"Rz Trade Inc","601 South 6Th Avenue La Puente California 91746 Tel:001-6264333314 Attn:Jancy","","Phone Numbers: 0016264333314 --- Emails: ","United States","2","Los Angeles, Ca","Yantian","732393","Kettle","2","15310","Paqs Logistics Inc","4441 Baldwin Ave Unit D El Monte Ca 91731 Mobil: 001-6264333314 Email: Eva@Uqishippinginc Com"
"Scioto Valley Woodworking Inc","423 Hopewell Rd Waverly Oh 45690 Ustel 219-801-4865","","Phone Numbers: 2198014865 --- Emails: ","United States","2","New York/Newark Area, Newark, Nj","Singapore","732393","Kitchen Cabinet Partskitchen Cabinet Partskitchen Cabinet Kitchen Cabinet Andparts Declare Product Composite Wood Compliant Phase Emission Standards Carb Atcm Epa Tsca Title Vikitchen Cabinet Partskitchen Cabinet, Kitchen Cabinet Partskitchen Cabinet Partskitchen Cabinet Kitchen Cabinet Andparts Declare Product Composite Wood Compliant Phase Emission Standards Carb Atcm Epa Tsca Title Vikitchen Cabinet Partskitchen Cabinet Partskitchen Cabinet","22","214799","",""
"Shenzhen Esunbay International Trade Co Ltd","C/O Amazon Services Llc 410 Terrry Ave N Seattle Wa 98109 Tel:+86 0755 2107 0915@@","","Phone Numbers: +860755210709 --- Emails: ","United States","2","Los Angeles, Ca","Yantian","732393","Toilet Paper Holder Toilet Paper Holder District Shenzhen Kennyfeng Dslbc Ytad Logistics Merrywei Szlbc Ytad Logistics Customservice","2","17939","Jl Customs Service Llc","Add: 9570 Santa Anita Ave Suite A Rancho Cucamonga Ca 91730 Tel: 909 500 2686 Op3@Jl-Customservice Com"
"Shipco Scan Transport","Ein 81-5445139 3110 W 84Th St Unit 4 Four And 5 Five Hialeah Florida 33018, Ein:81-5445139 3100 W 84Th St Unit#:4 Four Hialeah Fl 33018 Us","","Phone Numbers: 8154451393100, 8154451393110 --- Emails: ","United States","2","Los Angeles, Ca, Port Everglades, Fl","Kobe, Stadersand","732393, 761510","Kitchen House Hold Packed Jerichoprime Transport, Stainless Steel Cooking Knife","2","6571","Prime Transport Florida","1862 Northwest 82Nd Ave Miami Florida 33126 Office +1 305-591-0733 / Mobile 786 213-1985"
"Shuntak Intl Inc","6369 Bluestone Way Fontana Ca92336 9095078456 Shuntakop1@Gmail Com","","Phone Numbers:  --- Emails: 9095078456 Shuntakop1@Gmail Com","United States","2","New York/Newark Area, Newark, Nj","Yantian","732393","Kettle Kettle Printer, Kitchen Faucet Kitchen Faucet Printer Led Light Tea Kettle","2","16180","Kut International Co Ltd","Flat/Rm 1405C 14/F Lucky Centre 165-171 Wan Chai Road Wanchai Hongkong"
"Signature Housewares Inc","671 Via Alondra Suite 801 Camarillo Ca 93012 U S A Tel 805-484-6666","","Phone Numbers: 8054846666 --- Emails: ","United States","2","Los Angeles, Ca","Yantian","732393","Stoneware Kitchen Ware Stoneware Kitchen Ware, Stoneware Kitchen Ware Stoneware Kitchen Ware Mugs Bowls Spoon Rest Stoneware Kitchen Ware","4","49837","Clearfreight Inc","1960 East Grand Avenue Suite 700El Segundo Ca 90245 U S A Tel:310-726-0400 Fax :310-726-0420, 1960 East Grand Avenue Suite 700El Segundo Ca 90245 U S A Tel:310-726-0400 Fax:310-726-0420"
"Skyline Paper Enterprises","110 Morgan Ave Brooklyn Ny 11237 Usa Phone+17183866700 Emailparry0129@ Msn Com, Add:110 Morgan Ave Brooklyn Ny 112 37 Usa Brooklyn Kings New York U Nited States 17183866700 Telex: 112","","Phone Numbers: +17183866700, 17183866700 --- Emails: ","United States","2","New York/Newark, New York/Newark Area, Newark, Nj","Ningpo","761510","Aluminium Foil, Aluminium Foil Alumi Nium Foil Roll","2","30803","Skyline Paper Enterprises","Add:110 Morgan Ave Brooklyn Ny 112 37 Usa Brooklyn Kings New York United States 17183866700 Telex: 17"
"Solvana Products Inc","19223 Colima Rd 934 Rowland Heights Ca91748 Email:511052292@Qq Com","qq.com","Phone Numbers:  --- Emails: 511052292@Qq Com","United States","2","Los Angeles, Ca","Ningpo","732393","Stainless Steel Bottle Stainless Steel Bottle","2","24904","Solvana Products Inc","19223 Colima Rd 934 Rowland Heights Ca91748 Email:511052292@Qq Com"
"Spring Glory Corp","3587 N W 82 Av Doral Miami Fl 33122 U S A 305 670 0979","","Phone Numbers: 3056700979 --- Emails: ","United States","2","Miami, Fl","Valencia","732393","Cmau Paellas Groweight Mud Articles Churros Machine","2","5986","",""
"Star Ocean Wholesale Foods","1211 Pierce Butler Route Tel: 651 343-8098 Saint Paul Mn 55104 Us Saint Paul Mn55104 Us, 1211 Pierce Butler Route Tel: 651 343-8098 Saint Paul Mn 55104 Us Saint Paul Mn55104Us","","Phone Numbers: 6513438098 --- Emails: ","United States","2","New York/Newark Area, Newark, Nj","Laem Chabang","761510","Aluminium Cookware Cch Dat October, Aluminium Cookware Cch February","2","9779","",""
"Starbucks Coffee Company","2401 Utah Ave S Seattle Wa 98134-1435 Usa Tl 2063184288","","Phone Numbers: 2063184288 --- Emails: ","United States","2","Norfolk, Va","Valencia","732393","Merced Glass Clea Exw Aielo Malferit, Shinty Recycled Glass Clear Exw Aielo Malferit Tot Pkgs Panalpina Ave Kent Usa Starbucks Brokerage Sea Panalpina","2","22487","Panalpina Inc","21112 72Nd Ave S Kent Wa 98032 Usa Tel +1253518-2213 Email Starbucks-Brokerage Sea Panalpina"
"Sufen Trade Co Ltd","1942 Broadway St Ste 314C Boulder Co 80302 Email:Opall@Link-Trans Com","link-trans.com","Phone Numbers:  --- Emails: Opall@Link-Trans Com","United States","2","Houston, Tx, Los Angeles, Ca","Shanghai, Yantian","732393","Bento Bento Bottle Solid Wooden Infojl Customservice Opalllink Trans, Kitchen Shelving Solid Wooden","2","28489","Fast Chain Inc","575 W Manville St Compton Ca 90220 Entity No 4262969 Tel: 424 4527548 Emily"
"Sunshine International Corp","2005 Fletcher Creek Dr Memphis Tn 38133 Usa Fax: 901-452-8688 Tel: 901-452-0188","","Phone Numbers: 9014520188, 9014528688 --- Emails: ","United States","2","Houston, Tx, Los Angeles, Ca","Shanghai","732393","Steel Scaffold Aluminum Scaffold Stainless Steel Ware Seapriority Bco Ams, Steel Scaffold Stainless Steel Ware Seapriority","8","94731","V Alexander Co Inc","6555 Quince Road Suite 201 Memphis Tn 38119 Tel: 901 795-7761"
"Supreme Source & Supply Co","5776 Magnetic Loop San Jose Ca 95119 Supply12@Supervisionchn Com","supervisionchn.com","Phone Numbers:  --- Emails: 95119 Supply12@Supervisionchn Com","United States","2","New York/Newark Area, Newark, Nj","Ningpo","761510","Aluminum Foil Aluminum Foil Roll Aluminum Foil Sheets Aluminum Foil Lid Dome Lids, Aluminum Foil Aluminum Foil Sheets Aluminum Foil Roll Aluminum Foil Lid Dome","2","25283","Smart Supply Chain Inc","Our Mailing Address: 5680 Hwy 6 Ste 364 Missouri City Tx 77459 Our Group"
"Tcc Retail Marketing Inc","285 Riverside Avenue Suite 325 Westport Usa Ct 06880 Tel: +1 203 454-0066, 285 Riverside Avenue Suite 325 Westport Usa Ct 06880 Tel:+1 203 454-0066","","Phone Numbers: +12034540066 --- Emails: ","United States","2","Los Angeles, Ca","Yantian","732393","Saucepan Lid Casserole Lid Spout Rts Tcc Wooden Mate, Saucepan Lid Stick Fry Pan Rts Tcc Tiffany Budoff Sekologistics","2","22334","Seko Chicago Clearance","1111 Chase Ave Suite A Elk Grove Village Illinois Usa 60007 Contact: Tiffany Budoff"
"The North Barn Inc","19223 Colima Rd#749 Rowland Heights Ca91748 Tel:9095078456 Nbop99@Gmail Com, 19223 Colima Rd#749 Rowland Heightsca91748 Nbop99@Gmail Com","","Phone Numbers:  --- Emails: 9095078456 Nbop99@Gmail Com, Heightsca91748 Nbop99@Gmail Com","United States","2","Los Angeles, Ca, New York/Newark Area, Newark, Nj","Yantian","732393","Household Ware Household Ware Coffee Maker, Stainless Steel Bottle Chess Tea Kettle","2","21670","The North Barn Inc","19223 Colima Rd#749 Rowland Heights Ca91748 Tel:9095078456 Nbop99@Gmail Com"
"Three Internatonal Llc","63 Spring Valley Rd Paramus Berg En New Jersey United States 201-9 37-9998 Telex: 07652","","Phone Numbers: 2019379998 --- Emails: ","United States","2","New York/Newark Area, Newark, Nj","Shanghai","732393","Household Ware","2","22207","B&H Customs Services Inc","147-19 Springfield Lane #A Jamaica New York New York New York Unit Ed States Telex: 11413, 147-19 Springfield Lane #A Jamaica Queens New York United States T Elex: 11413"
"Tokimeku Inc","Dba Material 135 Madison Ave Fl 8 New York Ny 10016 Us 714 74795004, Dba Material 135 Madison Ave Fl 8New York Ny 10016 Us 714 797-5004","","Phone Numbers: 71474795004, 7147975004 --- Emails: ","United States","2","New York/Newark Area, Newark, Nj","Shekou, Yantian","732393","Saute Pan Wood, Stainless Steel Cookware","2","13149","Tokimeku Inc","Dba Material 135 Madison Ave Fl 8 New York Ny 10016 Us 714 74795004, Dba Material 135 Madison Ave Fl 8New York Ny 10016 Us 714 797-5004"
"Touch Of Class","3503 Olsen Blvd Suite 215 Amarillo Tx 79109 Email:Jenny@Cmsshipping Net, 3503 Olsen Blvd Suite 215 Amarillo Tx 79109 Will Z@Motherlines Com","cmsshipping.net, motherlines.com","Phone Numbers:  --- Emails: Jenny@Cmsshipping Net, Will Z@Motherlines Com","United States","2","Long Beach, Ca, Los Angeles, Ca","Yantian","732393","Ceramic Ware Kitchen Ceramic Ware Kitchen Ceramic Ware Kitchen Wooden Lid Shpt Solid Wood Jin Cmsshipping, Ceramic Ware Kitchen Ceramic Ware Kitchen Garden Wooden Cutting Board Shpt Solid Wood","5","59041","First Way Asia Limited","Unit 2508A 25/F Bank Of America Tower 12 Harcourt Road Central Hongkong Tel:852-39216080 Fax:852-39216081"
"Tradewind Invest Llc","555 Madison Avenue New York Ny 1022 Usa Tel:+1-212-765-4349","","Phone Numbers: +12127654349 --- Emails: ","United States","2","Los Angeles, Ca","Kajang, Singapore","761510","Cmau Kitchenware Alloy Metal Alum Kitchenware Items Pgi Spex, Kitchenware Kitchenware Alloy Metal Alum Kitchenware Items Pgi Spex Dated Hbl Ucl Khi Ddc Statement Solid Wood Has Requested Under Deck Placement","4","36070","M/S Faramarzipour Usa Inc","4311 Meadowview Place Encino Ca 91436 Usa Dun 103885794 Cell #: 323 582-2222, Dba Royal Manufactureres 4311 Meadowview Place Encino Ca 91436 Usa"
"Trancharm Global Inc","1995 E Cedar St Ontario Ca 91761-5572 953","","Phone Numbers: 917615572953 --- Emails: ","United States","2","Los Angeles, Ca","Xiamen","732393","Kitchen Ware Decorations Fishing Tackle, Kitchen Ware Household Casserole Carrierpet Playpen","2","26242","Trancharm Global Inc","1995 E Cedar St Ontario Ca 91761-5572 953"
"Transportes Internationales Scn S","Antonio Bellet 444 Of 1101 Providencia Santiago Chile Fono: 56 2 27845560, Antonio Bellet 77 Of 1501-Providencsantiago De Chile / Chile Tel :56 2 784 55 60 Fax :56 2 784 5","","Phone Numbers: 56227845560, 5627845560 --- Emails: ","United States","2","New York/Newark Area, Newark, Nj, Philadelphia, Pa","Istanbul","732393","Plastic Kitchen Product Kitch Enwares From Red Clay Sti Granite Oven Tray Steel Cookware Steel Pan Stick Granite Cookware Stick Granite Casserole Stick Granite Double Sided Grill Pan Stick Granite Wok Fry Pan Stick Granit Turkish Wok Pan Stick Ranite Fry Pan Stick Grni Creap Pan, Steel Cookware Steel Casserole Teel Pressure Cooker Stick Granite Cookware Stick Granite Dou Ble Sided Pan Stci Granite Casserole Stick Granite Fry Pan Stick Granite Wok Fry Pan Stick Granite Crepe Pan","2","13578","Transportes Internationales Scn S","Antonio Bellet 444 Of 1101 Providencia Santiago Chile Fono: 56 2 27845560, Antonio Bellet 77 Of 1501-Providencsantiago De Chile / Chile Tel :56 2 784 55 60 Fax :56 2 784 5"
"Trinity International Industries","930 E 233Rd Street Carson Ca 90745 Tel:404-480-4593","","Phone Numbers: 4044804593 --- Emails: ","United States","2","Los Angeles, Ca","Shanghai","732393","Stainless Steel Wall Shelf Kitchen Cart, Welded Stainless Steel Sink","2","27788","American Global Logistics","309 E Paces Ferry Rd Ne Suite 800 Atlanta Ga 30305 Usa Notify Aglsupplychain Com"
"Uhty Trade Inc","6545 Market Ave N Ste 100 North Canton Oh 44721Tel 1-909-481-8999Container@Link-Trans, 6545 Market Ave N Ste 100North Canton Oh 44721Tel:1-909-481-8999","","Phone Numbers: 19094818999 --- Emails: ","United States","2","Long Beach, Ca","Ningpo","761510","Aluminum Cookpot Alumi Solid Wooden, Aluminum Cookpot Aluminum Cookpot Solid Wooden","2","20935","Jl Customs Service Llc","20418 East Walnut Drive North Units 1B & 1C Diamond Bar Ca 91789 Attnjacky Te, 20418 East Walnut Drive North Units1B & 1Cdiamond Bar Ca 91789"
"Unfi Wholesale Inc","Phone:253-281-3368 11840 Valley View Rd Eden Prairie Mn 55344-3643","","Phone Numbers: 25328133681184 --- Emails: ","United States","2","Tacoma, Wa","Yantian","732393","Bbq Accessories Bbq Accessories Cust Gwb Beer Can Chicken Rack Stick Mesh Grill Led Grill Light Cover Hasselback Potato Slicer Pack Basting Brush Nylon Grill Brush Scrp Spatula Asst Plastic Fork Asst Plst Tongs Asst Topper Fish Wire Bskt Ast Corn Skewers Corn Holders Asst Marinade Injector Plastic Food Cover Digital Meat Thermometer Nylon Grill Scrub Brsh Ast Meat Claws Asst Chrome Skewers Top Asst Corn Holders Pig Pairs Corn Holders Dog Pairs Long Handle Basting Brush Plst Grill Brush Brst Baskt Flex Top Fld Hdl Skillet Removable Rws Hndl Chimney Starter Btm Rlse Marinade Tray Lid Bbq Scrub Brush Asst Bbq Caddy Declares That Does Any Solid Wood Mbl Unfi Wholesale Phone Valley View Eden Prairie, Sea Animal Cookie Cutter Sea Animal Cookie Cutter Desktop Fldable Portable Fan Portable Handeld Fan Sped Frisbee Asst Age Frisbee Asst Age Plastic Toys Gwb Nature Explorer Ant Condo Splash Potato Balloons Filler Gwb Floral Arrangement Floral Arrangement White Ceramic Pot Shell Succulent Decor Spring Decorations Gwb Green Ice Cream Maker Declares That Does Any Solid Wood District Shenzhen China Mbl Unfi Wholesale Phone Valley View Eden Prairie","2","15786","Unfi Wholesale Inc","Phone:253-281-3368 11840 Valley View Rd Eden Prairie Mn 55344-3643"
"Unicena Llc","Tax Id 472357662 2200Nw 32 Nd St Ste 1500 Pompano Beach - Fl - Zip Code 33069 Usa Phone +1 561 305-0160, Tax Id: 472357662 2200Nw 32 Nd St Ste 1500 Pompano Beach - Fl - Zip Code 33069 Usa","","Phone Numbers: 4723576622200, +15613050160 --- Emails: ","United States","2","Miami, Fl, Port Everglades, Fl","Cartagena, Port Bustamante","761510","Agreement Abroad Said Units Assorted Food Stuff Distributed Palnet Ruc Rsx Fda Registration Wooden Treated Certified, Said Assorted Food Stuff Abroad Agreement Due Fda Registration Wooden Treated Certified Continuation Consignee Att Marcus Mail Marcusunicena","4","47242","Dawn Freight Inc","44828-4430 Nw 74Th Avenue Miami - Fl - Usa Phone 305-597-1545 Mail Infodawnfreight Net, 44828-4430 Nw 74Th Avenue Miami - Fl - Usa Phone: 305-597-1545"
