"Global Group","Traiding Bv Berkelstraat 6 E Willemstad Curacao 05999 Tax Id 102308858 Fernando A Sancivier C Willemstad Ph 599 9 888 931","","Phone Numbers: 5999888931 --- Emails: ","United States","1","Houston, Tx","Tampico","302148","Kitchen Towel Toalla Cocina Premier Mega Nac Servilleta Premier Nal Servilleta Premier Nal Papel Higienico Higienol Exp Servilleta Elite Ultra Nal Papel Higienico Higienol Exp Papel Higienico Elite Gold Nac Higienol Exp Elite Gold Dise Nal","1","4042","Global Group","Traiding Bv Berkelstraat 6 E Willemstad Curacao 05999 Tax Id 102308858 Fernando A Sancivier C Willemstad Ph 599 9 888 931"
"Goldlog Brasil Log Inter Eireli","Epp Cnpj 16 832 760 0001/03","","Phone Numbers: 168327600001 --- Emails: ","United States","1","Houston, Tx","Veracruz","293499","Cajas Con Bandejacuadrada Asas Cajas Con Bandeja Ovalada Grill Cajas Con Bandeja Rectangular Cajas Con Bandeja Rectangular Con Asas Ergon Micas Cajas Con Bandeja Panqu Cajas Con Pavera Cajas Con Bandeja Ovalada Grill Squaredish Ovalroasting Dish Rectangular Dish Rectangular Dish Loafcake Dish Roaster Master Ovalroasting Dish","2","17972","Goldlog Brasil Log Inter Eireli","Epp Rua Exp Joao De Carvalho 26"
"Guilherme Magalhaes Abreu Mendes","Cpf: 036122246-70 Av Brig Fa Lima 2012-7O -Cjto 73-Jd","","Phone Numbers: 03612224670 --- Emails: ","United States","1","Houston, Tx","Veracruz","830130","Household Goodsbooks Clothes Glasses Ornaments Chair Lamp Kitchen Items Furniture Pictures Mirror","1","1450","Gerson And Grey Servicios Ltda","Cnpj 07768031/0001-36 Av Cjto 73-Jd Paulistano Sao Pau"
"Gulf Agency Co","Qatar W L L P O Box 6534 Doha Qatar Phone: 97444205760","","Phone Numbers: 97444205760 --- Emails: ","United States","1","Houston, Tx","Tampico","851660","Stoves","1","7392","Gulf Agency Co","Qatar W L L P O Box 6534 Doha Qatar Phone: 97444205760"
"Homeline Inc","Capitol Bye Pass Monrovia-Liberia Harb Email: Homelinelib73@Yahoo Com","","Phone Numbers:  --- Emails: Homelinelib73@Yahoo Com","United States","1","Houston, Tx","Tampico","845020","Washers Dryers Electric Stove Cargo Tra Cking Note","1","5369","Homeline Inc","Capitol Bye Pass Monrovia-Liberia Harb Email: Homelinelib73@Yahoo Com"
"Hst Sea & Air Freight B V","Transportcentrum 21 7547 Rt Enschede The Netherlands T 053-4804055 Ctc Safhst Nl","","Phone Numbers: 0534804055 --- Emails: ","United States","1","Houston, Tx","Veracruz","845710","Grills Profiles Reinforcedpl Rejillas Perfiles Plastico Reforzado Con Fibra Devidrio Accesorios Para Ensamble","1","9970","Hst Sea & Air Freight B V","Transportcentrum 21 7547 Rt Enschede The Netherlands T 053-4804055 Ctc Safhst Nl"
"Ignacio De Pablo Cajal C/O Inter","S&R S L C/ Bartomeu Garcia I Subira 6 08830 Sant Boi De Llobregat Phone +34 93 640 02 50 Fax +34 93 652 24 52 Poc Gisela","","Phone Numbers: +34936400250, +34936522452 --- Emails: ","United States","1","Houston, Tx","Veracruz","790700","Household Books Household Books Clothes Glasses Ornaments Chair Lamp Kitchen Items Furniture Pictures Mirror Sown Tare","1","2390","Inter S&R S L","Bartomeu Garcia I Subira 6 08830 San Boi De Llobregat Contact Inter S&R S L Telephone 34936400250"
"Jose Antonio Cervantes Cuellar","C/O Sit Grupo Empresarial S L Calle Rioja 5 28823 Coslada Madrid Spain Tel 0034 91 671 0608 Email Thomas Saurersitspain","","Phone Numbers: 0034916710608 --- Emails: ","United States","1","Houston, Tx","Veracruz","790700","Household Household Books Clothes Glasses Ornaments Chair Lamp Kitchen Items Furniture Pictures Mirror Sown Tare","1","1835","Jose Antonio Cervantes Cuellar","C/O Sit Grupo Empresarial S L Calle Rioja 5 28823 Coslada Madrid Spain Tel 0034 91 671 0608 Email Thomas Saurersitspain"
"Juan Pablo Dambra","C/O Robinsons Relocation Nuffield Way Abingdon Oxfordshire Ox14 1Tn Ctc Mary Bamford Tel +44 0 1235 552272","","Phone Numbers: +44012355522 --- Emails: ","United States","1","Houston, Tx","Veracruz","790700","Household Household Books Clothes Glasses Ornaments Chair Lamp Kitchen Items Furniture Pictures Mirror Sown Tare","1","314","Seaport Freight Services Limited","Suite 9 Unit 3 Orwell House Ferry Lane Felixtowe Suffolk Ip11 3Ql Ctc Phil Cory Tel 01394 676691 Email"
"K C Dat S Pte Ltd","6 Lok Yang Way Jurong Singapore 628625 Tax Id 196300186Z Contact Jose A Juan Lozano Aguirre Beltran Telephone 6562618116 Email","","Phone Numbers: 6562618116 --- Emails: ","United States","1","Houston, Tx","Veracruz","790700","Household Books Household Books Clothes Glasses Ornaments Chair Lamp Kitchen Items Furniture Pictures Mirror","1","979","K C Dat S Pte Ltd","6 Lok Yang Way Jurong Singapore 628625 Tax Id 196300186Z Contact Jose A Juan Lozano Aguirre Beltran Telephone 6562618116 Email"
"Kaipert Philipp Alexander Ascott Makati Gloriett A4 Ayala Center Makati","1224 Metro Manila Philippines Tax Id 8884265115972 Tel No 02 56478236","","Phone Numbers: 0256478236, 8884265115972 --- Emails: ","United States","1","Houston, Tx","Veracruz","830130","Household Books Clothes Glasses Ornaments Chair Lamp Kitchen Items Furniture Pictures Mirror Sown Tare","1","3160","Ags Four Winds","Compound 17 Phivedec Industrial Estate Veterans Center Taguig City Tax Id 043439564975Xx"
"Kestrel Liner Agencies Ltd","Barbados Tax Id:20219183 Gladstonia Building Fontabelle St Michael Barbados W I Telephone: 2464352626//2464352827//","","Phone Numbers: 2464352626, 2464352827 --- Emails: ","United States","1","San Juan, Puerto Rico","Port Bustamante","851660","Stoves Custom","1","7544","Kestrel Liner Agencies Llp Tax Id","710885661 829464 9505 Nw 108 Th Avenue Medley Florida 33178 At N:Calvin Alkins Ph:7862201650/"
"Kimberly Clark Commercial Inc","Calle Marginal Pr 165 Km 2/8 Pr00970 00970 Guaynabo","","Phone Numbers: 0097000970 --- Emails: ","United States","1","San Juan, Puerto Rico","Puerto Manzanillo","630292","Kitchen Towels","1","1387","Kimberly Clark Commercial Inc","Calle Marginal Pr 165 Km 2/8 Pr00970 00970 Guaynabo"
"Kronen International S A","Cuit 30-60451400-9 Valentin Gomez 151 Cp B1706Fma - Haedo Buenos Aires - Argentinaxx","","Phone Numbers: 3060451400 --- Emails: ","United States","1","Houston, Tx","Tampico","902810","Gas Stove Gas Stove","1","5906","Kronen International S A","Cuit 30-60451400-9 Valentin Gomez 151 Cp B1706Fma - Haedo Buenos Aires - Argentinaxx"
"Kronen International Sa Cuit Nbr","30604514009 N 3 Entre 107 Y 109 Sanluis C P 5700/Ar/30604514009 Contact Agustin Rosello Telephone 144 895023 6","","Phone Numbers: 1448950236 --- Emails: ","United States","1","Houston, Tx","Tampico","902810","Gas Stove Gas Stove","3","11803","Kronen International Sa Cuit Nbr","30604514009 N 3 Entre 107 Y 109 Sanluis C P 5700/Ar/30604514009 Contact Agustin Rosello Telephone 144 895023 6"
"La Pause Whole Sale And Retail","Cherlie Clare Phone: +164+3318154 Email: Cherlieclare@Hotmail Com","","Phone Numbers:  --- Emails: Cherlieclare@Hotmail Com","United States","1","Port Everglades, Fl","Puerto Manzanillo","851660","Assorted Spirits Gatorade Sodas Water Bottle Washing Stoves Pots Microwave Owen Blenders Brooms Mops Bed Sheets Towels","1","21438","Seacor Island Lines","1300 Eller Drive"
"La Victoria Discount","Ruc 660607352 Jose De Diego #4E Cayey Puerto Ricophone: 787-447-4230","","Phone Numbers: 7874474230 --- Emails: ","United States","1","San Juan, Puerto Rico","Puerto Manzanillo","950510","Christmas Ornaments Ribbons Garlands Artificial Flower Artificial Plants Glasswar Metal Ornaments Lamps Mirrors Plastic Folders Ove Electric Stove Boards Urtains Gift Deco Rations Plastic","1","8681","La Victoria Discount","Ruc 660607352 Jose De Diego #4E Cayey Puerto Ricophone: 787-447-4230"
"Laparkan Freight","2-9 Lombard Str Georgetown Guyana Karyn Billey@Laparkan Com","laparkan.com","Phone Numbers:  --- Emails: Karyn Billey@Laparkan Com","United States","1","Houston, Tx","Tampico","845140","Washing Center Microw Ave Refrigerator Door Refrigerator Door Frei Ght Agreed All Charges Payable Rangle Brasil Gas Stove","7","24034","Laparkan Freight","2-9 Lombard Str Georgetown Guyana Karyn Billey@Laparkan Com"
"Lucas Joys Petersen C/O Inter S&R","S L C/ Bartomeu Garcia Isubira 6 08830 Sant Boi De Llobregat Contactgabriela Arroyo Telephone 34 936 400 250 Email Garroyointe","","Phone Numbers: 34936400250 --- Emails: ","United States","1","Houston, Tx","Veracruz","790700","Household Household Books Clothes Glasses Ornaments Chair Lamp Kitchen Items Furniture Pictures Mirror Sown Tare","1","3450","Lucas Joys Petersen C/O Inter S&R","S L C/ Bartomeu Garcia Isubira 6 08830 Sant Boi De Llobregat Contactgabriela Arroyo Telephone 34 936 400 250 Email Garroyointe"
"Lucia Oderiz Balaguer","C/O Sit Grupo Empresarial S L Calle Rioja 5 28823 Coslada Madrid Spain Tel 00 34 91 671 0608 Fax 00 34 91 674 0654","","Phone Numbers: 0034916710608, 00349167406 --- Emails: ","United States","1","Houston, Tx","Veracruz","790700","Household Books Household Books Clothes Glasses Ornaments Chair Lamp Kitchen Items Furniture Pictures Mirror","1","1950","Lucia Oderiz Balaguer C/O Sit Grupo","Empresarial S L Av Fuentemar 13 C P 28823 Coslada Madrid Espa A Eori Esb28139780"
"Luis Eduardo Alonso Viegas","Av Brig Faria Lima -Cpf 03372939700 2012-7O-Cjto73-Jd Paulistano Sao Paulo Sp-Cep 01452-002-Brazil","","Phone Numbers: 033729397002012 --- Emails: ","United States","1","Houston, Tx","Veracruz","940340","Household Books Clothes Glasses Ornaments Chair Lamp Kitchen Items Furniture Pictures Mirror Sown Tare Ncm Wooden Treated Certified Conventional Heat Treatment Juarez Lerdo Veracruz Veracruz Mexico Contact Expo Gestaad Telephone Trafico Exportaciongestaad Xxcontact Andrea Hernandez Telephone Andreahtranscontainer Group","1","2656","Gerson And Grey Servios Ltda","Cnpj 07 768 031/0001-36 Av Brig Faria Lima 2012 - 7 - Cjto 73 - Jd Paulistano Sao Paulo Sp - Cep 01452-002 -"
"Luz Jesus Benavides Salinas C/O","Gosselin Mobility Italy Via Tito Trocchi 68 C P 00166 Roma Italia Contact Chiarra Mottola Telephone 0666178336 Email","","Phone Numbers: 0666178336 --- Emails: ","United States","1","Houston, Tx","Veracruz","830130","Kitchen Items Household Books Clothes Glasses Ornaments Chair Lamp Kitchen Items Furniture Pictures Mirror","1","960","Luz Jesus Benavides Salinas C/O","Gosselin Mobility Italy Via Tito Trocchi 68 C P 00166 Roma Italia Contact Chiarra Mottola Telephone 0666178336 Email"
"Mabe Sa De Cv","/ Paseo De Las Palmas 100 Lomas De Chapultepec 11000 Ciudad De Mexico / Atn Adrian Dominguez / Tel 5591788100 / Rfc Mab911203Rr7","","Phone Numbers: 5591788100 --- Emails: ","United States","1","Houston, Tx","Tampico","732111","Spare Stoves Washers Spare Custom Cargo Transit Outside Country Gateway Kestrel Liner Agencies Llc Tropical Shipping All Charges Should Payed Ppd Kestrel Liner Agencies","1","4784","Mabe Sa De Cv","/ Paseo De Las Palmas 100 Lomas De Chapultepec 11000 Ciudad De Mexico / Atn Adrian Dominguez / Tel 5591788100 / Rfc Mab911203Rr7"
"Makro Grocers As Brydens Sons Cnr Fort Anchorage","Roads St John S Antigua Ph: 268 462-1811","","Phone Numbers: 2684621811 --- Emails: ","United States","1","San Juan, Puerto Rico","Pointe A Pitre","630292","Payable San Jose Head Office Diapers Fem Towels Kitchen Towels","1","10239","Makro Grocers","1800 Nw 135 Avenue Suite 119 110 111 Miami Fl 33182 Usa"
"Malak Mattrass & Furniture Factory","Sammy Sofan Sucker Garden 134 Philipsburg Sint Marteen General Paises Bajos C P 9999 Phone Number 786 299 5141","","Phone Numbers: 7862995141 --- Emails: ","United States","1","Houston, Tx","Tampico","732111","Gas Stoves Washing Machine","1","4064","Ambar Distributors Llc","1372 Nw 78 Avenue Doral Fl 33126 Off 786 299 5141 Taxid 38-3795120 Contact Person Odette Barrios Opsforevertradng-Usa Net"
"Maria De La Paz Sanchez Rivera C/O Clover Systems Llc","15555 Panther Lake Dr Winter Garden Fl 34787 Usa Tel 305 499 7040","","Phone Numbers: 3054997040 --- Emails: ","United States","1","Port Everglades, Fl","Cartagena","790700","Household Books Household Books Clothes Glasses Ornaments Chair Lamp Kitchen Items Furniture Pictures Mirror Sown Tare","1","2150","Clover Systems Llc","Hhgs Imports Department Taxid 592570160 Tel 305 499 7040 Atencion Maria Rojas"
"Middle East Group","Nv Ajc Brouwers Rd 13 Cayhill Sint Maarten Union Road 89 Cole Bay Sint Maarten C P 99999 Ciudad Philipsburg/ Tel +1 721 543-7024 / Tax Id 435134954","","Phone Numbers: +17215437024 --- Emails: ","United States","1","Houston, Tx","Tampico","292145","Coolers Coolers Freezers Refr Side Side Automatics Gas Stove Refr Ptas Frigobares Washing Center Dryers","1","4552","Middle East Group","Nv Ajc Brouwers Rd 13 Cayhill Sint Maarten Union Road 89 Cole Bay Sint Maarten C P 99999 Ciudad Philipsburg/ Tel +1 721 543-7024 / Tax Id 435134954"
"Millennium Cargo Services Ltd","Suite 1L1 Hastingwood Industrial Estate Wood Lane Erdington Birmin Gham B24 9Qr Tax Id Gb670857016 Ctc Ali Askar Ph 0121 311 0550","","Phone Numbers: 01213110550 --- Emails: ","United States","1","Houston, Tx","Tampico","841869","Kitchen Ware Kitchen Ware Kitchen Ware Kitchen Ware Kitchen Ware Kitchen Ware","9","20626","Millennium Cargo Services Ltd","Suite 1L1 Hastingwood Industrial Estate Wood Lane Erdington Birmin Gham B24 9Qr Tax Id Gb670857016 Ctc Ali Askar Ph 0121 311 0550"
"Mondiale Vgl Pty Ltd","Tax Id: 68002433267; Bldg 1 1 Pier Road Banksmeadow Nsw 2019","","Phone Numbers: 68002433267 --- Emails: ","United States","1","Houston, Tx","Tampico","732111","Outdoor Grill Bgb Bqar Dcs Codes Remote Hpbrf Hpb Jacket Stainless Stl Bga Outdoor Grill Bgb Bqar Dcs Outdoor Grill Bgb Bqrn Dcs Cart Cad Cartcad Grill Cart Side Shelf Griddle Plate Bgc Gpdcs Codes","4","42089","Mondiale Freight Services Ltd","Head Office; Building 1 1 Coa +61 2 8336 8800"
"Mundoshop Europe","88 Avenue De L Europe 77184 Emerainville - France Ctc Nicolas Corbay Ph +33680960971 Vat Fr39751735556 Nicolasmundoshop Org","","Phone Numbers: +33680960971, 39751735556 --- Emails: ","United States","1","Houston, Tx","Veracruz","200897","Kitchen Manual Ware Bundles Carboard Agave Distilled Mezcal Groceries Beers Kitchen Manual Warehs","2","21267","Rue De Coupeauville B P","38 76133 Epouville France Ctc Lebigre Camille +33 0 2 35 13 37 87 Lebigre Cleonvincent Fr"
"Music Man / Front St","20 Phillipsburg St Maarten / Atn Jalkishin Pursnani / Ph 1721 542 4413 / Tax Id 811692501","","Phone Numbers: 17215424413 --- Emails: ","United States","1","Houston, Tx","Tampico","732111","Stoves Stoves Custom Cargo Transit Outside Country Gateway Kestrel Liner Agencies Llc Tropical Shipping All Charges Should Payed Kestrel Liner Agencies","1","5551","Music Man / Front St","20 Phillipsburg St Maarten / Atn Jalkishin Pursnani / Ph 1721 542 4413 / Tax Id 811692501"
"Neele Vat Ocean B V","Seattleweg 3 3195 Nd Pernis-Rotterdam The Netherlands Tel +31 0 88 996 4679 Email","","Phone Numbers: +310889964679 --- Emails: ","United States","1","Houston, Tx","Veracruz","790700","Household Books Household Books Clothes Glasses Ornaments Chair Lamp Kitchen Items Furniture Pictures Mirror Sown Tare","1","1400","Alvaro Serrano Ranz","C/O Voerman International Wolga 12 2491 Bj Den Haag The Netherlands Tel +31 0 88 996 4679 Email"
"North Carga S A","S Cod 0366 Nit Cll 25 G # 80C 71 Ph: 57-1 4047000 Atn Marcela Eslava Email Operacio Bogota-Colombia","","Phone Numbers: 5714047000 --- Emails: ","United States","1","Houston, Tx","Veracruz","850699","Equipment Kitchen","1","594","North Carga S A","S Cod 0366 Nit Cll 25 G # 80C 71 Ph: 57-1 4047000 Atn Marcela Eslava Email Operacio Bogota-Colombia"
"Omar E Cherit Hernandez C/O Gerson","And Grey Transportes Av Brig Faria Lima 2012 70 Abd Cj 73 Cep Cnpj 07768031/0001-36 01452926 Brasilxx","","Phone Numbers: 00013601452926 --- Emails: ","United States","1","Houston, Tx","Veracruz","790700","Household Household Books Clothes Glasses Ornaments Chair Lamp Kitchen Items Furniture Pictures Mirror Sown Tare Ncm","1","2000","Omar E Cherit Hernandez C/O Gerson","And Grey Transportes Av Brig Faria Lima 2012 70 Abd Cj 73 Cep Cnpj 07768031/0001-36 01452926 Brasilxx"
"Omar Francisco Lechuga Palomo C/O","Ags Relocations Dmcc P O Box 27049 Dubai Uae Trn 100278973100003 Contact Omar Francisco Lechuga Palomo","","Phone Numbers: 100278973100003 --- Emails: ","United States","1","Houston, Tx","Veracruz","790700","Household Books Household Books Clothes Glasses Ornaments Chair Lamp Kitchen Items Furniture Pictures Mirror","1","3820","Ags Relocations Dmcc","P O Box 27049 Dubai Uae Trn 100278973100003 Contact Roxanne Ong Telephone 971 4 454-1531"
"Onnera Colombia S A","S Xexx010101000 Bogota 110931 Bogota Numregidtrib 8110141373","","Phone Numbers: 8110141373 --- Emails: ","United States","1","Houston, Tx","Tampico","731010","Equipment Kitchen","4","12675","North Carga Sas Cod","0366 Nti 900 160 595-0 Calle 25 G No 80C-71 Tel 57-1-4047000 Cp 110931 5732258245070 Operacionesnorthcarga Com"
"Onnera Colombia Sas Tax Id 811","014 137-3 Calle 25 G#80C-11 C P 11001 Ctc:Laura Moreno Compras@Onneragroup Co/","onneragroup.co","Phone Numbers:  --- Emails: Moreno Compras@Onneragroup Co","United States","1","Houston, Tx","Tampico","841850","Equipo Cocina Kitchen Equipment","1","8831","Soluciones Depco Sas","Tax Id:900 773 306-1 Calle 7 Sur N 42-70 Ofc 1102 Ctc:Alejandro Galotel:+57 4 3222858"
"Orient Cargo Agency","Al Mulla Ware House B111 P O Box: 14671 Al Qusais Industrialtel: 0097142593509","","Phone Numbers: 0097142593509 --- Emails: ","United States","1","Houston, Tx","Tampico","841590","Ith Parrillas Alambre Form Alambre Hechas Acero Wire Grills Wire Forms Mad Steel","1","3237","Orient Cargo Agency","Al Mulla Ware House B111 P O Box: 14671 Al Qusais Industrialtel: 0097142593509"
"P","Po Box 23425 Al Turaia Souq Doha Salwa Road Doha Qatar C P 999999 Tax Id 97444433998 Ctcrajendranplanettecqatar Com","","Phone Numbers: 97444433998 --- Emails: ","United States","1","Houston, Tx","Tampico","845020","Spare Washing Center Dryers Electric Stove Spare","1","6296","P","Lanet Tec Po Box 23425 Al Turaia Souq Doha Salwa Road Doha Qatar C P 999999 Tax Id 97444433998 Ctcrajendranplanettecqatar Com"
"Pablo Sebastian Blanco Rivero C/O Edelweiss Spedition Srl","Panama No 1524 Martinez- Buenos Aires 1640-Argentina Cuit Number 2023376488 Ncm 630900","","Phone Numbers: 2023376488 --- Emails: ","United States","1","Houston, Tx","Veracruz","701331","Glasses Household Books Clothes Glasses Ornaments Chair Lamp Kitchen Items Furniture Pictures Mirror Sown Tare","1","4788","Edelweiss Spedition Srl","C/O Adrian Antonio Tesoriero Panama 1524-Martinerz-B1640Djr Buenos Aires Argentina"
"Petter Johnny Andrietta","Cpf 260 692 188-76 Av Brig Faria Lima 2012 - 7 - Cjto 73 - Jd Paulistano Sao Paulo Sp - Cep 01452-002 -","","Phone Numbers: 26069218876 --- Emails: ","United States","1","Houston, Tx","Veracruz","630520","Household Household Books Clothes Glasses Ornaments Chair Lamp Kitchen Items Furniture Pictures Mirror Ncm Wooden Treated Certified Conventional Heat Treatment","1","2174","Gerson And Grey Servicos Ltda","Cnpj 07 768 031 / 0001 -36 Av Brig Faria Lima 2012- 7 - Cjto 73 - Jd Paulistano Sao Paulo Sp - Cep 01452-002 - Brazil -"
"Philips Consumer Lifestyle","1600 Summer Street Ein+13342911512 Stamford Ct 06905 Us","","Phone Numbers: +13342911512 --- Emails: ","United States","1","Los Angeles, Ca","Lazaro Cardenas","732399","Tableware Kitchen Ware Tableware Kitchen Ware Articles Plastics Articles Oth Eces Shavers Electr Shave Clippers Epilato Eces","1","5104","Ups Supply Chain Solutions","6940 Engle Road Suite C Middleburg Heights Oh 44130 Cleveland Oh 44130 Us"
"Pier 17 Panama Inc","Tax Id:1284105-1-601253 D V 97 Avenida Ricardo J Alfaro Edificio Century Tower Piso 1 Nr D1 Nr 2004 Panama Republic Of //","","Phone Numbers: 1051601253 --- Emails: ","United States","1","Houston, Tx","Veracruz","851220","Pallet Pallet Automoti Lamps Automotive Terminals Lamparas Automotrices Luces Direccionales Termina Les Uso Automotriz Codes Pallet Botellas Mil Cada Una Con Tequila Agave Cajas Otellas Cada Una Herramientas Mano Urnas Biodegradables Tierra Cenizas Piezas Cardboard Dmc Rev Belt Caf Belt Belt Dmc Buckle Belt Cafe Belt Belt Normal Buck Let Negro Belt Belt Normal Buckle Cinturon Dmc Rev Belt Negro Cafe Belt Belt Dmc Rev Belt Cafe Negro Belt Polyurethane Pallet Stove Partes Estibable Pallet Mezcal Aleron Alc Vol Pallet Espuma Polietileno Con Aluminio Bonded Cargo Transit Cargo Cierres Terminados Laton Cierr Fijo Cierre Separable Cfdi Cfdi Cfd Cfdi Abrazadera Abrazadera Abrazadera Riel Logistico Oxidable Cal Asidera Aluminio Redonda Charola Abs Discos Filo Carbu Bco Zas Disco Recortadora Mdc Rue Esponja Dique Medio Hojas Azul Nictone Ique Grueso Hojas Azul Nictone Dique Mediano Hojas Negro Ictone Dique Grueso Hoj Pallet Books Polirricinoleato Poliglicerol Palsgaard Pgpr Emulsionantes Esta B","2","26858","Pier 17 Panama Inc","Tax Id:1284105-1-601253 D V 97 Avenida Ricardo J Alfaro Edificio Century Tower Piso 1 Nr D1 Nr 2004 Panama Republic Of //"
"Productos De Seguridad De Perimetro","Sa Calle 67 Este San Francisco 97 Panama Tax Id: 715801374088Dv86 Fbares@Barrera Com Pa","barrera.com","Phone Numbers:  --- Emails: 715801374088Dv86 Fbares@Barrera Com Pa","United States","1","Houston, Tx","Tampico","293299","Steel Grill Post Base Post Bayoneta Accessory Doors Clamps Staples Black Clamp Bolt Nut Tweezers Taples","2","21136","Productos De Seguridad De Perimetro","Sa Calle 67 Este San Francisco 97 Panama Tax Id: 715801374088Dv86 Fbares@Barrera Com Pa"
"Productos De Seguridad De Perimetros S A","Calle 67 Este San Francisco 97 Panama Panama Tax Id: 715801374088Dv86","","Phone Numbers: 715801374088 --- Emails: ","United States","1","Houston, Tx","Tampico","320417","Gray Medium Staple Gray Staple White Metallic Clamp Gray Metallic Clamp Metalbracket White Post Clamp Whit Green Black Gray Ornamental Grille Post Ornamental Fence Metallic Clamp Green Gray Blue Coils Barbed Wire Contemporary Grating Contemporary Door Milan Door Green Steel Grating White Green Black Self Drilling Pija Piece Hinged Gate High Security Clamp Port Fence","2","22166","Productos De Seguridad De Perimetros S A","Calle 67 Este San Francisco 97 Panama Panama Tax Id: 715801374088Dv86"
"Radiocentro Cxa Paseo De Los Periodistas","No 50 Sanchez Miraflores Santo Domingo Prov Santo Domingo Rep Dominicana 10203660549331","","Phone Numbers: 10203660549331 --- Emails: ","United States","1","Houston, Tx","Tampico","732111","Gas Stove Gas Stove","3","13944","Radiocentro Cxa Paseo De Los Periodistas","No 50 Sanchez Miraflores Santo Domingo Prov Santo Domingo Rep Dominicana 10203660549331"
"Redplan S A","Numregidtrib 212301600011 Montevideo 11000 Montevideo Montevideo Uy Ury","","Phone Numbers: 212301600011 --- Emails: ","United States","1","Houston, Tx","Tampico","841981","Kitchen Equipment Para Hosteleria","1","5454","Redplan S A","Numregidtrib 212301600011 Montevideo 11000 Montevideo Montevideo Uy Ury"
"Rodolfo Leandro Dal Ge De Goes","C/O Sit Grupo Empresarial S L Av Del Segle Xxi 78 08840 Viladecans Barcelona Spain Tel 00 34 93 630 5555","","Phone Numbers: 00349363055 --- Emails: ","United States","1","Houston, Tx","Veracruz","830130","Household Books Clothes Glasses Ornaments Chair Lamp Kitchen Items Furniture Pictures Mirror","1","1555","Sit Grupo Empresarial S L","Av Del Segle Xxi 78 08840 Viladecans Barcelona Spain Tel 00 34 93 630 5555 Fax 00 34 93 630 57200Xx"
"Rosana L L C/O Adrian A T C/O Lift Van Internation Cuit","No 20223376488 Ruta 202 N 3449 Don Torcuato- Buenos Aires B1611Abg Argentina","","Phone Numbers: 20223376488 --- Emails: ","United States","1","Houston, Tx","Veracruz","830130","Household Books Clothes Glasses Ornaments Chair Lamp Kitchen Items Furniture Pictures Mirror Sown Tare","1","1000","Lift Van International Co","Cuit 20-22337648-8 Ruta 202 N 3449 Don Torcuato Buenos Aires Argentina"
"Rossi Beguy Martin Eduardo C/O Mercovan Argentina Srl","Cuit 20-29952086-3 Juan Azurduy 1520 Piso 3 Of E C1429Adj Buenos Aires Argentina","","Phone Numbers: 2029952086 --- Emails: ","United States","1","Houston, Tx","Veracruz","980400","Household Books Household Books Clothes Glasses Ornaments Chair Lamp Kitchen Items Furniture Pictures Mirror Sown Tare","1","2418","Rossi Beguy Martin Eduardo C/O Mercovan Argentina Srl","Cuit 20-29952086-3 Juan Azurduy 1520 Piso 3 Of E C1429Adj Buenos Aires Argentina"
"Samuel Gutierrez","800 Ave Ponce De Leon San Juan Pr 00907 Tel 787-647 1892","","Phone Numbers: 7876471892 --- Emails: ","United States","1","San Juan, Puerto Rico","Veracruz","940340","Household Wooden Lift Vans Household Books Clothes Glasses Ornaments Chair Lamp Kitchen Items Furniture Pictures Mirror","1","2793","Rodi Cargo Intl Group","-Pr Julio N Matos Ind Park Calle Campeche Lote 26 Carolina Pr 00987 Puerto Rico Tel 787-647-1892"
"Sea Way Logistics Ltd","5 Jabutinsky St Beit Avgad Israel 5252006 Tax Id:513156786 Contact : Merav Ben Merav@Seaway Co Il Ph 97237565742","seaway.co.il","Phone Numbers: 97237565742 --- Emails: Ben Merav@Seaway Co Il","United States","1","Houston, Tx","Veracruz","731449","Galvanized Steel Grill","3","25620","Sea Way Logistics Ltd","5 Jabutinsky St Beit Avgad Israel 5252006 Tax Id:513156786 Contact : Merav Ben Merav@Seaway Co Il Ph 97237565742"
"Sergio Luiz Ramalho Dos Santos","27285268852 Rua Jose Rodriguez Pinhairo 3351 81170-200 Curitiba Pr-Brazil Cnpj 62 422 878/0011-44 Xxx","","Phone Numbers: 335181170200 --- Emails: ","United States","1","Houston, Tx","Veracruz","940340","Household Books Household Books Clothes Glasses Ornaments Chair Lamp Kitchen Items Furniture Pictures Mirror Sown Tare Ncm Wooden Applicable","1","1244","Metropolitan Transports S A","Cnpj 62422878/0011-44 Rua Jose Rodrigues Pinheiro 3351 81170200 Curitiba Pr-Brazil Xxxx"
