"Company Name","Top Addresses","Company Websites","Company Contact Info","Company Country","Aggregated Volume","Top Destination Ports Used","Top Departure Ports Used","Top H.S. Code","Product Description","Total TEU","Total Weight","Top Notify Parties","Top Notify Party Addresses"
"Kronen International Sa","Tax-Id 30-60451400-9 Valentin Gomez 151 Haedo Buenos Aires Haedo Buenos Aires Argentina C P 1706, Tax Id: 30-60451400-9 Valentin Gomez 151 Haedo Bueno, Cuit Nbr 30604514009 N 3 Entre 107 Y 109 San Luis C P 5700/Ar/30604514009 Contact Agustin Rosello","","Phone Numbers: 3060451400, 30604514009, 1448950236 --- Emails: ","United States","90","Houston, Tx, New Orleans, La","Tampico","732393, 732111, 902810","Kitchen Kitchen Invoices Kitchen Kitchen Invoices Kitchen Kitchen Invoices Kitchen Kitchen Invoices Kitchen Kitchen Invoices Kitchen Kitchen Invoices, Gas Stove Gas Stove, Kitchen Cont Kitchen Invoices Kitchen Cont Kitchen Invoices Kitchen Cont Kitchen Invoices Kitchen Cont Kitchen Invoices Kitchen Cont Kitchen Invoices Kitchen Cont Kitchen Invoices","521","2428171","Kronen International Sa","Tax-Id 30-60451400-9 Valentin Gomez 151 Haedo Buenos Aires Haedo Buenos Aires Argentina C P 1706, Tax Id: 30-60451400-9 Aires Haedo Buenos Aires Arge, Cuit Nbr 30604514009 N 3 Entre 107 Y 109 San Luis C P 5700/Ar/30604514009 Contact Agustin Rosello"
"Haier Appliances Caribbean Andcompa","Victoria Industrial Park Edificio 1 Carolina Puerto Rico C P 00985/Pr/ 660549331 Ctc Pedro Ramos Tel:0017876966","","Phone Numbers: 0017876966 --- Emails: ","United States","36","San Juan, Puerto Rico","Tampico, Port Bustamante","841810, 845011, 732111","Bundle Refrigerator Bottom Mount Bundles Refr Bottom Mount Bundles Dryers Bundles Electric Stove Bundles Stove Bundles Dryers Bundles Electric Stove Bundles Washing Center, Dryers Dryers Refr Bottom Mount Electric Stove Dryers Laundry Center Dryers Electric Stove Refr Bottom Mount Electric Stove Refr Side Side Dryers Dryers Dryers Gas Stove Laundry Center Laundry Center Dryers Laundry Center Laundry Center, Dryers Electric Stove Refr Side Side Refr Bottom Mount Refr Door Refr Bottom Mount","533","3156244","Perez & Cia De P R Inc, Haier Appliances Caribbean Andcompa","Tax Id 660375734 Calle Miraflores Esq Villaverde Muelle 15 Miramar Santurce P R 00908 Telephone: 787-725-9400, Victoria Industrial Park Edificio 1 Carolina Puerto Rico C P 00985/Pr/ 660549331 Ctc Pedro Ramos Tel:0017876966"
"H&K Manufacturing Unlimited","Company Panattoni Park Wroclaw North Gate Ii Ul Polnocna 1 51-180 Szymanow Poland Vat No Hkm Pl5263540015, Company Panattoni Park Wroclaw North Gate Ii Ul Polnocna 1 51- 180 Szymanow Poland Vat No Hkm Pl5263540015, Company Panattoni Park Wroclaw North Gate Ii Ul Polnocna 1 51- 180 Szymanow Poland Vat Hkm Pl5263540015","","Phone Numbers: 5263540015 --- Emails: ","United States","35","Houston, Tx","Tampico","732393, 841899, 271111","Stainless Steel Kitchen Equipment Crates Stainless Steel Kitchen Equipment, Stainless Steel Crates Stainless Steel Kitchen Equipment Refrigerating Machines Freezers Cylindre Freezers Propano Freezer Refrigerating Machines Flammable Toxic Liquefied Gas Class Ems Marine Pollutant, Stainless Steel Crates Stainless Steel Kitchen Equipment Stainless Steel Crates Stainless Steel Kitchen Equipment","67","186916","H&K Manufacturing Unlimited, Cargomind Poland Sp Z O O, Cargomind Poland Sp Zo O","Company Panattoni Park Wroclaw North Gate Ii Ul Polnocna 1 51-180 Szymanow Poland Vat No Hkm Pl5263540015, 1 Sierpnia 6 Bud D 02-134 Warszawa Poland Tax Id 5342379755 Wro-Oceancargomind Com, 1 Sierpnia 6 Bud D 02-134 Warszawa Poland Tax Id 5342379755 Wro-Oceancargomind Com Np"
"Colchoneria Y Muebleria La Nacional","Carretera De Mendoza 219 Santo Domingo C P 012345/Do/101024526 Contacto Xiony Cuevas Tel 809 594 82 88, Carr De Mendoza 219 Santo Domingo Cp 012345/Do/101024526 Ctc Xiony Cuevas Tlf 8095948288, Carretera De Mendoza Villa Faro 219Santo Domingo C P 012345/Do/101024526 Ctc Xiony Cuevas Tel 8095948288","","Phone Numbers: 8095948288 --- Emails: ","United States","34","Houston, Tx","Tampico","902810, 732111, 732190","Gas Stove Estufa Gas, Gas Stove Estufas Gas Gas Stove, Gas Stove","232","641942","World Trade Logistics Srl, Colchoneria Y Muebleria La Nacional","Rnc No 1-30-50997-2 Av Lope De Vega No 13 Progreso Business Center Suite 110 Ens Naco Santo, Carr De Mendoza 219 Santo Domingo Cp 012345/Do/101024526 Ctc Xiony Cuevas Tlf 8095948288, Rnc No 1-30-50997-2 Av Lope De Vega No 13 Progreso Business Center Suite 110 Ens Naco Santo Domingo D N"
"Haier Appliances Caribbean And Company","Victoria Industrial Park Edificio 1 Carolina Puerto Rico C P 00985/Pr/ 660549331 Ctc Pedro Ramos Tel:0017876966, Victoria Industrial Park Edificio 1 Carolina Puerto Rico C P 00985/Pr/ 660549331 Ctc Pedro Ramos Tel:0017876966//","","Phone Numbers: 0017876966 --- Emails: ","United States","24","San Juan, Puerto Rico","Tampico","845011, 841810, 732111","Dryers Electric Stove Gas Stove Refrigerators Doors Laundry Center Dryers Gas Stove Dryers Refrigerator Doors, Electric Stove Gas Stove Dryers Refrigerator Bottom Mount Refrigerator Side Side Gas Stove, Electric Stove Gas Stove Dryers Refrigerator Side Side","475","2861706","Perez & Cia De P R Inc","Tax Id 660375734 Calle Miraflores Esq Villaverde Muelle 15 Miramar Santurce P R 00908 Telephone: 787-725-9400"
"Radio Centro C Por A","Avenida Paseo De Los Periodistas 50Santo Domingo C P 012345/Do/101011041 Ctc Nelson Adames Tel 809-685-7131, Av Paseo De Los Periodistas 50 Santo Domingo Cp 012345/Do/101011041 Ctc Nelson Adames Tlf 809-685-7131, Avenida Paseo De Los Periodistas 50 Miraflores Santo Domingo C P 012345/Do/101011041 Ctc Nelson Adames Tel 809-685-7131 12345","","Phone Numbers: 8096857131, 18096857131, 80968571311234 --- Emails: ","United States","19","Houston, Tx","Tampico","902810, 732111, 732392","Gas Stove, Gas Stove Gas Stove Gas Stove Gas Stove, Gas Stove Estufa Gas Gas Stoves Refrigerators Estufa Gas Gas Stoves Refrigerators Refr Ptas Gas Stoves Refrigerators","261","740265","Radio Centro C Por A","Avenida Paseo De Los Periodistas 50Santo Domingo C P 012345/Do/101011041 Ctc Nelson Adames Tel 809-685-7131, Av Paseo De Los Periodistas 50 Santo Domingo Cp 012345/Do/101011041 Ctc Nelson Adames Tlf 809-685-7131, Avenida Paseo De Los Periodistas 50 Miraflores Santo Domingo C P 012345/Do/101011041 Ctc Nelson Adames Tel 809-685-7131 12345"
"Courts Antigua & Barbuda Ltd","/ Lower Market St Corner Of St Johns / Atn Anik Knowles / Ph 268 462 5694 / Tax Id 169724, / Lower Market Street Corner Of St Johns Antigua / Atn Anik Knowles / Ph 268 462 5694","","Phone Numbers: 2684625694 --- Emails: ","United States","17","Houston, Tx","Tampico","732111, 841810, 845020","Stoves Stoves Custom Cargo Transit Outside Country Gateway Kestrel Liner Agencies Llc Tropical Shipping All Charges Should Payed Kestrel, Combined Refrigerators Freezers Refrigerators Stoves Washers Custom Cargo Transit Outside Country Gateway Kestrel Liner Agencies Llc Tropical Shipping All Charges Should Payed Kestrel, Refrigerators Freezers Refrigerators Stoves Washers Custom Cargo Transit Outside Country Gateway Kestrel Liner Agencies Llc Tropical Shipping All Charges Should Payed Kestrel","19","76593","Courts Antigua & Barbuda Ltd, Kestrel Liner Agencies Llp Tax Id","/ Lower Market St Corner Of St Johns / Atn Anik Knowles / Ph 268 462 5694 / Tax Id 169724, 710885661 9505 Nw 108Th Avenue Medley Florida 33178 / Atn Gary Aspinall Ph 786 220 1650, / Lower Market Street Corner Of St Johns Antigua / Atn Anik Knowles / Ph 268 462 5694"
"Unicomer St Lucia / Orange Park","Commercial Centre Bois Dorange Marisule St Lucia / Atn Berthia Augustin / Ph 758 457 8117 / Tax Id 1790302","","Phone Numbers: 7584578117 --- Emails: ","United States","17","Houston, Tx","Tampico","732111, 845020","Stoves Stoves Custom Cargo Transit Outside Country Gateway Kestrel Liner Agencies Llc Tropical Shipping All Charges Should Payed Ppd Kestrel Liner Agencies, Stoves Stoves Spare Custom Cargo Transit Outside Country Gateway Kestrel Liner Agencies Llc Tropical Shipping All Charges Should Payed Ppd Kestrel Liner Agencies, Refrigerators Washers Refrigerators Stoves Custom Cargo Transit Outside Country Gateway Kestrel Liner Agencies Llc Tropical Shipping All Charges Should Payed Ppd Kestrel Liner Agencies","17","74782","Unicomer St Lucia / Orange Park, Kestrel Liner Agencies Llp Tax Id, Kestrel Liner Agenices Llc","Commercial Centre Bois Dorange Marisule St Lucia / Atn Berthia Augustin / Ph 758 457 8117 / Tax Id 1790302, 710885661 / 9505 Nw 108 Th Avenue Medley Florida 33178 Atn Gary Aspinall Ph 786 220 1650 / Fx 786 220 1691, 16320 Nw 59 Avenue"
"Unicomer Grenada Ltd","/ Young Street St George Grenada / Atn Prisca Nelson Gabriel / Ph 473 4357305 / Tax Id 0007516, / Young Street St Georges Grenada / Atn Prisca Gabriel / Ph 473 435 7305, Young Street St George Grenada Atn Prisca Nelson Gabriel Ph 473 4357305 Tax Id 0007516","","Phone Numbers: 4734357305 --- Emails: ","United States","16","Houston, Tx","Tampico","732111, 845020","Stoves Stoves Custom Cargo Transit Outside Country Gateway Kestrel Liner Agencies Llc Tropical Shipping All Charges Should Payed Ppd Kestrel, Spare Stoves Spare Custom Cargo Transit Outside Country Gateway Kestrel Liner Agencies Llc Tropical Shipping All Charges Should Payed Ppd Kestrel, Refrigerators Stoves Refrigerators Custom Cargo Transit Outside Country Gateway Kestrel Liner Agencies Llc Tropical Shipping All Charges Should Payed Ppd Kestrel","20","76806","Unicomer Grenada Ltd, Kestrel Liner Agencies Llp Tax Id","/ Young Street St George Grenada / Atn Prisca Nelson Gabriel / Ph 473 4357305 / Tax Id 0007516, 710885661 9505 Nw 108Th Avenue Medley Florida 33178 / Atn Gary Aspinall / Ph 786 220 1650"
"Unicomer St Kitts & Nevis Ltd","/ Bay Road Po Box 108 Basseterre St Kitts / Atn Perla Tayson / Ph 869 466 1640 / Tax Id 809136, Bay Road Po Box 108 Basseterre St Kitts Atn Perla Tayson Ph 869 466 1640 Tax Id 809136","","Phone Numbers: 8694661640 --- Emails: ","United States","14","Houston, Tx","Tampico","732111, 845020, 841810","Refrigerators Stoves Refrigerators Custom Cargo Transit Outside Country Gateway Kestrel Liner Agencies Llc Tropical Shipping All Charges Should Paid Miami Kestrel Liner Agencies, Stoves Stoves Custom Cargo Transit Outside Country Gateway Kestrel Liner Agencies Llc Tropical Shipping All Charges Should Paid Miami Kestrel Liner Agencies, Refrigerators Stoves Refrigerators Doors Custom Cargo Transit Outside Country Gateway Kestrel Liner Agencies Llc Tropical Shipping All Charges Should Paid Miami Kestrel Liner Agencies","16","65263","Unicomer St Kitts & Nevis Ltd, Kestrel Liner Agencies Llp Tax Id","/ Bay Road Po Box 108 Basseterre St Kitts / Atn Perla Tayson / Ph 869 466 1640 / Tax Id 809136, 710885661 9505 Nw 108Th Avenue Medley Florida 33178 /Atn Gary Aspinall Ph 786 220 1650, Bay Road Po Box 108 Basseterre St Kitts Atn Perla Tayson Ph 869 466 1640 Tax Id 809136"
"Plaza Lama S A","Avenida 27 De Febrero Santo Domingoc P 012345/Do/101171111 Contacto Luchy Lara Tel 809-985-2073, Avenida 27 De Febrero Santo Domingoc P 012345/Do/101171111 Ctc Luchy Lara Tel 809-985-2073, Avenida 27 De Febrero Santo Domingoc P 012345/Do/101171111 Contact Luchy Lara Telephone 809 985-2073","","Phone Numbers: 8099852073, 18099852073 --- Emails: ","United States","13","Houston, Tx","Tampico","902810","Gas Stove","47","142064","Plaza Lama S A","Avenida 27 De Febrero Santo Domingoc P 012345/Do/101171111 Contacto Luchy Lara Tel 809-985-2073, Avenida 27 De Febrero Santo Domingoc P 012345/Do/101171111 Ctc Luchy Lara Tel 809-985-2073, Avenida 27 De Febrero Santo Domingoc P 012345/Do/101171111 Contact Luchy Lara Telephone 809 985-2073"
"Unicomer St Vincent Ltd","/ Bay Street Po Box 25 Kingstown St Vincent Cp Vc9999 / Atn Lisa Veira / Ph 784 456 1325 / Tax Id 028225, / Bay Street Po Box 25 Kingstown St Vincent Cp Vc9999 / Atn Lisa 50 Veira / Ph 784 456 1325 / Tax Id, Bay Street Po Box 25 Kingstown St Vincent Cp Vc9999 Atn Lisa Veira Ph 784 456 1325 Tax Id 028225","","Phone Numbers: 7844561325 --- Emails: ","United States","13","Houston, Tx","Tampico","732111, 845020, 841810","Stoves Stoves Custom Cargo Transit Outside Country Gateway Kestrel Liner Agencies Llc Tropical Shipping All Charges Should Payed Kestrel Liner Agencies, Spare Stoves Spare Custom Cargo Transit Outside Country Gateway Kestrel Liner Agencies Llc Tropical Shipping All Charges Should Payed Kestrel Liner Agencies, Refrigerators Refrigerators Washers Stoves Spare Custom Cargo Transit Outside Country Gateway Kestrel Liner Agencies Llc Tropical Shipping All Charges Should Payed Kestrel Liner Agencies","13","56256","Unicomer St Vincent Ltd, Kestrel Liner Agencies Llp Tax Id, Kestrel Liner Agencies Llc","/ Bay Street Po Box 25 Kingstown St Vincent Cp Vc9999 / Atn Lisa Veira / Ph 784 456 1325 / Tax Id 028225, 710885661 9505 Nw 108Th Avenue Medley Florida 33178 Atn Gary Aspinall, 9505 Nw 108Th Avenue Medley"
"Abdul Mohsen A Al Swailem Establis","Riyadh 11421 Kingdom Of Saudi Arabia Zc 544 Mr Saad Al-Swailem Saadalswailem Com 966114658100","","Phone Numbers: 966114658100 --- Emails: ","United States","11","Houston, Tx","Tampico","851690, 731822, 732392","Electric Stove, Electric Stove Dryers, Electric Stove Washers","23","118703","Abdul Mohsen A Al Swailem Establis","Riyadh 11421 Kingdom Of Saudi Arabia Zc 544 Mr Saad Al-Swailem Saadalswailem Com 966114658100"
"Unicomer Dominica Ltd","/ Old Street 29 Roseau Dominica / Atn Rachel Samuel / Ph 767 255 2421","","Phone Numbers: 7672552421 --- Emails: ","United States","11","Houston, Tx","Tampico","732111, 845020, 841810","Stoves Stoves Custom Cargo Transit Outside Country Gateway Kestrer Liner Agencies Llc Tropical Shipping All Charges Should Paid Miami Kestrel Liner Agencies, Refrigerators Refrigerators Stoves Washers Custom Cargo Transit Outside Country Gateway Kestrer Liner Agencies Llc Tropical Shipping All Charges Should Paid Miami Kestrel Liner Agencies, Refrigerators Washers Stoves Refrigerators Doors Custom Cargo Transit Outside Country Gateway Kestrer Liner Agencies Llc Tropical Shipping All Charges Should Paid Miami Kestrel Liner Agencies","13","50764","Kestrel Liner Agencies Llp / Tax Id, Unicomer Dominica Ltd","710885661 / 9505 Nw 108Th Avenue Medley Florida 33178 / Atn Gary Aspinall / Ph 786 220 1650 / Fax 786 220 1691, / Old Street 29 Roseau Dominica / Atn Rachel Samuel / Ph 767 255 2421, 710885661 / 9505 Nw 108Th Avenue Medley Florida 33178 / Atn Gary Aspinall / Ph 786 220 1650 / Fax 786 220 1691 Tax Id 710885661"
"Kestrel Liner Agencies Ltd C/O","Calvin Alkins Custom Services Ltd Tax Id 20219183 Gladstonia Buildingfontabelle St Michael Barbados Wi At N:Calvin Alkins / Ph:2464352626","","Phone Numbers: 2464352626 --- Emails: ","United States","10","San Juan, Puerto Rico","Port Bustamante","841829, 851660, 480269","Stoves Custom, Refrigerators Stoves Custom, Stoves Custom Stoves Pckages Refrigerators Custom","15","109144","Kestrel Liner Agencies Llp Tax Id, Kestrel Liner Agencies Llp, Kestrel Liner Agencies Llp / Tax Id","710885661 16320 Nw 59 Avenue Miami Lakes Florida 33014 At N: Gary Aspinall/, 829464 16320 Nw 59Th Avenue Miami Lakes Florida 33014 United States, 710885661 16320 Nw 59 Avenue Miami Lakes Florida 33014 At Gary Aspinall Ph: 786 220 1650/Fx: 786220 1691"
"Unicomer St Lucia /","Orange Park Commercial Marisule St Lucia / Atn Berthia Augustin / Ph 758 457 8117","","Phone Numbers: 7584578117 --- Emails: ","United States","10","Houston, Tx","Tampico","732111","Stoves Stoves Custom Cargo Transit Outside Country Gateway Kestrel Liner Agencies Llc Tropical Shipping All Charges Should Payed Ppd Kestrel Liner Agencies, Stoves Custom Cargo Transit Outside Country Gateway Kestrel Liner Agencies Llc Tropical Shipping All Charges Should Payed Ppd Kestrel Liner Agencies, Stoves Stoves Pacakges Washer Center Spare Custom Cargo Transit Outside Country Gateway Kestrel Liner Agencies Llc Tropical Shipping All Charges Should Payed Ppd Kestrel Liner Agencies","10","47494","Kestrel Liner Agencies Llp Tax Id, Unicomer St Lucia /","710885661 / 9505 Nw 108 Th Avenue Medley Florida 33178 Atn Gary Aspinall Ph 786 220 1650 / Fx 786 220 1691, Orange Park Commercial Marisule St Lucia / Atn Berthia Augustin / Ph 758 457 8117"
"Distribuidora Corripio S A","S Avenida Nu Ez De Caceres Santo Domingo C P 12345/Do/101003693 Ctc Rocio Tactuk Tel 809-227-3000, S Av Nu Ez De Caceres Santo Domingo C P 12345/Do/101003693 Contacto Rocio Tactuk Tlf 809-227-3000, S Avenida Nu Ez De Caceres Santo Domingo C P 12345/Do/101003693 Contacto Rocio Tactuk Tel 809-227-3000","","Phone Numbers: 8092273000 --- Emails: ","United States","6","Houston, Tx","Tampico","902810, 845710","Gas Stove, Gas Stove Laundry Centers, Laundry Centers Gas Stove Refrigerators","18","67722","Distribuidora Corripio S A","S Avenida Nu Ez De Caceres Santo Domingo C P 12345/Do/101003693 Ctc Rocio Tactuk Tel 809-227-3000, S Av Nu Ez De Caceres Santo Domingo C P 12345/Do/101003693 Contacto Rocio Tactuk Tlf 809-227-3000, S Avenida Nu Ez De Caceres Santo Domingo C P 12345/Do/101003693 Contacto Rocio Tactuk Tel 809-227-3000"
"H & K Restaurant Systems Australia","21 Mckay Close Wetherill Park Nsw 2164 Au Te +61280316828 Simon Costigan","","Phone Numbers: +61280316828 --- Emails: ","United States","6","Long Beach, Ca","Manzanillo","732393, 841850, 732111","Accesories Stainless Steel Kitchen Accesories, Kitchen Equipment, Kitchen Equipment Equipo Cocina Kitchen Equipment","14","38350","H & K Restaurant Systems Australia, Tel 61, Tcf International Unit","2 9668 0000 Email: Melissatcfinternational Com Au, 21 Mckay Close Wetherill Park Nsw 2164 Au Te +61280316828 Simon Costigan, 5 18-28 Sir Joseph Banks Drive Kurnell 2231 Nsw P O Box 147 Sydney Tax Id 43 071 011 320 Contact Melissa Page"
"European Logistics Support Office","Da-E Elso C/O Govlog N V Belcrownlaan 23 B-2100 Deurne Be Belgium Attn Kristel De Maeyer Tel +32 3 360 79 78 Tax Id, Da-E Elso C/O Govlog N V Belcrownlaan 23 B-2100 Deurne Be Belgium Attn Kristel De Maeyer Tel +32 3 360 79 78","","Phone Numbers: +3233607978 --- Emails: ","United States","4","Houston, Tx","Tampico","851660","Electric Stove Estufa Electrica Electric Stove, Electric Stove Estufa Electrica Electric Stove Shippers Stow Express Release Originals, Estufa Electrica Electric Stove Electric Stove Estufa Electrica Electric Stove Express Release Originals","24","113675","European Logistics Support Office","Da-E Elso C/O Govlog N V Belcrownlaan 23 B-2100 Deurne Be Belgium Attn Kristel De Maeyer Tel +32 3 360 79 78 Tax Id, Da-E Elso C/O Govlog N V Belcrownlaan 23 B-2100 Deurne Be Belgium Attn Kristel De Maeye Tel + 32 3 540 20 27"
"The North West Company Lp By General Partner Nwc Gp Inc","77 Main St Wpg Mb R3C 2R1 G S T 808425870Rt0001 - Canada Phone 204-9341781","","Phone Numbers: 2049341781 --- Emails: ","United States","4","Long Beach, Ca, Los Angeles, Ca","Cartagena","630292, 690990, 830130","Comforter Trays Kitchen Articles Clocks Pots Carpets Organizer Towels Baskets, Home Furniture Ornament Clock Kitchen Utensils Gloves Kitchen Towels Carpet Curtain Comforter, Home Items Kitchen Items Curtain","4","37115","Livingston International Cst53434Livingstonintl Com","11-1100 Waverly Street Winnipeg Manitoba R3T 3X9"
"Fca Italy S P A","13960 Via Pinerolo 21 Italy To 10060 Italy Tax Id 07973780013","","Phone Numbers: 07973780013 --- Emails: ","United States","3","Houston, Tx","Veracruz","870810","Automotive Automotive Frt Fascia Pedpro Brkt Upper Fiat Grille Assy Charges Account Chrysl Automotive Automotive Frt Fascia Pedpro Brkt Charges Account Chrysl Automotive Automotive Fasc Fiat Dodge Rpa Frt Lwr Fasc Fiat Dodge Ser Charges Account Chrysl Automotive Automotive Frt Fascia Pedpro Brkt Fasc Fiat Dodge Rpa Frt Lwr Fasc Fiat Dodge Charges Account Chrysl Automotive Automotive Frt Lwr Fasc Fiat Dodge Ser Frt Fascia Pedpro Brkt Charges Account Chrysl Automotive Automotive Frt Fascia Pedpro Brkt Charges Account Chrysl, Automotive Fasc Fiat Dodge Rpa Frt Lwr Fasc Fiat Dodge Ser Upper Fiat Grille Assy Automotive Automotive Frt Lwr Fasc Fiat Dodge Ser Upper Fiat Grille Assy Automotive, Automotive Fasc Fiat Dodge Rpa Upper Fiat Grille Assy Frt Fascia Pedpro Automotive","13","6070","Fca Italy S P A","13960 Via Pinerolo 21 Italy To 10060 Italy Tax Id 07973780013"
"Fps Famous Pacific Shipping B V","Van Riemsdijkweg 78 3088 Hd Rotterdam The Netherlands Tel: +31 10 2831 919 /935 Atn : Marco Van Den Nouwland, Van Riemsdijkweg 78 3088 Hd Rotterdam The Netherlands Tel: 31102831919/935 At N: Marco Van Den Nouwland, Van Riemsdijkweg 78 3088 Hd Rotterdthe Netherlands Tel:  10 2831 91Tax Id: Nl809653035000","","Phone Numbers: +31102831919, 31102831919, 809653035000 --- Emails: ","United States","3","Houston, Tx, New Orleans, La","Veracruz","321410, 701990, 851690","General Cargo Roll Paper Vitrica Conteniendo Manga Trezada Fibra Vidrio Recubierta Resinas Braided Fiberglass Sleeve Coated Resins Mexi Aloe Laboratorios Packaes Plastic Drums Diameters Height Each Product Aloe Vera Gel Batch Plastic Frum Diameter Height Each Product Aloe Vera Gel Batch Mexi Aloe Laboratorios Packwages Plastics Drums Each Product Aloe Vera Liposoluble Lot Trade Wood Gears Sicorsa Industrial Ibc Plastic Textile Preparation Brb Sqo Cordaflex High Density Polyethylene Ethylene Copolymer Vinyl Acetate Christina Primke Pairs Mexican Handcraft Shoes Wiegand Assembly Equipment Tools Herramientas Equipo Montaje Carnet Ata Carnet Ata Carnet Ata Lauro Antonio Tonacatl Ojeda Lift Van Triplay Que Contienen Household Bed Toys Kitchen Items Pictures Chair Etc, Magna Powertrain Pallet Stc Sellador Silicos Silico Sealing Julio Ant Onio Serna Molina Pallet Household Rsonal Effects Shoes Clothes Books Kitchen Items Etc Bienes Efectos Personales Usados Zapatos Ropa Libros Articulos Cocina Etc Erreka Mex Pallet Stc Piezas Codos Cesorios Tuberia Plastic Elbow Par Plasti Pipe Accessories Angel Gerardo Segura Carmona Stc Cajas Con Cuadernos Notebo Oks Mezcal Amo Stc Mezcal Verde Momento Espadin Joven Alco Hol Green Mezcal Young Spadi Moment Alcohol, Plastic Vinyl Articles Eika Mexico Piezas Parrillas Electricas Electric Grills Angelus Pallet Machinery Maquilados Elastomeros Bloques Poli Metacrilato Metilo Mezcal Convite Pallet Botellas Mezcal Diasorin Liaison Analyzer","3","34938","Fps Famous Pacific Shipping B V","Van Riemsdijkweg 78 3088 Hd Rotterdam The Netherlands Tel: +31 10 2831 919 /935 Atn : Marco Van Den Nouwland, Van Riemsdijkweg 78 3088 Hd Rotterdam The Netherlands Tel: 31102831919/935 At N: Marco Van Den Nouwland, Van Riemsdijkweg 78 3088 Hd Rotterdthe Netherlands Tel:  10 2831 91Tax Id: Nl809653035000"
"Music Man / Front","Street 20 Phillipsburg St Maarten / Atn Jalkishin Pursnani / Ph 1 721 542 4413 / Tax Id 811692501","","Phone Numbers: 17215424413 --- Emails: ","United States","3","Houston, Tx","Tampico","732111","Stoves Stoves Custom Cargo Transit Outside Country Gateway Kestrel Liner Agencies Llc Tropical Shipping All Charges Should Payed Ppd Kestrel","3","15300","Music Man / Front, Kestrel Liner Agencies Llp Tax Id","Street 20 Phillipsburg St Maarten / Atn Jalkishin Pursnani / Ph 1 721 542 4413 / Tax Id 811692501, 710885661 9505 Nw 108Th Avenue Medley Florida 33178 / Atn Gary Aspinall / Ph 786 220 1650"
"New Fashion World Corportation","Po Box 51494 Toa Baja Pr 00950 Tax Id 66-0781066 San Juan Puerto Rico Phone 787-795-4900","","Phone Numbers: 7877954900 --- Emails: ","United States","3","San Juan, Puerto Rico","Puerto Manzanillo","630210, 691200, 950510","Alfombras Ropa Mesa Xmas Ornaments Ceramic Kitchen Ware Cotton Table Clothing Drinking Glass Hereby Certifying That There Solid Wood Shipmentcountry China Indica, Plastic Flowers Metal Bathroom Accessories Metal Kitchen Utensils Plastic Bathroom Accesories Plastic Kitchen Accessories Plastic Kitchen Hooks Hammock Xmas Ornaments Ceramic Bathroom, Ropa Cama Mantas Fundas Polyester Kitchen Accesories Polyester Bed Sheets Toys Usa Toys China Country China Usa Hereby Certifyng That There Solid Wood","4","40897","New Fashion World Corportation, New Fashion World Corp","Po Box 51494 Toa Baja Pr 00950 Tax Id 66-0781066 San Juan Puerto Rico Phone 787-795-4900, Po Box 21494 Toa Baja Pr 00950 San Juan Puerto Rico Phone; 787-795-4900"
"Skybridge Freight Solutions Llc","Jebel Ali South Free Zone Sheikh Zayed Rd 8 5 Interchange Dubai Uae Trn 100268153200003, Jebel Ali South Free Zone Po Box 121673 Dubai United Arab Emirates Alyssasfs Ae Ph +971 528720149","","Phone Numbers: 100268153200003, +971528720149 --- Emails: ","United States","3","Houston, Tx","Tampico","732393","Stainless Steel Crates Stainless Steel Kitchen Equipmentstainless Steel Crates Stainless Steel Kitchen Equipmentstainless Steel Crates Stainless Steel Kitchen Equipment, Stainless Steel Kitchen Equipment Crates Stainless Steel Kitchen Equipment, Stainless Steel Kitchen Equipment Crates Stainless Steel Kitchen Equipment Stainless Steel Kitchen Equipment Crates Stainless Steel Kitchen Equipment","7","27148","Skybridge Freight Solutions Llc","Jebel Ali South Free Zone Sheikh Zayed Rd 8 5 Interchange Dubai Uae Trn 100268153200003, Jebel Ali South Free Zone Po Box 121673 Dubai United Arab Emirates Alyssasfs Ae Ph +971 528720149"
