"Geodis Gerenciamento De Fretes Do Brasil Ltda","Avenida Francisco Matarazzo 1350 - Sp - Barra Funda Brazil 52 147 923/0001-74 Amanda Barbosa 1150 26 3212, Francisco Matarazzo 1350 Agua Branca 05001100 Sao Paulo Brasil 52147923000174 Barbara Baldovinotti","","Phone Numbers: 1150263212, 52147923000174 --- Emails: ","United States","2","Houston, Tx","Veracruz","841391, 940360","Laser Measure Lufkin Wooden Processed Wood Ncm, Tube Tube Wood Declaration Treated Certified Ncm Ncm","2","852","Brasil Ltda, Geodis Gerenciamento De Fretes Do Brasil Ltda","Avenida Francisco Matarazzo 1350 - Sp - Barra Funda Brazil 52 147 923/0001-74 Amanda Barbosa 1150 26 3212 Amanda Barbosageodis Com, Francisco Matarazzo 1350 Agua Branca 05001100 Sao Paulo Brasil 52147923000174 Barbara Baldovinotti"
"Handel Import Ltda","Rua Gil Stein Ferreira Nro 100-Sala1101 88301-210 - Centro Itajai Sc - Brasil Cnpj 12 365 241/0001-13","","Phone Numbers: 110188301210 --- Emails: ","United States","2","Houston, Tx","Veracruz","390210","Oriented Polypropylene Film Con Rollos Pelicula Biax Orientada Polipropileno Tipo Elr Rollos Calidad Oriented Polypropylene Film Type Elr Rolls Quality Wooden Processed Wood Ncm Oriented Polypropylene Film Con Rollos Pelicula Biax Orientada Polipropileno Tipo Elr Rollos Calidad Oriented Polypropylene Film Type Elr Rolls Quality Wooden Processed Wood Ncm, Polypropylene Oriented Polypropylene Film Type Elr Rolls Quality Wooden Processed Wood","6","61431","Handel Import Ltda","Rua Gil Stein Ferreira Nro 100-Sala1101 88301-210 - Centro Itajai Sc - Brasil Cnpj 12 365 241/0001-13"
"Ineos Styrolution Do Brasil Polimer","Cnpj 12487655000387 Av Itaipava Sala 05 850 Itaipava Cp 88316-300 Itajai Brazil Santa Catarina, Ltda Cnpj 12487655000204 Av Papa Joao Xxiii 2479 Suppl Amz 2Bl A Loteamento Industrial Coral","","Phone Numbers: 12487655000204, 12487655000387 --- Emails: ","United States","2","Houston, Tx","Tampico","390330, 390390","Chemical Product Big Each Luran Ncm Country Mexico Procedence Country Mexico Acquisition Country Mexico Wooden Treated Certified Inoffensive Chemical Product Wood Cargo Securing Handling Treated According Ispm Standard, Inoffensive Chemical Product Sacks Each Terluran Ncm Inoffensive Chemical Product Country Mexico Procedence Country Mexico Acquisition Country Mexico Wooden Treated Certified Wood Cargo Securing Handling Treated According Ispm Standard","4","44936","Comissaria Pibernat Ltda, Pbl Assessoria De Comerico Exterior Ltda","Cnpj 57108730000209 Rua Alexandre Herculano 197 Cj 19011902 1903 E 1904 Gonzaga C P 11050, Cnpj 92 102 433/0009-23 Rua Manoel Vieira Garcao No 120 88301-425 Itajai Brazil"
"Logwin Air Ocean Brazil Logistica E","Despachos 55 11 5098-0632 Ltda Cnpj 45 541 539/0001-96 Rua Vieira De Moraes 670 Br 04617-0001 Sao Paulo-Sp-Brazil, Despachos Ltda Rua Vieira De Moraes670 Br 04617-0001 Sao Paulo-Sp-Brazil Cnpj 45 541 539/0001-96 55 11 5098-0632","","Phone Numbers: 00019655115098, 551150980632 --- Emails: ","United States","2","Houston, Tx","Veracruz","848310, 870850","Drive Kit Pallet Drive Kit Wood Declaration Treated Certified Ncm, Drive Knit Wood Declaration Treated Certified Ncm","2","1577","Logwin Air Ocean Brazil Logistica E Despachos 55 11 5098 0632 Ltda, Logwin Air Ocean Brazil Logistica E Despachos Ltda","Cnpj 45 541 539/0001-96 Rua Vieira De Moraes 670 Br 04617-0001 Sao Paulo-Sp-Brazil, Rua Vieira De Moraes670 Br 04617-0001 Sao Paulo-Sp-Brazil Cnpj 45 541 539/0001-96 55 11 5098-0632"
"Magnum Companhia De Pneus Sa","Rod Antonio Heil 1001 - Km 01 Galpao 07 Modulo A Itaipava Itajai Cp 88316001 Tax-Id 10783660000654 Ctc Rogrio, Tax-Id 10783660000654 Rod Antonio Heil 1001 - Km 01 Galpao 07 Modulo A Itaipava Itajai Cp 88316001 Ctc Rog Rio","","Phone Numbers: 10783660000654 --- Emails: ","United States","2","Houston, Tx","Veracruz","401120","Tires Bulk Tires Wood, Tires Tires Import License Required Wood Apply Tires Tires Import License Required Wood Apply Tires Tires Import License Required Wood Apply","7","62059","Magnum Companhia De Pneus Sa","Rod Antonio Heil 1001 - Km 01 Galpao 07 Modulo A Itaipava Itajai Cp 88316001 Tax-Id 10783660000654 Ctc Rogrio, Tax-Id 10783660000654 Rod Antonio Heil 1001 - Km 01 Galpao 07 Modulo A Itaipava Itajai Cp 88316001 Ctc Rog Rio"
"New Fashion World Corp","Po Box 51494 Toa Baja Pr 00950 San Juan Puerto Rico Phone 787-795-4900, Po Box 51494 Toa Baja Pr00950 San Juan Puerto Rico Phone 787-795-4099","","Phone Numbers: 7877954099, 7877954900 --- Emails: ","United States","2","San Juan, Puerto Rico","Puerto Manzanillo","950510","Xmas Ornaments Hereby Certifying That There Solid Wood Country China, Xmas Ornaments Polyester Cushion Hereby Certifying That There Solid Wood Country China","2","26468","New Fashion World Corp","Po Box 51494 Toa Baja Pr 00950 San Juan Puerto Rico Phone 787-795-4900, Po Box 51494 Toa Baja Pr00950 San Juan Puerto Rico Phone 787-795-4099"
"Nike India Private Limited","Iec: 0704011573 Ground Floor & First Floor Olympia Building No 66/1 Bagmane Tech Park C V, Iec:0704011573 Ground Floor & Firstfloor Olympia Building No 66/1 Bagmane Tech Park C V Raman Nagar","","Phone Numbers: 0704011573 --- Emails: ","United States","2","Houston, Tx, Mobile, Al","Veracruz","610910","Apparel Line All Ollect Wood Terial Mrsu Summary Mrsu Summar, Apparel Line All Wood Conta Iner Sudu Cont Ainer Summary Sudu Mlmx Summary","2","1006","Dhl Logistics Pvt Ltd","On Behalf Of Nike India Pvt Ltd Temple Steps 1St Floor Block 2 & 3 184-187 Anna Salai Little"
"Overseas Negocios Internacionais Rua Jacob Sens","No 292 Zc 88113 -285 Sao Jose Sc Brazil Ph Y Fax: 0483279 9800, No 292 Zc 88113 -285 Sao Jose Sc Brazil Ph Y Fax:0483279 9800","","Phone Numbers: 04832799800 --- Emails: ","United States","2","San Juan, Puerto Rico","Port Bustamante","730210","Sacks Each Terluran Ncm Country Mexico Procedence Country Mexico Acquisition Country Mexico Wooden Treated Certified Inoffensive Chemical Product Sacks Each Terluran Ncm Country Mexico Procedence Country Mexico Acquisition Country Mexico Wooden Treated Certified Inoffensive Chemical Product Wood Cargo Securing Handling Treated According Ispm Standard Original Destination Maritime Ineos Styrolution Mexicana, Sacks Each Terluran Ncm Country Mexico Procedence Country Mexico Acquisition Country Mexico Wooden Treated Certified Inoffensive Chemical Product Wood Cargo Securing Handling Treated According Ispm Standard Original Destination Maritime Ineos Styrolution Mexicana","6","87920","Mondiana Ind De Plasticos Ltda","Rod Sc 407 Km 1 2800 Alto Biguacu Zc 88164-183 Sc Brazil Ph: 554832799800, Rod Sc 407 Km 1 2800 Alto Biguacu Zc 88164183 Sc Brazil Ph 55483279 9800 Email Rafael Mondiana Com Br"
"Pantos Do Brasil Logistica Ltda","1119 Av Marcos Penteado De Ulhoa Roed Office Tambore 22 Andar Cj 2205 06460-040 Barueri Cnpj 08 889 896/0","","Phone Numbers: 220506460040 --- Emails: ","United States","2","Houston, Tx","Tampico","830241","Plate Reg Carrier Ate Reg Carrier Rail Wdw Reg Rail Wdw Reg Plate Reg Pwr Base Plate Reg Pwr Base Drum Wdw Pwr Shoe Carrier Guide Wdw Pwr Plate Assy Reg Pwr Base Plate Reg Pwr Base Wood Applicable, Plate Reg Carrier Wdw Reg Rail Wdw Reg Plate Reg Pwr Base Plate Reg Pwr Base Drum Pwr Drum Wdw Pwr Pulley Wdw Reg Plate Assy Reg Pwr Base Plate Ssy Reg Pwr Base Pla Reg Carrier Ncm Woode Applicable","2","16828","Pantos Do Brasil Logistica Ltda","1119 Av Marcos Penteado De Ulhoa Roed Office Tambore 22 Andar Cj 2205 06460-040 Barueri Cnpj 08 889 896/0"
"Pedro Maccio Y Cia Sa","Manuel Melendez 4454 Montevideo Uruguay Ruc 210213820013","","Phone Numbers: 210213820013 --- Emails: ","United States","2","Houston, Tx","Tampico","292429, 380893","Cerillo Herbicide Corrosive Liquid Paraquat Dichloride Diuron Dimethyl Bipyrid Inium Dichloride Chlorophenyl Dimethylurea Class Iii Rine Pollutant Ems Segregation Group Wooden Fibreboard Plastic Bottles Into Each Fibreboard Oxes Plastic Bottl Mtq Wood Treated Cer Tified Fumigated, Pallet Cerillo Herbicide Corr Osive Liquid Paraquat Dichloride Diuron Methyl Bipyridinium Dichl Oride Dichloropheny Dimethylurea Class Iii Marine Pollutant Ems Gregati Group Woo Den Fibreboard Plastic Ttles Into Each Fibreboard Plastic Bottles Mtq Wooden Packag Treated Certified Umigated Pallet Cerillo Herbicide Corro Sive Liquid Paraquat Dichloride Diuron Dim Ethyl Bipyridinium Dichlo Ride Dichlorophenyl Dimethylurea Class Iii Marine Pollutant Ems Gregati Group Wood Fibreboard Plastic Bot Tles Into Each Fibreboard Otal Plastic Bottles Ross Mtq Wooden Treated Certified Fum Igated Pallet Cerillo Herbicide Cor Rosive Liquid Paraqua Dichloride Diuron Imethyl Bipyridinium Dich Loride Dichlorophen Dimethylurea Clas Iii Marine Pollutant Segregati Group Ooden Fibreboa Plastic Bottles Into Each Fibreboard Plastic Bottles Wooden Pack Age Treated Certified Fumigated","8","92708","Pedro Maccio Y Cia Sa","Manuel Melendez 4454 Montevideo Uruguay Ruc 210213820013"
"Shyam Sunder Ramesh Kumar Plot","No 514 B Mithi Rohar Gandhidham - 370201 Kutch Gujarat 1 Gst No 24Aampj0809N1Zk Iec No 3309002519 Pan: Aampj0809N, No 514B Mithi Rohar Gandhidham Kutch Gujarat 370201 Gst No 24Aampj0809N1Zk Email Neerajzindal@Gmail Com","","Phone Numbers: 3309002519 --- Emails: Email Neerajzindal@Gmail Com","United States","2","Los Angeles, Ca","Port Bustamante","440110","Teak Wood Round Logs Teak Wood Round Logs Teak Wood Round Logs Teak Wood Round Logs Teak Wood Round Logs Volumen Hoppus Equivale Hubber Teak Wood Round Logs, Teak Wood Round Logs Teak Wood Round Logs Volumen Hoppus Equivale Hubber Teak Wood Round Logs Teak Wood Round Logs Teak Wood Round Logs Teak Wood Round Logs","24","340898","Shyam Sunder Ramesh Kumar Plot","No 514 B Mithi Rohar Gandhidham - 370201 Kutch Gujarat 1 Gst No 24Aampj0809N1Zk Iec No 3309002519 Pan: Aampj0809N, No 514B Mithi Rohar Gandhidham Kutch Gujarat 370201 Gst No 24Aampj0809N1Zk Email Neerajzindal@Gmail Com"
"Siemens Energy Brasil Ltda","Cnpj440 13159006580 R Dona Francisca 8300 8300 Joinville Sc 89219-600 Br","","Phone Numbers: 44013159006580 --- Emails: ","United States","2","Houston, Tx","Tampico, Veracruz","853890, 940350","Wood Breaker Unit Bushing Aaa Ncm Wooden Treated Certified, Wood Stc Terminales Terminals Aaa Aaa Ncm Wooden Treated Certified","2","3556","Fiorde Assessoria Cnpj, Nelson Heusi Logistica E Armazens G Erais Ltda","55 446 835 0001-61 R Frei Caneca 739 Consolacao Sao Paulo 01307-001 Br, Endereco 100 Rua Gil Stein Ferreiraitajai 88301-210 Br"
"Syngenta Agro Sa","Av Libertador 1855 Vicente Lopez Buenos Aires Argent Cuit - 30-64632845-0","","Phone Numbers: 3064632845 --- Emails: ","United States","2","Houston, Tx","Tampico","380893","Cerillo Herbicide Corrosiv Liquid Paraquat Dic Hloride Diuron Dimeth Bipyridinium Dichlorid Dichlorophenyl Dimethylurea Class Iii Marine Pollutant Ems Segr Egation Group Woode Fibreboard Oxes Plastic Bott Les Into Each Fibreboard Plastic Bottles Wooden Packa Treated Certified Fumigated Cerillo Herbicide Corrosi Liquid Paraquat Chloride Diuron Dimet Hyl Bipyridinium Dichlori Dichlorophenyl Dimethylurea Class Iii Marine Pollutant Ems Seg Regation Group Wood Fibreboard Plasti Bott Les Into Each Fibreboard Plastic Bottles Wooden Pack Age Treated Certified Fumigated, Pallet Oderis Herbicide Corrosive Liqu Paraquat Dichlor Ide Trimethylcetylammonium Chloride Diuron Class Iii Marine Pollutant Ems Segregation Group Wood Fibreboard Plasti Bottl Into Each Fibreboard Plastic Bottles Wooden Pac Kage Treated Certified Fumigated","5","47432","Maersk Logistics Services Argenti","Oficina 3Ero A C1059 Abd Buenos Aires Argentina Cuit 30707055959"
"Vitelsa Caribe S A","S Tax Id: 901 307 719 4 Direcci N: Calle 1 No 2 05 Parque Cent Mz Zf A Lt Int 13 Turbaco, S Tax Id: 9013077194 Direccion: Calle 1 No 2 05 Parque Ct Mz Zf A Lt Int 13 Turbaco Boliva","","Phone Numbers: 9013077194 --- Emails: ","United States","2","Houston, Tx, San Juan, Puerto Rico","Tampico","700529","Ases Clear Float Glass End Cap Wood Cri Stal Flotado Claro Cajas Adera End Cap Vidrio Flotado Laminas Chapa Forma Rectangular Sin Cualquier Tro Trabajo Sin Camada Abso Rvente Cor Incolor Tipo Floa Mexico Volume Weig Ases Clear Float Glass End Cap Wood Cri Stal Flotado Claro Cajas Adera End Cap Vidrio Flotado Laminas Chapa Forma Rectangular Sin Cualquier Tro Trabajo Sin Camada Abso Rvente Cor Incolor Tipo Floa Mexico Volume Weig, Persona Contacto Laura Torres Clear Float Glass Clear Float Glass Clear Float Glass Clear Float Glass End Cap Wood Cristal Flotado Claro Cajas Madera End Cap Vidrio Flotado Laminas Chapa Forma Rectangular Sin Cualquier Otro Trabajo Sin Camada Absorvente Cor Incolor Tipo Float Mexico Volume","10","136529","Agencia De Aduanas Hermann Schwyn Carrera 13B, Lt Global Logistic","Nit: 900-639-834-4 Direccion: Km 1 5 Via Chia-Cajica Costado Occidental Edificio Oxus, No 26-78 Edificio Chambacu Piso 6 Oficina 60Cartagena Colombia"
"Volkswagen Do Brasil Industria De Veiculos Automotores Ltda","Avenida Das Industrias S/N Vinhedo Sp Brasil Cep 13288-163 59 104 422/0018-06, Cnpj No 59 104 422 0103 84 Rua Antonio Singer 6751 Campo Largo","","Phone Numbers: 13288163591044, 59104422010384 --- Emails: ","United States","2","Houston, Tx","Veracruz","841410, 940350","Stabilizer Link Ncm Payable Morristown Wooden Treat Certified Use Woode, Vacuum Pipe Vacuum Pipe Wooden Processed Wood Ncm","2","3505","Volkswagen Do Brasil Industria De Veiculos Automotores Ltda","Avenida Das Industrias S/N Vinhedo Sp Brasil Cep 13288-163 59 104 422/0018-06, Cnpj No 59 104 422 0103 84 Rua Antonio Singer 6751 Campo Largo"
"Weg Equip Elets S A","Av Pref Waldemar Grubba 3000 - Vl Lalau Jaragua Do Sul - 89256-900 Tel 4732764000 - Fax 4732764000, Av Pref Waldemar Grubba 3000 89256-900 Jaragua Do Sul Sc Brazil 71757 2500 1050","","Phone Numbers: 300089256900, 4732764000, 7175725001050 --- Emails: ","United States","2","Houston, Tx","Veracruz","820820, 850300","Electric Motors Electric Motors Wood Treated Certified Electric Motors Electric Motors Wood Treated Certified, Instruments Slitter Cutting Rollers Mts Lxwxh Over Height Cms Wooden Processed Wood Ncm","4","29203","Asia Shipping Transportes Internacionais Ltda, Weg Equip Elets S A","Av Pref Waldemar Grubba 3000 89256-900 Jaragua Do Sul Sc Brazil 71757 2500 1050, Cnpj 01137526000180 Rua Alexandre Herculano 197 13 Andar Gonzaga Santos"
"Zincoligas Industria E Comercio L","Avenida Prefeito Samir Nasserr 2055Cnpj:00 999 513/0005-81 Email: Adm Gv@Zincoligas Com Br Pho, Tres Rios-Rj Brasil Zip Code 25 804Cnpj:00 999 513/0005-81 Email: Adm Gv@Zincoligas Com Br Pho","zincoligas.com","Phone Numbers:  --- Emails: Adm Gv@Zincoligas Com Br","United States","2","Houston, Tx","Tampico","290544, 790111","Zinc Shg Wood Treated Certi Fied, Zinc Woode Treated Certifie Ncm","12","198500","Zincoligas Industria E Comercio L","Avenida Prefeito Samir Nasserr 2055Cnpj:00 999 513/0005-81 Email: Adm Gv@Zincoligas Com Br Pho, Tres Rios-Rj Brasil Zip Code 25 804Cnpj:00 999 513/0005-81 Email: Adm Gv@Zincoligas Com Br Pho"
"2583319 Ontario Inc","6200 Tomken Rd Mississauga Ontario L5T 1X7 Phone 905-672-8000","","Phone Numbers: 9056728000 --- Emails: ","United States","1","Philadelphia, Pa","Puerto Manzanillo","440799","Bund Les Commodity Cumaru Angel Dipteryx Panamensis Vata Irea Erythrocarpa Decking Fas Ncm Wood Treated Cer Tified","2","21800","Willson International Limited","Torontostaff@Willsonintl Com Phone: 905-363-1133 Fax: 905-816-4408"
"A Schulman Plast Do Brasil Ltda","Rod Anhanguera Sn Km 112 Nova Veneza 13177-435 Sumare Sao Paulo Brazil Ph: 09236165000","","Phone Numbers: 09236165000 --- Emails: ","United States","1","San Juan, Puerto Rico","Port Bustamante","390330","Sacks Each Terluran Ncm Ncm Country Mexico Procedence Country Mexico Acquisition Country Mexico Wooden Treated Certified Inoffensive Chemical Product Wood Cargo Securing Handling Treated According Ispm Standard Original Destination Maritime Ineos Styrolution Mexicana","2","29440","A Schulman Plast Do Brasil Ltda","Cnpj 02376055000800 Rod Anhanguera Sn Km 112 Nova Veneza 13177-435 Sumare Sao Paulo"
"Aceros De America Inc","Road Nr 1 Km 25 0 Rio Piedras To Caguas Puerto Rico Ein 66-0316868 Mrn 0011583-0039","","Phone Numbers: 00115830039 --- Emails: ","United States","1","San Juan, Puerto Rico","Veracruz","441239","Brazilian Pine Plywood Reference Type Abt High Cube Bundles Brazilian Pine Plywood Phenolic Glue Oes Ply Produced Conformance Carb Epa Regulation Fwi Tpc Oiled Edges Sealed Red Bundles Bota Nical Name Pinus Spp Shipped Board Woodenpackage Treated Certified Ruc Ioa Contin Uatuion Cep Phone Mail Lavrasul Lavrasul These Solid Wood Pack Ing Are Completely Free Bark Andaparentely Free From Live Plant Pests Department Agriculture Regulation Cfr Nbfaa Aphis Rule Export Reference Reference Type Abt","10","122441","Aceros De America Inc","Road Nr 1 Km 25 0 Rio Piedras To Caguas Puerto Rico Ein 66-0316868 Mrn 0011583-0039 Phone/Fax:"
"Agp Per Usa","C Guillermo Dansey 2016 Cercado De Lima Lima Peru Contacto Lyzeth Principe Leon Tel 51 1 7024600 Ext 345 Ruc 20509862843","","Phone Numbers: 20509862843, 5117024600 --- Emails: ","United States","1","Houston, Tx","Tampico","700521","Green Float Glass Clear Float Glass Green Clear Float Glass End Cap Wood Cristal Flotado Tintex Claro Cajas Madera End Cap Vidrio Flotado Laminas Chapa Forma Rectangular Sin Cualquier Otro Trabajo Sin Camada Absorvente Cor Verde Incolor Tipo Float Mexico Volume Green Float Glass Clear Float Glass Green Float Glass Green Float Glass Green Float Glass Clear Float Glass","6","82707","Agp Per Usa","C Guillermo Dansey 2016 Cercado De Lima Lima Peru Contacto Lyzeth Principe Leon Tel 51 1 7024600 Ext 345 Ruc 20509862843"
"Agricola Df Sas Tax Id","9010516821 Fca Liviney Vda La Cristalina Puerto Gaitan Meta Colombia Ctc Cesar Rojas Ph 57 318 640 0553 Mailcrojasmatallanayahoo Es","","Phone Numbers: 573186400553 --- Emails: ","United States","1","Houston, Tx","Tampico","292620","Woods Swimmer Mezclador Killbros Desyerbadora Woods Serie Desyerbadora Rhino Serie Tractorcito Cesped Bush Hog Serie Nuevo Tractorcito Cesped Zxr Kioti Serie Nuevo Tractorcito Cesped Ariens Serie Nuevo Tractorcito Cesped Bad Boy Magnum Serie Nuevo Tractorcito Cesped Toro Serie Nuevo Tractorcito Cesped Zxr Kioti Serie Nuevo Niveladora Puntas Compresor Serie Contenedor Ecmu Marca Cimc Modelo Serie Cimc Owned","2","23690","",""
"Ain Global Importaca E Exportacao","Cnpj 10291570000131 R Dona Francis Ca 8300 Bl 10 - Mddistrito Indust Rial Joinville Cp 89219-600 Santa Catarina Brazil Ph 11 3525-5011","","Phone Numbers: 10291570000131, 1135255011 --- Emails: ","United States","1","Houston, Tx","Tampico","730210","Terluran Each Terluran Ncm Noffensive Chemical Product Country Mexico Procedence Country Mexico Acquisition Country Mexico Wooden Treated Certified Wood Cargo Securing Handling Treated Accordingto Ispm Standard","2","25550","Activas Plasticos Industriais Ltda","Modulo B Distrito Industrial 8300 Bl 9 R Dona Francisca 89219-600 Joinville Santa Catarina"
"Albaugh Agro Brasil Ltda","Avenida Basileia 590 Resende Rj R27 521-210 Cnpj 01 789 121/0004-70 Insc Estadual 80 588 054Ph 55 24 3354-11766","","Phone Numbers: 552433541176 --- Emails: ","United States","1","Houston, Tx","Veracruz","292111","Dimethylamine Isocontainer Dimethylamine Aqueous Solution Class Flash Point Marine Pullutant Ems Ncm Wood Pack Applicabledimethylamines Isocontainer Dimethylamine Aqueous Solution Class Flash Point Marine Pullutant Ems Ncm Dimethylamine Isocontainer Dimethylamine Aqueous Solution Class Flash Point Marine Pullutant Ems Ncm Dimethylamine Isocontainer Dimethylamine Aqueous Solution Class Flash Point Marine Pullutant Ems Ncm Dimethylamine Dimethylamine Aqueous Solution Class Flash Point Marine Pullutant Ems Ncm Dimethylamine Isocontainer Dimethylamine Aqueous Solution Class Flash Point Marine Pullutant Ems Ncm","9","115860","Den Hartogh Logistica Latin America Ltda","Cnpj 01 291 213/0001-82 Av Julio De Sa Bierrebanch 65 Sala 706 Bloco 1 Rio De Janeiro Brasil Cep 22775-028"
"Alfanar Factory","For Ceramics And P O Box 301 Riyadh 11411 Kingdom Of Saudi Arabia Ph:+966-920006111","","Phone Numbers: +966920006111 --- Emails: ","United States","1","Houston, Tx","Veracruz","210690","Mosaico Vidrio Mosaic Gla Tile Bult Letter Credit Bcpm Against Nfirmed Notified Sight Loading Board Beneficiary Warehouse Mexico Port Oading Any Sea Port Mexico Port Discharge Jeddah Seap Ort Saudi Arabia Trade Terms Exw Beneficiary Warehous Mexico Against Full Oice Value Mosaic Aterials Applicants Rchase Dat Purchase Der Dated All Have Woode Crates Has Been Labeled Irremovable Way Printed Mosai Cos Venecianos Mexico Manufacturer Produc Xporter Certifies Hat Being Exported Ngdom Saudi Arabia Mexican Manufacture","1","17161","Global Corp","Logistics Llc 3Rd Floor Al Khair Buidling 3642 Prince Saud Alfaisal Street Al Rawdah Dist Jeddah 23433 K S A"
"Aliss Usa Corp","8081 Nw 74Th St Miami Fl 33166-2317 305 594 0450 Miami @Aliss Com","","Phone Numbers: 331662317305594 --- Emails: ","United States","1","Port Everglades, Fl","Puerto Manzanillo","691200","Cushion Plastic Kitchenware Polyresin Decorations Wood Tchenware Cotton Dress Cotto Kitchen Linens Flip Flops Ceramic Dinnerware Ceramic Corations Framed Mirror Glas Kitchenware Metal Kitchenwa Metal Decoration Chair Etal Furniture Lantern Ntry Bangladesh Azil China India Turkey","2","17888","Elemar International Forwarding Inc","3475 Nw 114Th Ave Doral 33178-1847"
"Aluplast Gmbh","Auf Der Breit 2 Tel 0721471746 Mail Ingo Catakaluplast Net Karlsruhe 76227 Germany Federal Republic Of","","Phone Numbers: 0721471746 --- Emails: ","United States","1","Houston, Tx","Veracruz","848020","Bases Wood Perfiles Pvc Para Fabricacion Puertas Ventanas Bases Madera","1","9883","Aluplast Gmbh","Auf Der Breit 2 Tel 0721471746 Mail Ingo Catakaluplast Net Karlsruhe 76227 Germany Federal Republic Of"
"American Factory","Direct Furniture 240 New Camellia Blvd Covington La 70433 985-871-0300","","Phone Numbers: 70433985871 --- Emails: ","United States","1","New Orleans, La","Tampico","691110","Leather Sofa Setsmade Chinapo Sfn Solid Wood","1","5016","Flexsteel Industries Inc","385 Bell St"
"Analyse Controle Diagnostic Des R Zone Industrielle Du Rohu","Lanester 56600 France Vat: Fr59537515363 Ctc: Frederic Noblanc","","Phone Numbers: 59537515363 --- Emails: ","United States","1","New Orleans, La","Tampico","630533","Contenedor Mrku Sello Peso Bruto Linear Low Density Polyethylene Woode Bags Wooden Pallet Bags Contenedor Msku Sello Peso Bruto Linear Low Density Polyethylene Woode Bags Wooden Pallet Bags","4","51621","Analyse Controle Diagnostic Des R Zone Industrielle Du Rohu","Lanester 56600 France Vat: Fr59537515363 Ctc: Frederic Noblanc"
"Anker Logistica Y Carga Sas","Nit: 900 183 090 - 2 Aci 463 Carrera 74 No 55 - 66 Normandia I Bogota Colombia Tel 571 746 08 1","","Phone Numbers: 9001830902 --- Emails: ","United States","1","Houston, Tx","Veracruz","482210","Bultos Tarimas Cada Arima Con Cajas Con Piezas Cada Caja Cono Varios Colores Figuras Engargolado Los Tipos Utilizados Para Bobinado Hilados Extiles Woode Treated Certifi","1","7293","Anker Logistica Y Carga Sas Nit","900 183 090 - 2 Aci 463 Carrera 74 No 55 - 66 Normandia I Bogota Colombia Tel 571 746 08 1"
"Antex Ltda","Rua Francisco Ferreira Da Cruz 2500Bairro Pinheiros 83820-293Fazenda Rio Grande Parana Brasil Cnpj 03129424000149","","Phone Numbers: 03129424000149 --- Emails: ","United States","1","Houston, Tx","Tampico","960629","Polyester Polyester Semidull Textile Polymer Pol Mero Poli Ster Semiopaco Textil Wood Treated Certified Ncm","2","22200","Antex Ltda","Rua Francisco Ferreira Da Cruz 2500Bairro Pinheiros 83820-293Fazenda Rio Grande Parana Brasil Cnpj 03129424000149"
"Ao Philip Morris Izhora","Nd Zone Gorelovo Bl 2 Leningrad Region Leningrado Tax Id: 4720007247","","Phone Numbers: 4720007247 --- Emails: ","United States","1","Houston, Tx","Tampico","330290","Cargo Stowed Refrigerated Sat Requested Carrying Temperatuof Degrees Celsius Wood Treated Certified Menthol Las Tarimas Madera Son Tratadas Fumigadaacuerdo Con Legislacion Vigente Del Ispm International Standards Phytossanitary Measures Ncm","1","5455","Ao Philip Morris Izhora","Nd Zone Gorelovo Bl 2 Leningrad Region Leningrado Tax Id: 4720007247"
"Aron Global Pte","Imited 175A Bencoolen Street 07-05 Burlington Square Singapore 189650 Ph:+6562949240","","Phone Numbers: +6562949240 --- Emails: ","United States","1","Houston, Tx","Veracruz","440342","Teak Wood Round Logs Hoppus Teak Wood Round Logs Hoppus Hoppus Volumen Hoppus Equival Hubber Teak Round Logs Tectona Grandis Teak Wood Round Logs Hoppus","6","79700","R B Patel","14 Sardar Patel Timber Market Lati Bazar Zone 3 Behind Gita Mandir Ahmedabad Guijarat"
