"Asil Celik Sanayi Ve Ticaret As Gemic Koyu Mevkii","16800 Orhangazi-Bursa Turkey Vat No 0860052518 Ctc Omer Gencoglu Mr Ph Tel 0090 224 280 61 26","","Phone Numbers: 0090224280612, 0860052518 --- Emails: ","United States","1","Houston, Tx","Tampico","520528","Carbon Ferromanganese Metric Tons Medium Carbon Ferromanganese Size Feet Equivalente Solid Wood Are Totally Free Bark Apparently Free From Live Plant Pests Carbon Ferromanganese Metric Tons Medium Carbon Ferromanganese Size Feet Equivalente Solid Wood Are Totally Free Bark Apparently Free From Live Plant Pests Carbon Ferromanganese Metric Tons Medium Carbon Ferromanganese Size Feet Equivalente Solid Wood Are Totally Free Bark Apparently Free From Live Plant Pests Carbon Ferromanganese Metric Tons Medium Carbon Ferromanganese Size Feet Equivalente Solid Wood Are Totally Free Bark Apparently Free From Live Plant Pests Carbon Ferromanganese Metric Tons Medium Carbon Ferromanganese Size Feet Equivalente Solid Wood Are Totally Free Bark Apparently Free From Live Plant Pests","7","120000","Asil Celik Sanayi Ve Ticaret As Gemic Koyu Mevkii","16800 Orhangazi-Bursa Turkey Vat No 0860052518 Ctc Omer Gencoglu Mr Ph Tel 0090 224 280 61 26"
"Aveks Ic Ve Dis Tecaret A S","Tax Id:1050560009 Imes Sanayi Sitesi C Blok 306 Sokakno 4 Tr 34775","","Phone Numbers: 1050560009 --- Emails: ","United States","1","Houston, Tx","Tampico","720219","Fcl Fcl Metric Tons Medium Carbon Ferro Manganese Size Big Bags Polypropylene Feet Solid Wood Are Totally Free Bark Apparently Free From Live Plant Pests Metric Tons Medium Carbon Ferro Manganese Metric Tons Medium Carbon Ferro Manganese","6","108935","Aveks Ic Ve Dis Tecaret A S","Tax Id:1050560009 Imes Sanayi Sitesi C Blok 306 Sokakno 4 Tr 34775"
"Avon Industrial Ltda","Av Interlagos 4300 Jurubatuba Sao Paulo Sao Paulo Brazil C P 04660-907 Cnpj 00680516000124","","Phone Numbers: 00680516000124 --- Emails: ","United States","1","Houston, Tx","Tampico","392330","Glass Bottles Glass Bottles Cosmetic Glass Color Decorated Capacity Glass Bottles Cosmetic Glass Color Decorated Capacity Glass Bottles Cosmetic Glass Color Decorated Capacity Ncm Wood Declartion Treated Certified Impbr","1","5030","Avon Industrial Ltda","Av Interlagos 4300 Jurubatuba Sao Paulo Sao Paulo Brazil C P 04660-907 Cnpj 00680516000124"
"Axalta Coating Systems Brasil Ltda","Cnpj 15 373 395/0001-45 Av Lindomar Gomes De Oliveira 463 07220-900 Guarulhos-Sp Brazil","","Phone Numbers: 46307220900 --- Emails: ","United States","1","Houston, Tx","Veracruz","290541","Trimethylolpropane Bigbags Trimethylolpropane Ncm Wood Cargo Securing Handling Treated According Ispm Standard","1","10480","Axalta Coating Systems Brasil Ltda","Cnpj 15 373 395/0001-45 Av Lindomar Gomes De Oliveira 463 07220-900 Guarulhos-Sp Brazil"
"Bompreco Supermercados Do Nordeste","Rua Padre Carapuceiro 800 Sl 2 Cnpj 13 004 510/0001-89 51020280 Caxanga - Pe Brazil","","Phone Numbers: 00018951020280 --- Emails: ","United States","1","Houston, Tx","Tampico","847529","Glassware Ncm Named Account Nse Wood Applicable","1","7963","Fiorde Logistica International","Rua Frei Caneca 739 - 3 Andar Frei Caneca Sao Paulo Cep 01307-001Cnpj 55 446 835/0001-61 Brazil"
"Bostik Argentina Sa","Av Fondo De La Legua 1044 Martinez Buenos Aires Argentina Cp 1640 Tax Id 30-70953145-6 Florencia Denarobostik Com","","Phone Numbers: 3070953145 --- Emails: ","United States","1","Houston, Tx","Tampico","300510","Adhesive Adhesive Ncm Wood","2","23315","Bostik Argentina Sa","Av Fondo De La Legua 1044 Martinez Buenos Aires Argentina Cp 1640 Tax Id 30-70953145-6 Florencia Denarobostik Com"
"Bridgestone Do Brasil Industria E C Omercio Ltda","Av Queiroz Dos Santos 1717 Santo Andre-Sp-Brasil- Cep 09015-901 Ctc Ms Simone C So Uza Ph 5511 4433 1276","","Phone Numbers: 551144331276 --- Emails: ","United States","1","Houston, Tx","Tampico","280300","Carbon Black Inspec Carbon Mineral Negro Humo Inspec Ncm Wood","10","114114","Contact Ms Simone C Souza","Contact Ms Simone C Souza"
"Brose Do Brasil Ltda","Rua Max Brose 171 83090-670 Sao Jose Dos Pinhais 02258243000150 Juan Padron 4133812080","","Phone Numbers: 02258243000150, 17183090670, 4133812080 --- Emails: ","United States","1","Houston, Tx","Veracruz","841520","Automotive Trunk Spindle Automotive Trunk Openers Wood Declaration Treated Certified Ncm","1","1263","Brose Do Brasil Ltda","Rua Max Brose 171 83090-670 Sao Jose Dos Pinhais 02258243000150 Juan Padron 4133812080"
"Bsw Houston S","1632 Haden Rd Houston Tx 77015 Usa Attn: Twinn@Brenntag Com","brenntag.com","Phone Numbers:  --- Emails: Twinn@Brenntag Com","United States","1","Houston, Tx","Veracruz","350699","Cyclohexylamine Cycloh Exylamine Imo Pgii Drum Feet Each Drum Fumigat Shrink Wrappe Erg Bsw Emergency Phone Via Chemtrec Ccn Borsod Wood Country Zech Republic","1","16000","Jas Forwarding Usa Charleston Bra","4289-A Crosspoint Drive Ladson Sc 29456 Usa Office: +1 843 486-5343"
"Cando Tiban Angel Genaro","Av Tsachila Lote 3 Santo Domingo Santo Domingo 24 Ecu Codigo Postal 230107 Nit 1708426729001","","Phone Numbers: 1708426729001 --- Emails: ","United States","1","Houston, Tx","Tampico","700529","Clear Float Glass Clear Float Glass Clear Float Glass End Cap Wood Cristal Flotado Claro Cajas Madera End Cap Vidrio Flotado Laminas Chapa Forma Rectangular Sin Cualquier Otro Trabajo Sin Camada Absorvente Cor Incolor Tipo Float Mexico Volume","2","26028","Cando Tiban Angel Genaro","Av Tsachila Lote 3 Santo Domingo Santo Domingo 24 Ecu Codigo Postal 230107 Nit 1708426729001"
"Capital Trade Importacao E Exportacao Ltda","Av Coronel Marcos Konder 805 Salas 1101-1108 11 Andar Centro Empresarial Marcos Konder Z C 88301-302 Centro Itajai","","Phone Numbers: 1101110811 --- Emails: ","United States","1","Houston, Tx","Tampico","730210","Chemical Product Sacks Each Terluran Ncm Country Mexico Procedence Country Mexico Acquisition Country Mexico Wooden Treated Certified Inoffensive Chemical Product Wood Cargo Securingand Handling Treated According Ispm Standard Chemical Product Sacks Each Terluran Ncm Country Mexico Procedence Country Mexico Acquisition Country Mexico Wooden Treated Certified Inoffensive Chemical Product Wood Cargo Securingand Handling Treated According Ispm Standard Chemical Product Sacks Each Terluran Ncm Country Mexico Procedence Country Mexico Acquisition Country Mexico Wooden Treated Certified Inoffensive Chemical Product Wood Cargo Securingand Handling Treated According Ispm Standard Chemical Product Sacks Each Terluran Ncm Country Mexico Procedence Country Mexico Acquisition Country Mexico Wooden Treated Certified Inoffensive Chemical Product Wood Cargo Securingand Handling Treated According Ispm Standard","10","127750","Apta Industria E Comercio De Resinas Ltda","Rua Expedicionario Holz 550 13 Andar Sala 1314 Bairroamerica Joinville Sc Brazil Cep 89 201-740 Cnpj"
"Cargo Y Servicios Internationales","Attn Rfc:Csi 0107 16 Q89 Norte 176 No 436 Col Pensador Gchristen@Cargoyserv Com Mx Mexico Df 15510","cargoyserv.com","Phone Numbers:  --- Emails: Pensador Gchristen@Cargoyserv Com Mx","United States","1","Houston, Tx","Puerto Manzanillo","850151","Break Bulk Three Phase Electric Motor Wooden Treated Certified Due Ruc Ncm Wood Have Been Submitted Phytosanitary Treatment Certified Method Heat Treatment Modality Kiln Drying Established International Standard Ispm","0","43335","Cargo Y Servicios Internationales Attn Rfc Csi","0107 16 Q89 Norte 176 No 436 Col Pensador Gchristen@Cargoyserv Com Mx Mexico Df 15510"
"Cba Itapissuma Ltda","Rod Pe 35 S/N Km 03 Ala A Zona Industrial 53700-000 - Itapissuma Pernambuco-Brazil Cnpj 05 342 105/ 0004-95 Tel +55 11 5508-6947","","Phone Numbers: +551155086947 --- Emails: ","United States","1","Houston, Tx","Veracruz","391231","Jumbo Reels Espula Aco Retor Spulas Ncm Rack Aco Retor Racks Ncm Aluminium Ncm Wooded","1","4518","Cba Itapissuma Ltda","Rod Pe 35 S/N Km 03 Ala A Zona Industrial 53700-000 - Itapissuma Pernambuco-Brazil Cnpj 05 342 105/ 0004-95 Tel +55 11 5508-6947"
"China National Chemical Fiber Corp","Jian-Guo Road Beijing 100020 China X Taxid 91110000100011508X","","Phone Numbers: 911100001000115 --- Emails: ","United States","1","Houston, Tx","Veracruz","440110","Cipres Cypress Wood Round Logs","8","87750","China National Chemical Fiber Corp","Jian-Guo Road Beijing 100020 China Xs Taxid 91110000100011508X"
"Cimed Industria Sa","Av Coronel Armando 2750 Un Ind I Pouso Alegre Mg-37558-608 Tel 3521022000 Fax 3521022005 Cnpj 02 814 497/0002-98","","Phone Numbers: 3521022000, 3521022005 --- Emails: ","United States","1","Houston, Tx","Veracruz","291632","Organic Peroxide Organic Peroxide Type Olid Dibenzoyl Peroxide Concentration Class Assigned Perkadox Dfg Ung Fibreboard Plastic Bags Marine Pollutant Yes Benzoyl Peroxide Ems Ncm Wood Cargo Securing Handling Treated According Ispm Standard Mex Norme Sadt Emergency Temperature Control Temperature Point Closed Ventilation Humidit Organic Peroxide Type Solid Dibenzoyl Peroxide Marine Pollutant","1","900","Cimed Industria Sa","Av Coronel Armando 2750 Un Ind I Pouso Alegre Mg-37558-608 Tel 3521022000 Fax 3521022005 Cnpj 02 814 497/0002-98"
"Cimed Industria Sa Coronel Armando","Rubens Storino 2750 Minas Geraispouso Alegre Mgbrazil Cnpj 0281449700 0298Contact Suellen Carvalho Costa E Suellen Costagrupocimed Com Br","","Phone Numbers: 02814497000298 --- Emails: ","United States","1","Houston, Tx","Veracruz","291632","Organic Peroxide Perkadox Dfg Ung Marine Pollutant Yes Dib Enzoyl Peroxide Ems Mex Norme Sadt Organic Peroxide Type Solid Dibenzoyl Peroxide Marine Pollutant Wood Cargo Securing Handling Treated According Ispm Standard","1","900","Cimed Industria Sa Coronel Armando","Rubens Storino 2750 Minas Geraispouso Alegre Mgbrazil Cnpj 0281449700 0298Contact Suellen Carvalho Costa E Suellen Costagrupocimed Com Br"
"Consulado Geral Americano","No Rio De Janeiro Cnpj 04 141 058 0001 06 Av Presidente Wilson 147 Centro 20 030 020 Rio De Janeiro","","Phone Numbers: 04141058000106 --- Emails: ","United States","1","Houston, Tx","Veracruz","150990","Construction Diploma Tic Wood Applicable Soc Tghu Mscu Sil Vavc State Gov Phone Marilia Fujii Sirva","3","29827","Concept Mobility Servicos De Mobilidade Ltda","Rua Voluntarios Da Patria 126 Sala 901 Botafogo Riode Janeiro Rj Brasil Cep 22270 010"
"Dantzler Inc","Carretera 865 Km 5 5 Candelaria Arenas Toa Baja Pr 00949 Ph 787-784-2153","","Phone Numbers: 7877842153 --- Emails: ","United States","1","San Juan, Puerto Rico","Veracruz","691010","Crates Cedar Plac Especie Introducida Cedro Australiano Toona Ciliata Quality Eucalyptus Core Tsca Title Certified Termited Treated Thicknesses Crates Marks Tmg Ced Crt Mic Clean Board Declaredby Cargo San Juan Puerto Rico Certify That Solid Wood Swpm Wood Wpm Has Been Manufacturer Certifies Product Accordance Withthe Formaldehyde Emission Standards Specifie Epa Tsca Title Carb Atcm Phase Tpc Bmh Epa Certificate Tpc Epa Bmh Carb Certificate Tpc Carb Manufacturer Lot Batch Tax Hacienda Bond Continuation Hernandarias Alto Parana Para Guay Ncms Wooden Treated Certified","2","31200","Diana Vega","Dianavega@Maderastratadas Com"
"Delpa Shipping Trade Forwarding","46 Filonos Str Piraeus 18535 Gr Contact Imports 210 4227400 T 210 4111897 F","","Phone Numbers: 2104111897, 2104227400 --- Emails: ","United States","1","Houston, Tx","Tampico","842121","Slac Stc Filters Viz Water Nos Pallet Type Wood Heat Treated Aes Itn Service Type Pier Pier","1","7080","Delpa Shipping Trade Forwarding","46 Filonos Str Piraeus 18535 Gr Contact Imports 210 4227400 T 210 4111897 F"
"Dillard Supply","55 Industrial Park Rd 38855 - Mantachie Ms Usa Phone: 1 662 2827587 Fax: 1 662","","Phone Numbers: 16622827587 --- Emails: ","United States","1","New Orleans, La","Tampico","440910","Slac Into Taeda Pine Moul Dings Fsc Mixed Scs Coc Ncm Morristown Agree Ment Sea Waybill Ddp Ntachie Usa Wood Was Treated Are Certified Method","1","15970","Perin Trade Co","4160 Temescal Canyon Rd Suite 401 92883 - Corona Ca Usa Phone: 1 951 2812557 Attn : Jeferson Perin"
"Dow Brasil Ind E Com De Produtos Quimicos Ltda","Cnpj: 60435351000319 Rod Br-101 700 Km 112 Andar 2 Galpacep 88311-600 Itajai-Sc Brazil","","Phone Numbers: 60435351000319 --- Emails: ","United States","1","Houston, Tx","Veracruz","390120","Uni Val Dmda High Dens Ity Polyethylene Resin Bags Bags Pallet Ncm Umber Bags Woode Treated Rtified","8","101821","Comissaria Pibernat Ltda","Cnpj: 92 102 433/0009-23 Rua Manoel Vieira Garcao 120-9 Andar-Sala 901 Edificio Zen Tower"
"Dsv Uti Air & Sea Agenciamento De T","105 Av Engenheiro Luiz Carlos Berri04571-010 - Sao Paulo - Brazil Cjn: 02735565000142","","Phone Numbers: 02735565000142 --- Emails: ","United States","1","Houston, Tx","Tampico","440710","Autopartes Asientos Utilizados Vehiculos Automoviles Wood Treated Certif Ied","1","11915","Dsv Uti Air & Sea Agenciamento De T","105 Av Engenheiro Luiz Carlos Berri04571-010 - Sao Paulo - Brazil Cjn: 02735565000142"
"Energizer Brasil Ind Com Bens D","Rodovia Br 232 S/N Km 9 3 Curado Jaboatao Dos Guararapes Pe Brasil Ph: 55-81-2101-8919","","Phone Numbers: 558121018919 --- Emails: ","United States","1","Houston, Tx","Tampico","200570","Trlu Metric Tons Manganese Oxide Big Bags Each Way Pallet Wood Treated Certif Ied Ncm Brazil Mrku Tric Tons Manganese Dioxid Big Bags Each Way Wooden Ackage Treated Certified Ncm Brazil","3","53501","Energizer Brasil Ind Com Bens D","Rodovia Br 232 S/N Km 9 3 Curado Jaboatao Dos Guararapes Pe Brasil Ph: 55-81-2101-8919"
"Enzur S A","Azara 3787 11400 Contact Eduardo Pomies Telephone 00 5982-5086644 Email Eduardoenzur Com","","Phone Numbers: 0059825086644 --- Emails: ","United States","1","Houston, Tx","Veracruz","441510","Triethanolamine Triethanolamine Monoetanolamine Plastic Drums Monoethanolamine Monoethanolamine Imo Class Flashpoint Palletized Drums Fumigated Wood Trietanolamine Metal Drums Palletized Drums Fumigated Wood Zarpe Boarding Board Ncm Group Proper Shipping Name Ethanolamine Ncm","1","19530","Enzur S A","Azara 3787 11400 Contact Eduardo Pomies Telephone 00 5982-5086644 Email Eduardoenzur Com"
"Euro Rijn International B V","Plaza 6 Nl-4782 Moerdijk The Netherlands Tel:31-0168-393250 The Netherlands","","Phone Numbers: 310168393250 --- Emails: ","United States","1","Houston, Tx","Tampico","250100","Metric Tons Nitrided Medium Carbon Ferromanganese Big Bags Size Weigt Femn Mcn Solid Wood Are Totally Free Bark Apparently Free From Live Plant Pests Metric Tons Nitrided Medium Carbon Ferromanganese Big Bags Size Weigt Femn Mcn Solid Wood Are Totally Free Bark Apparently Free From Live Plant Pests","3","55150","Euro Rijn International B V","Plaza 6 Nl-4782 Moerdijk The Netherlands Tel:31-0168-393250 The Netherlands"
"Expeditors International Do Brasi","R Dr Renatopaes Debarros 1017 Cj142Edif Corpprk Cnpj:00711 083/0001-2704530-001 Sao Paulo - Sp","","Phone Numbers: 00012704530001 --- Emails: ","United States","1","Houston, Tx","Veracruz","701010","Wooden Glass Ringes Ncm Wood Treated Certifi","1","560","Expeditors International Do Brasi","R Dr Renatopaes Debarros 1017 Cj142Edif Corpprk Cnpj:00711 083/0001-2704530-001 Sao Paulo - Sp"
"Fanfani Srl","U Via Dei Fulgidi 6 57123 Livorno Li Italy Tel 0586214611 Email G Eberlefanfani Eu","","Phone Numbers: 0586214611 --- Emails: ","United States","1","Houston, Tx","Veracruz","940169","Wood Teak Wood","2","22660","Bertolino Piero Srl","Via Roma 52 Candia Canavese 10010 To Italy Email Infobertolinosrl Com"
"Fca Fiat Chrysler Automoveis Br Ltda","Av Contorno Da Fiat Cep 32530-480 Betim - Mg - Brasil 55 31 2123 214 Cnpj 16 701 716/0001-56","","Phone Numbers: 55312123214 --- Emails: ","United States","1","Houston, Tx","Veracruz","940190","Motor Vehicles Automotive Ncm Wood Treated According","1","80","Fca Fiat Chrysler Automoveis Br Ltda","Av Contorno Da Fiat Cep 32530-480 Betim - Mg - Brasil 55 31 2123 214 Cnpj 16 701 716/0001-56"
"Fca Italy Spa 63053A","Ente Di Servizio Del Polo Italia C So Settembrini 53 -10153 Torino Italy Tax Id It07973780013 Phone +39 011 0047292","","Phone Numbers: +390110047292, 07973780013 --- Emails: ","United States","1","Houston, Tx","Tampico","441510","Cable Drums Wood Wooden Crates","3","12350","Dhl Global Forwarding Italy S P A","Str Del Francese 152/8 10156 Torino To Italy Phone +39 011 4518448 Voip 2117 48 Tax Id It00754800159"
"Fcc Industria E Comercio Ltda","R Paineira 20 Vl Operaria Campo Bom C P 93700-000 Rio Grande Do Sul Brazil Ph 55 5121292274 E-Mail Nelson Marchettofcc Com Br","","Phone Numbers: 555121292274 --- Emails: ","United States","1","Houston, Tx","Tampico","390390","Styrolux Sacks Each Styrolux Ncm Inoffensive Chemical Product Country Mexico Procedence Country Mexico Acquisition Country Mexico Wooden Treated Certified Wood Cargo Securing Handling Treated According Ispm Standard","2","25550","Fcc Industria E Comercio Ltda","R Paineira 20 Vl Operaria Campo Bom C P 93700-000 Rio Grande Do Sul Brazil Ph 55 5121292274 E-Mail Nelson Marchettofcc Com Br"
"Ferceva S A","Ruc: 0992471158001 Km 2 5 Av Juan Tanca Marengo","","Phone Numbers: 0992471158001 --- Emails: ","United States","1","Houston, Tx","Tampico","700991","Clear Silver Mirror Float Glass Containerswith Clear Silver Mirror Float Glass End Cap Madeof Wood Cristal Flotado Espejo Claro Cajas Madera End Cap Vidrio Flotado Laminas Chapa Forma Rectangular Sin Cualquier Otro Trabajo Sin Camada Absorvente Color Incolor Tipo Float Mexico Ncm Volume","1","21415","Ferceva S A","Ruc: 0992471158001 Agustion Freire"
"Gac Logistica Do Brasil Ltda","Rua Dr Bacelar 368 Cj 31-21-33 Vila Clementino Sao Paulo Sp Brasil Phone : 55-11-5083-3999","","Phone Numbers: 551150833999 --- Emails: ","United States","1","Houston, Tx","Tampico","293090","Acelerante Cbs Ciclohexil Enzotiazol Sulfenamida Woode Aplicable Ncm Imo Class Cking Group Iii","1","10300","Gac Logistica Do Brasil Ltda","Rua Dr Bacelar 368 Cj 31-21-33 Vila Clementino Sao Paulo Sp Brasil Phone : 55-11-5083-3999"
"Gebr Der Weiss Gmbh","Am Sandtorkai 75 D 20457 Hamburg T +49 40 317 986159","","Phone Numbers: +494031798615 --- Emails: ","United States","1","Houston, Tx","Veracruz","391690","Hardware Wood Manufactures Tarimas Long Wooden Furniture Herrajes Manufacturas Madera Hardware Wood Manufactures","1","3974","Gebr Der Weiss Gmbh","Am Sandtorkai 75 D 20457 Hamburg T +49 40 317 986159"
"General Motors Do Brasil Ltda","Av General Motors 1959 - Cep 12224-300 Sao Jose Dos Campos - Sp Cnpj 59 275 792/0008-26 Valessa Pepe Te 55 11 4239 6236","","Phone Numbers: 551142396236 --- Emails: ","United States","1","Houston, Tx","Tampico","853890","Automotive Wood Declaration Treated Certified Ncm","1","7030","Same As Consignee","No Address"
"Gm Wood Products","531 Clay Streetnewaygo Mi 49337 Contact Name: Kyle T Ricecontac T Email: Krice@Gmcompanies Com","gmcompanies.com","Phone Numbers:  --- Emails: Krice@Gmcompanies Com","United States","1","New York/Newark Area, Newark, Nj","Bahias Ballenas","440910","Pckgs Taeda Pine Kiln Dried Less Clear Grade Finger Joint Blanks Raw Exterior Glue Country Braziltratamento Termico Pck Blank Raw Sheets Msku Pckgs Blank Raw Sheets Mrku Pckgs Blank Raw Sheets Mrku Final Destination Newaygo Contact Deliverytodd Mcculloughtmcc Ullough Gmcompanies Clean Shipped Boardshipped Boardfreight Ncm Naladi Ruc Wooden Mate Rial Yeswooden Treated Certifi Wood Heat Treatment","6","76680","Scm Solutions Corp","32938 Tamina Rd Suite 100Magnolia Tx 77354281-628-0808 Faximpor Ts@Scmcorp Comtom@Scmcorp Com"
"Grain De Sail","4 Route Du Bas De La Rivi Re 29600 Morlaix France Vat Fr75538866740","","Phone Numbers: 75538866740 --- Emails: ","United States","1","Houston, Tx","Veracruz","170490","Cocoa Liquor Amco Organic Cocoa Liquor Peru Wood Licor Cacao Natural Organico Organic Certified Lot Cargo Stowed Under Deck Below Waterline Away From Boilers Others Sources Heat Stand Direct Sunlight","1","11440","Grain De Sail","4 Route Du Bas De La Rivi Re 29600 Morlaix France Vat Fr75538866740 Julia Salaungraindesail Com"
"Guala Closures De Colombia Ltda","Calle 17 No 42-75 Bogota Colombia Rut 800 251 038-8 Tel 5712696599 Contacto Javier Pineda","","Phone Numbers: 5712696599 --- Emails: ","United States","1","Houston, Tx","Veracruz","821193","Lathe Its Accessories Wood Lathe Lunetta Sharpener Cutting Blade Roughing Cutting Blade Finished","1","2205","Guala Closures De Colombia Ltda","Calle 17 No 42-75 Bogota Colombia Rut 800 251 038-8 Tel 5712696599 Contacto Javier Pineda"
"Guala Closures Uk Ltd","Old Mill Park Industrial Kirkintilloch Glasgow Gbr Karina Vickers Ph 44 141 777 2015 Katrina Vickersgualaclosures Co Uk","","Phone Numbers: 441417772015 --- Emails: ","United States","1","Houston, Tx","Veracruz","994614","Wood Adhesive Plugs Cajas Con Tapones Madera Adehsivo Wood Adhesive Plugs","1","694","Same As Consignee","No Address"
"Hermis Trade Llc","3050 North 29Th Court Hollywood Fl 33020 Usa Contact: David O Dri Scoll Davido@W-Bp Com","w-bp.com","Phone Numbers:  --- Emails: Scoll Davido@W-Bp Com","United States","1","Port Everglades, Fl","Bahias Ballenas","441239","Containingplybead Pine Ywood Wbp Glue Grooved Pine Plywood Wbp Glue Ooved Clean Board Wood Rocessedg Metragem Cubica Due Ruc Ncm","2","27873","Hermis Trade Llc","3050 North 29Th Court Hollywood Fl 33020 Usa Contact: David O Dri Scoll Davido@W-Bp Com"
"His Agenciamento Maritimo Ltda","Av Mogi Taiacupeba 70 Taiacupeba Cnpj: 15 440 165/0001-51 Cep: 08765Tel: +55 11 2779-0818","","Phone Numbers: +551127790818 --- Emails: ","United States","1","Houston, Tx","Veracruz","200570","Said Wood Beta Carote Yellow Oil Soluble Lutei Wsl Carotene Butter Color Caroteno Pink Thocyanin Concentrated Ncm Wooden Treated Certified","1","6370","His Agenciamento Maritimo Ltda","Av Mogi Taiacupeba 70 Taiacupeba Cnpj: 15 440 165/0001-51 Cep: 08765Tel: +55 11 2779-0818"
"Holland Southwest International Inc","6831 Silsbee Houston Tx 77033 Contact: Alex Keller Phone: 713-644-1966 Ext 123","","Phone Numbers: 7136441966 --- Emails: ","United States","1","Houston, Tx","Tampico","847439","Wood Mater Ial Complies Ispm High Cube Ackage Birch Plywood Ackages Composite Wood Prod Ucts Appearing Dentified Descriptions Carb Tsca Title Must Comply California Air Resources Boa Airborne Toxic Control Meas Ure Reduce Formaldehyde Missions From Wood Components Epa Tsca Title Formaldehyde Emissions Stan Dards","2","25400","Potts Mccanless And Mccanless","15201 East Frwy Channelview Tx 77530 Ph: 713-451-1566"
"Hutchinson Snc Transmissions","Rue Des Martyrs 37304 Joue-Les-Tours France Tax Id Fr20314397696","","Phone Numbers: 20314397696 --- Emails: ","United States","1","Houston, Tx","Veracruz","441510","Wood Wooden Articles Reels Wood Wooden","3","6646","",""
"Ies Do Brasil Solucoes Em Equipamie Ntos Ltda","Cnpj 150 90 456/001-67 Rodovia Br491 Km70 Guaranesia Minasgerais Brasil 37810-000 55-35-3555 8909 Michele Oliveira","","Phone Numbers: 553535558909 --- Emails: ","United States","1","Houston, Tx","Tampico","846692","Tools Ans Spare Wood Treated Certified Ncm","2","6959","Shipmasters International Freight Agenciamento De Frete Ltda","- Epp Al Terracota 185"
"Ikea Supply Ag C/O Ikea","Distribution Services 4762 Borusan Road Baytown Tx 77523 Usa Phone: 9129661490 - Fax:9129661419 Vat No: N A","","Phone Numbers: 9129661419, 9129661490 --- Emails: ","United States","1","Houston, Tx","Veracruz","940360","Stow Furniture Finished Pine Wood Purchase Consignment Ecis Fsc Mix Credit Product From Well Managed Forests Other Controlled Urces Ima Coc Due Ncm Tare There Raw Wood Inside Wooden Applicable Reference Type Abt","2","23387","Ikea Purchasing Services Us Inc","3200 Horizon Dr #120 Suite G10 King Of Prussia Pa 19406 Usa Attn: Customs Dept Ikea2 Usdo@Ikea Com Phone: 48"
"Indecar S A","Av Vernet 62 Capital Federal-Buenosaires-Argentina Cuit 30-57390794-5 Ctc Emiliano Argul/Arturo Sramek","","Phone Numbers: 3057390794 --- Emails: ","United States","1","Houston, Tx","Veracruz","310540","Monoamonium Phosphate Monoamonium Phosphate Sacks Each Oneh Wood Monopotassium Monopotassium Phosphate Sacks Each Oneh Wood Sodium Tripolyphosphate Sodium Sacks Each Oneh Wood Dangerous Dangerous Dangerous","1","20890","Indecar S A","Av Vernet 62 Capital Federal-Buenosaires-Argentina Cuit 30-57390794-5 Ctc Emiliano Argul/Arturo Sramek"
"Inmafynce S A","Km2 5 Av Juan Tanca Marengo 4 5 20-21 Y Agustin Freire Guayaquil - Ecuador Ruc 0992863927001","","Phone Numbers: 0992863927001 --- Emails: ","United States","1","Houston, Tx","Tampico","700991","Silver Mirror Clear Silver Mirror Float Glass Cms Clear Silver Mirror Float Glass End Cap Wood Espejo Claro Cajas Madera End Cap Vidrio Flotado Laminas Chapa Forma Rectangular Sin Cualquier Otro Trabajo Sin Camada Absorvente Cor Incolor Tipo Float Mexico Volume","1","20001","Inmafynce S A","Km2 5 Av Juan Tanca Marengo 4 5 20-21 Y Agustin Freire Guayaquil - Ecuador Ruc 0992863927001"
"International Timber Company","Survey No 1A1A Old No 461 Ambattu Gstin: 33Aaffi5913D1Zs Iec: 0415037841","","Phone Numbers: 0415037841 --- Emails: ","United States","1","Houston, Tx","Veracruz","440729","Said Teak Wood Clean Squar Hsn Applic Able Free Time Days Detenti Port Discharge Pla Elivery","4","52550","International Timber Company","Survey No 1A1A Old No 461 Ambattu Gstin: 33Aaffi5913D1Zs Iec: 0415037841"
"Jacob Redekop Fehr","Finca Australia Vda Cristalinas Lt 21 Puerto Gaitan Meta Colombia Ctc Cesar Rojas Taxid 7001748563 Tel 57 318 640 0553","","Phone Numbers: 573186400553, 7001748563 --- Emails: ","United States","1","Houston, Tx","Tampico","293292","Agricultural Machinery Maquinaria Agricola Machinery Agriculture Sembradora John Deere Serie Tractor John Deere Motor Serie Cabezal John Deere Serie Desyerbadora Woods Serie Compresor Wir Ingersoll Rand Serie Lem Compresor Jda Sullivan Palatek Serie Puertas Pvc Puertanatek Ventanas Pvc Puertanatek Molde Para Cemento Contenedor Ecmu Marca Cimc Modelo Aaa Serie Xcmc","2","28480","",""
