"Brp Brasil Motorsports Ltda","Rua Dona Francisca 8300 Joinville Sc 89219-600 Brazil Cnpj: 22 782 8330001-94","","Phone Numbers: 227828330001 --- Emails: ","United States","3","Houston, Tx","Veracruz, Tampico","890399","Hasu Crates Personal Water Craft Sea Doo Stowage Cat Ems Wooden Treated Certified Dangerous Ncm Elivery Msku Crates Personal Water Craft Sea Doo Stowage Cat Ems Wood Treated Certif Ied Dangerous Ncm Trhu Crates Personal Water Craft Sea Doo Stowage Cat Ems Wooden Treated Certified Dangerous Ncm Mrku Ith Crates Personal Water Craft Sea Doo Stowage Cat Ems Wooden Ckage Treated Certified Dangerous Ncm Delivery Tcku Crates Personal Water Craft Sea Stowage Cat Ems Wooden Treated Certified Dangerous Good Ncm Delivery Mrsu Crates Person Water Craft Sea Doo Stow Age Cat Ems Ooden Treated Cer Tified Dangerous Ncm Hasu Crat Personal Water Craft Sea Doo Stowage Cat Ems Wooden Treat Certified Dangerous Ods Ncm Mrku Crates Personal Water Raft Sea Doo Stowage Cat Ems Wooden Pack Age Treated Certified Ngerous Ncm Mrku Crates Person Water Craft Sea Doo Stow Age Cat Ems Ooden Treated Cer Tified Dangerous Ncm Mrsu Crates Personal Water Craft Sea Doo Stowage Cat Wooden Treated Certified Dangero Ncm Hasu C, Tcku Crates Ersonal Water Craft Sea Doo Stowage Cat Ems Wooden Treated Certified Dangerous Ncm Livery Sudu Crates Personal Ater Craft Sea Doo Stowage Cat Ems Woode Treated Certifi Dangerous Ncm Delivery Msku Rates Personal Water Craft Doo Stowage Cat Ems Wooden Eated Certified Dangerous Ncm Delivery Gbu Crates Persona Water Craft Sea Doo Stowa Cat Ems Oden Treated Cert Ified Dangerous Ncm Deliver Gcxu Crates Personal Water Craft Sea Doo Stowage Cat Wooden Treated Certified Danger Ous Ncm Delivery Tcku Crates Rsonal Water Craft Sea Doo Stowage Cat Ems Wooden Treated Certified Dangerous Del Ivery Tcnu Crates Personal Water Raft Sea Doo Stowage Cat Ems Wooden Pack Age Treated Certified Ngerous Ncm Delivery Mrsu Cra Tes Personal Water Craft Sea Doo Stowage Cat Ems Wooden Trea Ted Certified Dangerous Oods Ncm Delivery Tck Crates Sonal Water Craft Sea Doo Towage Cat Ems Wooden Treated Certified Dangerous Deli Very Mrku Crates Personal Water Aft Sea Doo Stowage Cat Ems Wooden Packa Treated Ce, Tllu Crates Person Water Craft Sea Doo Stow Age Cat Ems Ooden Treated Cer Tified Dangerous Ncm Deliver Mrsu Crates Personal Water Craft Sea Doo Stowage Cat Ems Wooden Pac Kage Treated Certified Angerous Ncm Delivery Hasu Crates Personal Water Craft Sea Stowage Cat Ems Wooden Treated Certified Dangerous Good Ncm Delivery Msku Crates Personal Wat Craft Sea Doo Stowage Ems Wooden Treated Certified Dangerous Ncm Delivery Caiu Crat Personal Water Craft Sea Doo Stowage Cat Ems Wooden Treat Certified Dangerous Ods Ncm Delivery Mrku Crates Personal Ater Craft Sea Doo Stowage Cat Ems Woode Treated Certifi Dangerous Ncm Delivery Msku Ates Personal Water Craft Doo Stowage Cat Ems Wooden Tre Ated Certified Dangerous Ncm Delivery Crates Personal Water Craft Sea Doo Stowag Cat Ems Woo Den Treated Certi Fied Dangerous Ncm Delivery Mrku Crates Personal Water Craft Sea Doo Stowage Cat Ems Wooden Reated Certified Dangerou Ncm Delivery Mrku Crates Person Water Craft Sea Doo Stow Age Cat Ems Ooden Treated","45","166728","Brp Brasil Motorsports Ltda","Rua Dona Francisca 8300 Joinville Sc 89219-600 Brazil Cnpj: 22 782 8330001-94"
"Cablena Do Brasil Ltda","Est Vinhedo Viracopos Km 80 5 Serrinha Itupeva Sao Paulo 13295-000 Brasil 01770422000109","","Phone Numbers: 01770422000109 --- Emails: ","United States","3","Houston, Tx","Veracruz","740312, 740811","Copper Wire Alambron Cobre Ncm Copper Wire Wooden Processed Wood Faa Copper Wire Alambron Cobre Ncm Copper Wire Wooden Processed Wood Faa Copper Wire Alambron Cobre Ncm Copper Wire Wooden Processed Wood Faa Cable Faa, Copper Wire Alambron Cobre Ncm Copper Wire Wooden Processed Wood Pei Pei Pei Pei Copper Wire Alambron Cobre Ncm Copper Wire Wooden Processed Wood Pei Pei Pei Pei Copper Wire Alambron Cobre Ncm Copper Wire Wooden Processed Wood Pei Pei Pei Pei Copper Wire Alambron Cobre Ncm Copper Wire Wooden Processed Wood Pei Pei Pei Pei, Copper Wire Alambron Cobre Ncm Copper Wire Wooden Processed Woodcopper Wire Alambron Cobre Ncm Copper Wire Wooden Processed Woodcopper Wire Alambron Cobre Ncm Copper Wire Wooden Processed Woodcopper Wire Alambron Cobre Ncm Copper Wire Wooden Processed Woodcopper Wire Alambron Cobre Ncm Copper Wire Wooden Processed Wood","26","297264","Cablena Do Brasil Ltda","Est Vinhedo Viracopos Km 80 5 Serrinha Itupeva Sao Paulo 13295-000 Brasil 01770422000109"
"Chemiba Srl","Eori Code: It03419920107 Via Xx Settember 5 16121 Genova Italia Ctc:Nicoletta Muci Ph: 00 331 551 762, Eori Code: It03419920107 Via Xx Settembre 5 16121 Genova Italia Ctc:Nicoletta Muci Ph: 00 331 551 762","","Phone Numbers: 00331551762, 03419920107 --- Emails: ","United States","3","Houston, Tx","Veracruz","310510","Sodium Carboxymethylcellulose Type Wetcel Armonized Codes Encina Wood Conifer Woods Supers Ack Each Lote Each, Sodium Carboxymethylcellulose Type Wetcel Harmonized Codes Encina Wood Allets Conifer Woods Supersa Each Encina Wood Conifer Woods Supersack Each Lote Each Each, Sodium Carboxymethylcellulose Type Wetcel Harmonized Codes Encina Wood Conifer Woods Supersack Each Encina Wood Conifer Woods Supersack Each Lote Each Each","3","48280","Matras Srl","Eori Code: It00275110104 Via De Marini 53 16149 Genova Italia Ctc:Veronica Galluccio Ph: +39 010 85 999 70"
"Cole Pallet Services Corp","1600 S 7Th Streetdekalb Il 6011 5Brett A Colebrett@Colepallet Com, 1600 S 7Th Streetdekalb Il 6011 5Fone 815 758-3226Brett A Co Lebrett@Colepallet Com","colepallet.com","Phone Numbers: 8157583226 --- Emails: A Colebrett@Colepallet Com, Co Lebrett@Colepallet Com","United States","3","Houston, Tx","Bahias Ballenas","440320","Bundles Pine Pallet Heat Treated Certified Pinus Taeda Below All Wood Product Including Runners Are Kdht Pine Wooden Treated Certifiedfreight Agreementfreight Collectncm Aladi Due Ruc, Bundles Pine Pallet Heat Treated Certified Pinus Taeda Below All Wood Product Including Runners Are Kdht Pine Wooden Treated Certifiedfreight Agreementfreight Collectncm Ladi Due Ruc, Bundles Pine Pallet Heat Treated Certified Pinus Taeda Below All Wood Product Including Runners Are Kdht Pine Wooden Treated Certifiedfreight Colle Ctfreight Agreementexpress Releasen Naladi Ruc","22","271420","Cole Pallet Services Corp","1600 S 7Th Streetdekalb Il 6011 5Brett A Colebrett@Colepallet Com, 1600 S 7Th Streetdekalb Il 6011 5Fone 815 758-3226Brett A Co Lebrett@Colepallet Com"
"Cristales Y Vidrios Del Per Usa","C Calle Cinco Mza C Lote 13 Urb Las Vegas Distrito De Puente Piedra Ctc Irina Morales Tel 81 8332630 Ruc 20554278524","","Phone Numbers: 20554278524 --- Emails: ","United States","3","Houston, Tx","Tampico","700529","Clear Float Glass Clear Float Glass Cms Clear Float Glass Clear Float Glass Cms Clear Glass End Cap Wood Cristal Flotado Claro Cajas Madera End Cap Vidrio Flotado Laminas Chapa Forma Rectangular Sin Cualquier Otro Trabajo Sin Camada Absorvente Cor Incolor Tipo Float Mexico Volume Clear Float Glass Clear Float Glass Cms, Float Glass Clear Float Glass Cms Float Glass Clear Float Glass Cms Clear Float Glass End Cap Wood Cristal Flotado Claro Cajas Madera End Cap Vidrio Flotado Laminas Chapa Forma Rectangular Sin Cualquier Otro Trabajo Sin Camada Absorvente Cor Incolor Tipo Float Mexico Volume, Float Glass Clear Float Glass Float Glass Clear Float Glass Clear Float Glass End Cap Wood Cristal Flotado Claro Cajas Madera End Cap Vidrio Flotado Laminas Chapa Forma Rectangular Sin Cualquier Otro Trabajo Sin Camada Absorvente Cor Incolor Tipo Float Mexico Volume","25","424488","Cristales Y Vidrios Del Per Usa","C Calle Cinco Mza C Lote 13 Urb Las Vegas Distrito De Puente Piedra Ctc Irina Morales Tel 81 8332630 Ruc 20554278524"
"Del Valle Kahman & Company","6600 Caballero Blvd Buena Park Ca Everyone@Dvkco Com, 6600 Caballero Blvd Buena Part Ca 90620-1132 Phone #: 714-522-3100, 6600 Caballero Blvd Buena Part Ca Barbara Rybicki Barbara@Dvkco Com","dvkco.com","Phone Numbers: 7145223100 --- Emails: Ca Everyone@Dvkco Com, Rybicki Barbara@Dvkco Com","United States","3","Los Angeles, Ca","Lazaro Cardenas","441222","Dvk Wood Complies Ispm High Cube Birch Plywood Composite Wood Roducts Appearing Identified Carb Title Must Comply California Air Resources Board Airborne Toxic Control Easure Reduce Formaldehyd Emissions From Wood Componen Epa Tsca Tit Formaldehyde Emissions Tandards, Msku Dvk Birch Plywood Fsc Mix Credit Coc Wood Complies Ispm Compo Site Wood Appearing Identified Scripti Ons Carb Tsca Title Must Compl California Air Sources Board Airborne Toxic Ontrol Measure Reduce Forma Ldehyde Emissions From Wood Components Epa Title Formaldehy Emi Ssions Standards, Ponu Los Angeles Dvk Dvk Pac Kages Birch Plywood Msku Dvk Birch Lywood Tcnu Dvk Packa Ges Birch Plywood Mrku Dvk Dvk Birch Plywood Fsc Mix Credit Coc Wood Compl Ies Ispm Composite Wood Appearing Identified Descri Ptions Carb Tsca Title Must Comply California Air Resources Board Airborne Toxic Control Easure Reduce Formaldehyde Emissions From Wood Components Epa Tsca Title Formaldehyde Emissions Stand Ards","12","158160","Del Valle Kahman & Company","6600 Caballero Blvd Buena Park Ca Jessica Gipson@Fedex Com; Dora Paz@Dex Com, 6600 Caballero Blvd Buena Part Ca 90620-1132 Phone #: 714-522-3100, 6600 Caballero Blvd Buena Part Ca Barbara Rybicki Barbara@Dvkco Com"
"Fox Cargo Do Brasil","Rua Cuiaba 229 - Mooca 03183-000 - Sao Paulo - Sp Fone: +55 11 3543-0200","","Phone Numbers: +551135430200 --- Emails: ","United States","3","Houston, Tx","Tampico","760200","Pallet Class Aluminum Scrap Ncm Woode Treated Certifie, Pallet Class Aluminum Scrap Ncm Woode Treated Certifie Pallet Class Aluminum Scrap Ncm Wooden Pac Kage Treated Certified","20","190766","Fox Cargo Do Brasil","Rua Cuiaba 229 - Mooca 03183-000 - Sao Paulo - Sp Fone: +55 11 3543-0200"
"Green Forest Products Llc","105N Apopka Avenue Inverness Fl U Tel 352-341-5500 Email: Chay@Green Danielle@Greenforestprod Com;Jessic","green.danielle","Phone Numbers: 3523415500 --- Emails: Chay@Green Danielle","United States","3","Port Everglades, Fl","Puerto Manzanillo","441231","Plywood Hardwood Plywood Aaa Plywood Hardwood Plywood Aaa Plywood Hardwood Plywood Stc Plywood Surface Coated Each Ply Tropical Hardwood Plywood Species Are Totally Free Bark Apparently Free Live Pests Plywood Consisting Least Outer Ply Following Tropical Woods Species Virola Sebifera Other Inner Ply Species Brosimum Utile Dacryodes Peruviana Schizolobium Parahybum Surface Covered Carb Certified Atcm Compliant Certificate Tpc Carb Epa Tsca Title Certified Cfr Certificate Tpc Epa Bundles Dae, Plywood Hardwood Plywood Aaa Stc Plywood Surface Coated Each Ply Tropical Hardwood Plywood Species Are Totally Free Bark Apparently Free Live Pests Plywood Consisting Least Outer Ply Following Tropical Woods Species Virola Sebifera Other Inner Ply Species Brosimum Utile Dacryodes Peruviana Schizolobium Parahybum Surface Covered Carb Certified Atcm Compliant Certificate Tpc Carb Epa Tsca Title Certified Cfr Certificate Tpc Epa Bundles Dae Plywood Plywood Hardwood Plywood Plywood Hardwood Plywood Aaa Plywood Hardwood Plywood Aaa, Plywood Hardwood Plywood Plywood Hardwood Plywood Plywood Plywood Hardwood Plywood Plywood Hardwood Plywood Plywood Hardwood Plywood Plywood Hardwood Plywood Stc Plywood Surface Coated Each Ply Tropical Hardwood Plywood Species Are Totally Free Bark Apparently Free Live Pests Plywood Consisting Least Outer Ply Tropical Wood Species Gmelina Arborea Jacaranda Copaia Terminalia Superba Cordia Alliodora Surface Covered Carb Certified Atcm Compliant Certificate Tpc Carb Epa Tsca Title Certified Cfr Certificate Tpc Epa Bundles Dae Plywood Hardwood Plywood Plywood Hardwood Plywood Plywood Plywood Hardwood Plywood Plywood Hardwood Plywood","22","252877","Green Forest Products Llc","105N Apopka Avenue Inverness Fl U Tel 352-341-5500 Email: Chay@Green Danielle@Greenforestprod Com;Jessic"
"Gurudev Corp","S No 94/14 Plot No 7 Nanded Road Tax Id: 0396024220, S No 94/1A Plot No 7 Nanded Roa Latur - 413512 Iec :- 0396024220, S No 94/1A Plot No 7 Nanded Road Latur 413512 Maharashtra - India Iec:0396024220","","Phone Numbers: 0396024220 --- Emails: ","United States","3","Houston, Tx","Veracruz","440729, 940169","Said Teak Wood Clean Squa Applica Ble Free Time Days Detentio Port Discharge Plac Elivery, Said Teak Wood Clean Squar Applic Able Free Time Days Por Discharge Place Deli Very, Teak Wood","18","238593","Gurudev Corp","S No 94/14 Plot No 7 Nanded Road Tax Id: 0396024220, S No 94/1A Plot No 7 Nanded Roa Latur - 413512 Iec :- 0396024220, S No 94/1A Plot No 7 Nanded Road Latur 413512 Maharashtra - India Iec:0396024220"
"Millennium Group","Of P R Inc Road 842 Km 2 5 B O Caimito San Juan Puerto Rico 00927 Ssp 660598710 Atn:Ulpiano Rodrigueztel Y Fax: 787 7319999/787-7318602, Of P R Inc Road 842 Km 2 5 B O Caimito San Juan Puerto Rico 00927 Ssp 660598710 Tel : Y Fax : : 787 7319999 // 787-7318602 /, Of P R Inc Road 842 Km 2 5 B O Caimito San Juan Puerto Rico 00927 Ssp 660598710 Tel Y Fax 787 7319999 //","","Phone Numbers: 7877319999, 7877318602 --- Emails: ","United States","3","San Juan, Puerto Rico","Veracruz","871680","Hand Tools General Example Wood Handles, Hand Tools General Example Wood Handles Hand Tools General Example Hammer, Hand Tools Hand Tools General Example Shovel Hand Tools Hand Tools General Example Wood Handles","7","81350","Ajc Logistics Llc, Evolution Caribbean Logistics Llc, Millennium Group","#220 Global Plaza Bldg 2Nd Floor Suite# 208 Office# B Blay Street Urb Industrial Bechara San Juan P R 00920, 165 Buchanan Office Center Suite 202 Rd 00968 Guaynabo Carr Mexico-Laredo Km 1009 Puerto Rico Email Dtorreseagle-Lo, Of P R Inc Road 842 Km 2 5 B O Caimito San Juan Puerto Rico 00927 Ssp 660598710 Atn:Ulpiano Rodrigueztel Y Fax: 787 7319999/787-7318602"
"Multilog S/A","Rodovia Deputado Antonio Heil 4999 Itaipava Cep 88316-003 Itajai Sc Brazil Tel: 41 32111799","","Phone Numbers: 4132111799 --- Emails: ","United States","3","San Juan, Puerto Rico","Port Bustamante","800120, 480269","Aluminum Billets Ncm Wood Applicable Aluminum Billets Ncm Wood Applicable Aluminum Billets Ncm Wood Applicable Aluminum Billets Ncm Wood Applicable Aluminum Billets Ncm Wood Applicable Aluminum Billets Ncm Wood Applicable Cnpj Aluminum Billets Ncm Wood Applicable Aluminum Billets Ncm Wood Applicable, Aluminum Billets Ncm Wood Applicable Aluminum Billets Ncm Wood Applicable Aluminum Billets Ncm Wood Applicable Aluminum Billets Ncm Wood Applicable Aluminum Billets Ncm Wood Applicable Cnpj Aluminum Billets Ncm Wood Applicable Aluminum Billets Ncm Wood Applicable, Aluminum Billets Ncm Wood Applicable Cnpj Aluminum Billets Ncm Wood Applicable","25","464453","Multilog S/A","Rodovia Deputado Antonio Heil 4999 Itaipava Cep 88316-003 Itajai Sc Brazil Tel: 41 32111799"
"Rtg Furniture Corp","Carr #2 Bo Candelaria Zip Code 00949 Toa Baja - Porto Rico Phone: 787 995-5959","","Phone Numbers: 7879955959 --- Emails: ","United States","3","San Juan, Puerto Rico","Veracruz","940350","Volumes Ofassembled Wooden Furniture Pine Wood Elow Ncm Comercial Lir Due Solid Wood Has Been Wooden App Licable Delivery Address Rtg Fur Niture Corporation Address Carr Candelaria Zip City Toa Baja Country Porto Rico Phone Hilda Durant Hdurant Roomstogo Ext Reference Type Abt Continuation Contact Rottamoveis, Volumes Ofassembled Wooden Furniture Pine Wood Elow Ncm Comercial Lir Due Solid Wood Materialhas Been Use Wooden Appl Icable Delivery Address Rtg Furn Iture Corporation Address Carr Candelaria City Toa Baja Phone Zip Country Porto Rico Hilda Durant Hdurant Roomstogo Ext Reference Type Abt Continuation Contact Rottamoveis","3","40328","Room To Go Pr","Carr #2 Bo Candelaria Toa Baja Pr 00949 Phone: 787 995 5959"
"Soliver Nv","Groene Herderstraat 18 Roeselare Belgium Zip Code: B-68000 Tax Id: Be-0402754787, Groene Herderstraat 18 Roeselare Belgium Zip Code: B-68000Tax Id: Be-0402754787","","Phone Numbers: 0402754787 --- Emails: ","United States","3","Houston, Tx","Tampico","700521, 700529","Clear Float Glass Clear Float Glass End Cap Wood Cristal Flotado Claro Cajas Madera End Cap Vidrio Flotado Laminas Chapa Forma Rectangular Sin Cualquier Otro Trabajo Sin Camada Absorvente Cor Incolor Tipo Float Mexico Volume, Green Float Glass Green Float Glass End Caps Wood Cristal Flotado Tintex Cajas Madera End Cap Vidrio Flotado Laminas Polido Las Dos Chapa Forma Rectangular Sin Cualquier Otro Trabajo Sin Camada Absorvente Cor Vertipo Float Mexico Volume Green Float Glass, Green Float Glass Green Float Glass Green Float Glass Green Float Glass End Caps Wood Cristal Flotado Tintex Cajas Madera End Cap Vidrio Flotado Laminas Polido Las Dos Faces Chapa Forma Rectangular Sin Cualquier Otro Trabajo Sin Camada Absorvente Cor Vertipo Float Mexico Volume","11","158891","Soliver Nv","Groene Herderstraat 18 Roeselare Belgium Zip Code: B-68000 Tax Id: Be-0402754787, Groene Herderstraat 18 Roeselare Belgium Zip Code: B-68000Tax Id: Be-0402754787"
"Usply 5870 Nw 163Rd","Street Miami Lakes Fl 33014 Usa Mr Nick Shethfax: 305 722-6623, Streetmiami Lakes Fl 33014 Usamr Nick Shethfax: 305 722-6623, Streetmiami Lakes Fl 33014 Usamr Nick Shethtel 305 722-6622 Fax: 305 722-6623","","Phone Numbers: 3057226623, 3057226622 --- Emails: ","United States","3","Port Everglades, Fl","Bahias Ballenas","441113, 441114","Said Crates Sheets Guarafiber Mdf Medium Densit Fiberboard Standard Grade Mark Cac Sheets Mdf Std Carb Phase Tsca Tit Levi Compliant Tpc Fsc Mix Credit Scs Coc Ncm Reference Kgsruc Cac Ncm Tota Clean Boardshipped Board Agreementw Ood Species Southernyellow Pine Pinus Ellio Ttii Taeda From Brazil Product Wood Processed Wood, Said Crates Sheets Guarafiber Mdf Medium Densit Fiberboard Standard Grade Mark Cac Sheets Mdf Std Carb Phase Tsca Title Pliant Tpc Fsc Mix Credit Scs Coc Ncm Reference Cac Ncm Cod Clean Boar Dshipped Board Agreementwood Species Southernyello Pine Pinus Elliottii Taeda From Razil Product Wooden Pro Cessed Wood, Said Crates Sheets Ofguarafiber Mdf Medium Density Fiberboard Standard Grade Mark Cac Sheets Mdf Std Carb Phase Tsca Title Compliant Tpc Fsc Mix Credit Scscoc Ncm Reference Cac Kgruc Cac Clean Boardshipped Board Eight Prepaidfreight Agreementwood Species Southern Yellow Pine Pinus Elliott Taeda From Brazil Product Wooden Processed Wood Said Crates Sheets Ofguarafiber Mdf Medium Density Fiberboard Standard Grade Mark Cac Sheets Mdf Std Carb Phase Tsca Title Compliant Tpc Fsc Mix Credit Scscoc Ncm Reference Cac Kgruc Cac Clean Boardshipped Board Eight Prepaidfreight Agreementwood Species Southern Yellow Pine Pinus Elliott Taeda From Brazil Product Wooden Processed Wood","12","159940","Usply 5870 Nw 163Rd","Street Miami Lakes Fl 33014 Usa Mr Nick Shethfax: 305 722-6623, Streetmiami Lakes Fl 33014 Usamr Nick Shethfax: 305 722-6623, Streetmiami Lakes Fl 33014 Usamr Nick Shethtel 305 722-6622 Fax: 305 722-6623"
"Builders First Source Inc","2001 Bryan Street Suite 1600 Dallas Tx 75201 Phone: 214-880-3510","","Phone Numbers: 2148803510 --- Emails: ","United States","2","Houston, Tx","Veracruz","210690","Pine Wood Panelboard Type Osb Riented Strand Board Osb Apa Ing Osb Apa Ing Wooden Processed Voice Lpbxxx Ify Tax Duns","40","521410","Expeditors International","Houston Tx 18255 Humble Parkway Humble Tx 77338-Usa"
"Corporacion Miyasato S A","C Ruc No : 20100083877 Avenida I 1174-La Victoria-Lima 15033 P, C Ruc No : 20100083877 Avenida Iquitos 1174-La Victoria-Lima","","Phone Numbers: 20100083877 --- Emails: ","United States","2","Houston, Tx","Tampico","700529","Clear Float Glass Clear Float Glass Containerswith Clear Float Glass End Cap Madeof Wood Cristal Flotado Claro Cajas Madera End Cap Vidrio Flotado Laminas Chapa Forma Rectangular Sin Cualquier Otro Trabajo Sin Camada Absorvente Cor Incolor Tipo Float Mexico Volume, Clear Float Glass Clear Float Glass Containerswith Clear Float Glass End Cap Wood Cristal Flotado Claro Cajas Madera End Cap Vidrio Flotado Laminas Chapa Deforma Rectangular Sin Cualquier Otro Trabajo Sin Camada Absorvente Cor Incolor Tipo Float Mexico Volume","22","383075","Corporacion Miyasato S A","C Ruc No : 20100083877 Avenida 15033 Peru Tel:+511-619-9500, C Ruc No : 20100083877 Avenida I Tel:+511-619-9500"
"Dongguan Yongzhu Chemistry Co Ltd","No 2-3 Block C No 2 Taiyuan Street Yayuan Industrial Area Nancheng District Dongguan City China T 0769-22403708 F 0769-22403706, Tax Id: 91441900725469287F No 2-3 Block C No 2 Taiyuan Street Yayuan Industrial Area","","Phone Numbers: 076922403706, 076922403708, 914419007254692 --- Emails: ","United States","2","Houston, Tx","Tampico","261400, 320611","Titanium Dioxide That Commodity Name Pure Rutile Titanium Dioxr Board Vessel Cma Cgm Lamartine Port Loading Altamira Mexico Wood Amarked Ippc Shipping Mark Vendor Frame Work Vendor Tax, Titanium Dioxide That Pure Rutile Titanium Dioxide Board Vessel Tolten Port Loading Altamira Mexico Wood Marked Ippc Shipping Mark Board Ocean Vendor Frame Work Tax","2","43830","Dongguan Yongzhu Chemistry Co Ltd","No 2-3 Block C No 2 Taiyuan Street Yayuan Industrial Area Nancheng District Dongguan City China T 0769-22403708 F 0769-22403706, Tax Id: 91441900725469287F No 2-3 Block C No 2 Taiyuan Street Yayuan Industrial Area"
"Europartners Argentina Sa","Cuit 33-71600349-9 Lima 555 Piso 2 Of 202 C1073Aak Caba Buenos Aires, Cuit 33-71600349-9 Lima 555 Piso 6 Of 202 C1073Aak Caba Buenos Aires","","Phone Numbers: 3371600349 --- Emails: ","United States","2","Houston, Tx","Tampico","847439, 940360","Drums Alke Woode Yes Wooden Condit Ions Treated Certified Ais Origen Mexico Pall Ets Bags Alkest Wooden Materi Yes Wooden Conditions Eated Certified Pais Rigen Mexico, Drums Lkest Dangerus Product Consoli Dates Cargo Ncm Woode Yeswooden Condition Treated Certifiedpais Origen Mexico","4","51835","Europartners Argentina Sa","Cuit 33-71600349-9 Lima 555 Piso 2 Of 202 C1073Aak Caba Buenos Aires, Cuit 33-71600349-9 Lima 555 Piso 6 Of 202 C1073Aak Caba Buenos Aires"
"Fareva Desenvolvimento Fabricacao","E Acondicionamento De Produtos Rua Americo Simoes 620 Sao Roque Dachave Itupeva Sao Paulo Bra C P 13295-000 12041854000103, E Acondicionamento De Produtos Rua Americo Simoes 620 Sao Roque Dachave Itupeva Sao Paulo Bra C P 13295-000 12041854000103 Eduardo","","Phone Numbers: 1329500012041854 --- Emails: ","United States","2","Houston, Tx","Veracruz","701010, 900140","Color Limestone Glass Color Limestone Glass Crystalline Cosmetic Decorated Capacity Wooden Processed Wood Ncm, Glass Glass Wood Declaration Treated Certified Ncm","2","7258","Fareva Desenvolvimento Fabricacao","E Acondicionamento De Produtos Rua Americo Simoes 620 Sao Roque Dachave Itupeva Sao Paulo Bra C P 13295-000 12041854000103, E Acondicionamento De Produtos Rua Americo Simoes 620 Sao Roque Dachave Itupeva Sao Paulo Bra C P 13295-000 12041854000103 Eduardo"
"Fox Cargo Do Brasil Ltda","Cnpj: 05 317 708/0001-94 Rua Cuiaba 229 - Mooca Ph:5511-35430200- Sao Paulo Sao","","Phone Numbers: 551135430200 --- Emails: ","United States","2","Houston, Tx","Veracruz","390690, 841370","Mid Range Liquid Flac Mxbr Ncm Wooden Packi Processed Wood, Pump Stg Mxbr Wooden Processed Wood","2","19875","Fox Cargo Do Brasil Ltda","Cnpj: 05 317 708/0001-94 Rua Cuiaba 229 - Mooca Ph:5511-35430200- Sao Paulo Sao"
"Fps Famous Pacific Shipping B V","Van Riemsdijkweg 78 3088 Hd Rotterdam The Netherlands Tel: +31 10 2831 919 /935 Atn : Marco Van Den Nouwland, Van Riemsdijkweg 78 3088 Hd Rotterdam The Netherlands Tel: 31102831919/935 At N: Marco Va","","Phone Numbers: +31102831919, 31102831919 --- Emails: ","United States","2","Houston, Tx, New Orleans, La","Veracruz","701990, 732619","Elring Klinge Mexico Palletss Containin Metallic Gaskets Use Automotive Conten Iendo Juntas Metalicas Para Uso Automotriz Fac Tura Maria Eugenia Serrano Zapata Van Madera Con Cajas Con Teniendo Articulos Personal Menaje Casa Wood Usehold Personal Eff Ects Air Temp Oil Coolers Bbm Cpg Mexicana Pallet Nteniendo Panel Acustico Par Ducto Salida Turbina Air Temp Oil Coolers Cimexlana Pal Let Contenido Tela Lana Peinada Pallet Fabric Wool, General Cargo Roll Paper Vitrica Conteniendo Manga Trezada Fibra Vidrio Recubierta Resinas Braided Fiberglass Sleeve Coated Resins Mexi Aloe Laboratorios Packaes Plastic Drums Diameters Height Each Product Aloe Vera Gel Batch Plastic Frum Diameter Height Each Product Aloe Vera Gel Batch Mexi Aloe Laboratorios Packwages Plastics Drums Each Product Aloe Vera Liposoluble Lot Trade Wood Gears Sicorsa Industrial Ibc Plastic Textile Preparation Brb Sqo Cordaflex High Density Polyethylene Ethylene Copolymer Vinyl Acetate Christina Primke Pairs Mexican Handcraft Shoes Wiegand Assembly Equipment Tools Herramientas Equipo Montaje Carnet Ata Carnet Ata Carnet Ata Lauro Antonio Tonacatl Ojeda Lift Van Triplay Que Contienen Household Bed Toys Kitchen Items Pictures Chair Etc","2","16899","Fps Famous Pacific Shipping B V","Van Riemsdijkweg 78 3088 Hd Rotterdam The Netherlands Tel: +31 10 2831 919 /935 Atn : Marco Van Den Nouwland, Van Riemsdijkweg 78 3088 Hd Rotterdam The Netherlands Tel: 31102831919/935 At N: Marco Va"
