"Company Name","Top Addresses","Company Websites","Company Contact Info","Company Country","Aggregated Volume","Top Destination Ports Used","Top Departure Ports Used","Top H.S. Code","Product Description","Total TEU","Total Weight","Top Notify Parties","Top Notify Party Addresses"
"Nv Soliver","Groene Herderstraat 18 Roeselare Belgium Zip Code: B-68000 Tax Id: Be-0402754787, Groene Herderstraat 18 Roeselare Belgium Zip Code: B-68000Tax Id: Be-0402754787, Groene Herderstraat 18 Roeselare Belgium Zip Code: B-68000 Tax Id: Be-0402754787 Erik","","Phone Numbers: 0402754787 --- Emails: ","United States","339","Houston, Tx, Mobile, Al, Tampa, Fl","Tampico","700521, 700529, 700530","Green Float Glass Green Float Glass End Cap Wood Cristal Flotado Tintex Cajas Madera End Cap Vidrio Flotado Laminas Chapa Forma Rectangular Sin Cualquier Otro Trabajo Sin Camada Absorvente Cor Verde Tipo Float Mexico Volume, Clear Float Glass Clear Float Glass End Cap Wood Cristal Flotado Claro Cajas Madera End Cap Vidrio Flotado Laminas Chapa Forma Rectangular Sin Cualquier Otro Trabajo Sin Camada Absorvente Cor Incolor Tipo Float Mexico Volume, Dark Green Light Float Glass Dark Green Light Float Glass End Cap Wood Cristal Flotado Tintex Plus Light Cajas Madera End Cap Vidrio Flotado Laminas Chapa Forma Rectangular Sin Cualquier Otro Trabajo Sin Camada Absorvente Cor Verde Tipo Float Mexico Volume","650","10066634","Nv Soliver, Ziegler Nv","Groene Herderstraat 18 Roeselare Belgium Zip Code: B-68000 Tax Id: Be-0402754787, Groene Herderstraat 18 Roeselare Belgium Zip Code: B-68000Tax Id: Be-0402754787, Klipperstraat 15 2030 Antwerp En Belgium Tax Id / Vat : Be 0403 480 507"
"Asia Shipping Transportes Internaci","R Alexandre Herculano 197 - 13 And Santos - Sp - Brazil Cep: 11050-030Phone: +55 13 2101-7770, Cnpj: 01137526000180 Rua Alexandre Herculano 197 13 And Gonzaga Santos Sp Brazil","","Phone Numbers: +551321017770, 01137526000180 --- Emails: ","United States","211","Houston, Tx, New Orleans, La","Veracruz","760200, 391740","Aluminum Beverage Scrap Ubc Ncm Wood Applicable, Aluminum Beverage Scrap Ubc Ncm Wood Applicable Aluminum Beverage Scrap Ubc Ncm Wood Applicable, Aluminum Beverage Scrap Ubc Ncm Wood Applicable Aluminum Beverage Scrap Ubc Ncm Wood Applicable Aluminum Beverage Scrap Ubc Ncm Wood Applicable","887","9866027","Asia Shipping Transportes Internaci","R Alexandre Herculano 197 - 13 And Santos - Sp - Brazil Cep: 11050-030Phone: +55 13 2101-7770, Cnpj: 01137526000180 Rua Alexandre Herculano 197 13 And Gonzaga Santos Sp Brazil"
"Baltek Inc","5240 National Center Drive Colfax Nc 27235 Usa Phone 1 336 398 1900 Colfax Nc27235 Us, 5240 National Center Drive Colfax Nc 27235 Usa Phone 1 336 398 1900 Colfaxnc27235 Us, 5240 National Center Drive Colfax Nc 27235 Usa Phone 1 336 398 1900 Colfax Nc27235Us","","Phone Numbers: 13363981900 --- Emails: ","United States","189","Norfolk, Va, New York, Ny, Houston, Tx","Puerto Manzanillo","442199, 480269","Balsa Wood Kilndried Secada Horno Glued Encolada Eight Dae Bft Ncm, Balsa Wood Kilndried Secada Horno Glued Encolada Dae Panels Bft Ncm, Balsa Wood Kilndried Secada Horno Glued Special Encolada Tota Wei Ght Dae Panels Bft Ncm","189","1600981","",""
"Asia Shipping Transportes Interna","R Alexandre Herculano 197 - 13 And Santos - Sp - Brazil Cep: 11050-030Phone: +55 13 2101-7770, R Alexandre Herculano 197 - 13 And Santos - Sp - Brazil Cep: 11050-030Phone:  13 2101-7770, Cnpj: 01137526000180 Rua Alexandre Herculano 197 13 And Gonzaga Santos Sp Brazil","","Phone Numbers: +551321017770, 1321017770, 01137526000180 --- Emails: ","United States","95","Houston, Tx","Veracruz","760200, 401100, 440130","Aluminum Beverage Scrap Ubc Ncm Wood Applicable Aluminum Beverage Scrap Ubc Ncm Wood Applicable, Aluminum Beverage Scrap Ubc Ncm Wood Applicable, Aluminum Beverage Scrap Ubc Ncm Wood Applicable Aluminum Beverage Scrap Ubc Ncm Wood Applicable Aluminum Beverage Scrap Ubc Ncm Wood Applicable","334","3500998","Asia Shipping Transportes Interna","R Alexandre Herculano 197 - 13 And Santos - Sp - Brazil Cep: 11050-030Phone: +55 13 2101-7770, R Alexandre Herculano 197 - 13 And Santos - Sp - Brazil Cep: 11050-030Phone:  13 2101-7770, Cnpj: 01137526000180 Rua Alexandre Herculano 197 13 And Gonzaga Santos Sp Brazil"
"John Deere Brasil Ltda","Catal O Quadra 11 Eixo 3 Lote 00 Catal O Dmic Gobr 75709-685 Cnpj 89674782001049, Catal O Quadra 11 Eixo 3 Lote 00 Catal O Dmic Gobr 75709-685 Tax Id 89674782001049, Catalo Quadra 11 Eixo 3 Lote 00 Catalo Dmic Gobr 75709-685 Tax Id 89674782001049","","Phone Numbers: 89674782001049, 89674782001472, 00104975701970 --- Emails: ","United States","51","Houston, Tx, New Orleans, La","Tampico","252230, 440399, 441700","Hydraulic Cylinder Wood Declaration Treated Certified Ncm Units Hydraulic Cylinder, Hydraulic Cylinder Wood Declaration Treated Certified Ncm Units Hydraulic Cylinder Units Hydraulic Cylinder Units Hydraulic Cylinder Units Hydraulic Cylinder Units Hydraulic Cylinder Units Hydraulic Cylinder Units Hydraulic Cylinder, Hydraulic Cylinder Wood Declaration Treated Certified Ncm Hydraulic Cylinder","51","373658","Panalpina Ltda","Pra A Antonio Telles 12 - 10 Andar Salas 101 A 108 - Centro Santos Brazil 37810-000, Pra A Antonio Telles 12 - 10 Andar Salas 101 A 108 - Centro Santos Cnpj 49 728 108/0002-75 Brazil 37810-000, Av Cristovao Colombo 2360/ 401 90560-002-Porto Alegre-Rs/Brasil A/C Marco Serpa 51 2149-4937 Cnpj49 728 108/0005-18"
"Hardwoods Specialty Products Us Lp","17618 Harvill Avenue Perris Ca 92570 Usa Tel: 951-653-9400, 17618 Harvill Avenue Perris Ca 92570 Usa Tel:951-653-9400 Fax:951-653-9444, 17618 Harvill Avenue Perris Ca 92570 Usa Tel: 951-653-9400 Fax: 951-653-9444","","Phone Numbers: 9516539400, 9516539444 --- Emails: ","United States","30","Los Angeles, Ca, Long Beach, Ca","Lazaro Cardenas","441232","Birch Plywood Composite Woo Appearing Identified Descriptions Carb Tsca Ust Comply Evironment Protection Agency Tsc Title Standards Reduc Formaldehyde Emissions From Composite Wood, Birc Plywood Beau Omposite Wood Appea Ring Identified Descriptions Tsca Must Comply Evironmental Protection Agency Tsca Title Sta Ndards Reduce Formaldehyd Emissions From Composite Ood, Birc Plywood Composite Wood Oducts Appearing Identified Descriptions Carb Tsca Mus Comply Evironment Protection Agency Tsca Title Standards Reduce Formaldehyde Emissions Composite Wood","62","828575","John M Brining Co Inc","202 Congress Street Mobile Al 36603 Tel: 251-432-9741 Fax: 251-432-2029, 202 Congress Street Mobile Al 36603 Tel: 251-432-9741, 202 Congress Street Mobile Al 3660 Tel: 251-432-9741 Fax: 251-432-2029Attn: Jackie Griffin"
"Deanson International Co Ltd","No 51 Jing 2Rd Wuqi Dist Taichung City 435 Taiwan R O C Tel 886 -4-26595075 Uniform Invoice Number 80706922, No 51 Jing 2Rd Wuqi Dist Taichung City 435 Taiwan R O C Tel 886 -4-26595075, No 51 Jing 2Rd Wuqi Dist Taichung City 435 Taiwan R O C Tel: 886 -4-26595075","","Phone Numbers: 886426595075 --- Emails: ","United States","26","Houston, Tx","Tampico","320611, 320619","Titanium Dioxide Titanium Dioxide That Pure Titanium Dioxide Board Board Ocean Vessel Tolten Port Loading Altamira Mexico Aaab Shipping Mark Taichung Taiwan Wood Marked Ippc Drawn Under Documentary Credit Aaab Mega International Commercial Bank San Chung Branch Vendor Frame Work Tax, Titanium Dioxide Titanium Dioxide That Pure Titanium Dioxide Board Vessel Canada Port Loading Altamira Mexico Wood Marked Ippc Aaab Shipping Mark Taichung Taiwan Board Ocean Vendor Frame Work Tax, Titanium Dioxide Pure Titanium Dioxide Board Board Ocean Vessel London Port Loading Altamira Mexico Aaab Shipping Mark Taichung Taiwan Wood Marked Ippc Drawn Under Documentary Credit Aaab Mega International Commercial Bank San Chung Branch Vendor Frame Work Tax Titanium Dioxide","182","2723440","Deanson International Co Ltd","No 51 Jing 2Rd Wuqi Dist Taichung City 435 Taiwan R O C Tel 886 -4-26595075 Uniform Invoice Number 80706922, No 51 Jing 2Rd Wuqi Dist Taichung City 435 Taiwan R O C Tel 886 -4-26595075, No 51 Jing 2Rd Wuqi Dist Taichung City 435 Taiwan R O C Tel: 886 -4-26595075"
"Vitro Panama","Calle 12 Rio Abajo Detras Del Edificio Torres Del Rios Local 1 Telefono 507 224-3625 O Fax 507 221-5402 Contacto Rosa Rosas, Calle 12 Rio Abajo Detras Del Edificio Torres Del Rios Local 1 Telefono 507 224-3625 O Fax 507","","Phone Numbers: 5072243625, 5072215402 --- Emails: ","United States","20","Houston, Tx, San Juan, Puerto Rico","Tampico","700529, 700521","Clear Float Glass Clear Float Glass Cms Clear Float Glass End Cap Wood Cristal Flotado Claro Cajas Madera End Cap Vidrio Flotado Laminas Chapa Forma Rectangular Sin Cualquier Otro Trabajo Sin Camada Absorvente Cor Incolor Tipo Float Mexico Volume Clear Float Glass Clear Float Glass Cms, Clear Float Glass Clear Float Glass End Cap Wood Cristal Flotado Claro Cajas Madera End Cap Vidrio Flotado Laminas Chapa Forma Rectangular Sin Cualquier Otro Trabajo Sin Camada Absorvente Cor Incolor Tipo Float Mexico Volume, Clear Float Glass Clear Float Glass Clear Float Glass Clear Float Glass Cms Clear Float Glass Clear Float Glass Clear Float Glass End Cap Wood Cristal Flotado Claro Cajas Madera End Cap Vidrio Flotado Laminas Chapa Forma Rectangular Sin Cualquier Otro Trabajo Sin Camada Absorvente Cor Incolor Tipo Float Mexico Volume","99","1624987","Vitro Panama","Calle 12 Rio Abajo Detras Del Edificio Torres Del Rios Local 1 Telefono 507 224-3625 O Fax 507 221-5402 Contacto Rosa Rosas, Calle 12 Rio Abajo Detras Del Edificio Torres Del Rios Local 1 Telefono 507 224-3625 O Fax 507"
"New Fashion World Corportation","Po Box 51494 Toa Baja Pr 00950 Tax Id 66-0781066 San Juan Puerto Rico Phone 787-795-4900, Po Box 51494 Toa Baja Pr 00950 San Juan Puerto Rico Phone 787-795-4900","","Phone Numbers: 7877954900 --- Emails: ","United States","17","San Juan, Puerto Rico","Puerto Manzanillo","950510, 940179, 940180","Metal Outdoor Furniture Country China Hereby Certifying That There Solid Wood, Alfombras Ropa Mesa Xmas Ornaments Ceramic Kitchen Ware Cotton Table Clothing Drinking Glass Hereby Certifying That There Solid Wood Shipmentcountry China Indica, Articulos Natacion Decoracion Xmas Ornaments Swimming Pools Hereby Certifyng That There Solid Wood Country China","19","185941","New Fashion World Corportation, New Fashion World Corp","Po Box 51494 Toa Baja Pr 00950 Tax Id 66-0781066 San Juan Puerto Rico Phone 787-795-4900, Po Box 21494 Toa Baja Pr 00950 San Juan Puerto Rico Phone; 787-795-4900"
"Volvo Logistics Terminal","Terminalvagen Arendal Ark Volvo Packaging Gothenburg 405 08 Sweden Ctc Group Administrationvlc Tax Id Se556365974601, Terminalvagen Arendal Ark Volvo Packaging Gothenburg 405 08 Sweden Tax Id Se556365374601, Terminalvagen Arendal Ark Volvo Packaging Gothenburg 405 08 Sweden Contact Ingrid Gustavsson Telephone 46 313378234","","Phone Numbers: 556365974601, 556365374601, 46313236468 --- Emails: ","United States","17","Houston, Tx","Veracruz","441293, 440500, 441520","Frame Wood Lid Plywood, Automotive Bundle Pallet Wood Bundles Bundle Frame Wood Bundles Bundle Spacer Wood Fibre Bundles Bundle Fixing Spacer Plastic Bundles, Bundle Bundle Wood Bundles Frame Wood Bundle Lid Plywoodbundle Pallet Wood Bundle Lid Plywoodbundle Frame Wood Bundle Lid Plywoodbundle Frame Wood Bundle Lid Plywood","58","416881","Volvo Logistics Terminal, Volvo Logistics Terminal Terminalvagen Arendal Ark Volvo Packaging Gothenburg","405 08 Sweden Ctc Group Administrationvlc Tax Id Se556365974601, Terminalvagen Arendal Ark Volvo Packaging Gothenburg 405 08 Sweden Tax Id Se556365374601, 405 08 Sweden Tax Id Se556365974601 Ctc Group Administrationvlcdeepseaimpor"
"Bfg Of North Carolina Inc","1321 Long Street High Point Nc 27262 Phone: 336-887-3832, 1321 Long Street High Point Nc 27262 Usa Phone: 336-8873832","","Phone Numbers: 3368873832 --- Emails: ","United States","15","New Orleans, La, Houston, Tx","Tampico, Veracruz","940350, 700992","Furniture Pine Wood Elliottis Clean Board Col Lect Ncm Wooden Applicable Express Lease Delivery Address Furniture Corp Military Pearl River, Furniture Pine Wood Elliottis Clean Board Col Lect Ncm Wooden Applicable Express Releas Delivery Address Urniture Corp Old Mili Tary Pearl River, Volumes Assembled Oden Furniture Pine Wood Below Jcs Due Ruc Ncm Solid Wood Materi Has Been Shi Pment Wooden Aplicable Eight Express Releas Delivery Address Rtg Furniture Corporation Addre Miller Zip City Brookshire Country Estados Unidos Phone Logisti Csroomstogo","19","125517","R T G Furniture Corp, Rtg Furniture Corp","11540 Highway 92 East Seffner Fl 33584 Phone: 813 621-3958, 11540 Highway 92 East Seffner Fl 33584 Phone: 813 621-3958 -, 11540 Hwy 92 East Seffner Fl 33584 Phone: 813 623-5400"
"Bayer S A","; Rua Domingos Jorge 1100 Ctc: Maria Teixeira1@Bayer Com; Tel: +55 11 5694 7018 0, ; Rua Domingos Jorge 1100 Ctc: Maria Teixeira1@Bayer Com; Tel:  11 5694 7018 0","bayer.com","Phone Numbers: +551156947018, 11569470180 --- Emails: Maria Teixeira1@Bayer Com","United States","14","Houston, Tx","Veracruz","400220, 940330, 730210","Aspirina Eferv Brasil Batch Lbp Flanax Tab Batch Lng Brpo Temperatura Degrees Unprocessed Wood Cargo Securing Handling Wood Treated According Ispm Standard Sin Ventilacion Humedad Ncm Envio Bayer Domingos Jorge Socorro Sao Paulo Brasil Camila Amaral Bayer, Flanax Tab Batch Lra Flanax Tablets Batch Lth Temperatura Degrees Unprocessed Wood Cargo Securing Handling Wood Treated According Ispm Standard Sin Ventilacion Humedad Ncm Envio Bayer Domingos Jorge Socorro Sao Paulo Brasil Camila Amaral Bayer, Flanax Tab Batch Pns Temperatura Degrees Unprocessed Wood Cargo Securing Handling Wood Treated According Ispm Standard Sin Ventilacion Humedad Ncm Envio Bayer Domingos Jorge Socorro Sao Paulo Brasil Camila Amaral Bayer","14","49277","Bayer Sa, Bayer S A","Est Boa Esperanca 650 Belford Roxo, ; Rua Domingos Jorge 1100 Ctc: Maria Teixeira1@Bayer Com; Tel: +55 11 5694 7018"
"Ineos Styrolution Do Brasil","Polimeros Ltda Cnpj 12 487 655/0002-04 Av Papa Joao Xxiii 2 479 09370-800 Maua, Polimeros Ltda Cnpj 12 487 655/0003-87 Rod Br 101 2050 - Sala 15 88311-600 Itajai, Polimer Ltda Cnpj 12487655000204 Av Papa Joao Xxiii 2479 Suppl Amz 2 Bl A Loteamento Industrial","","Phone Numbers: 247909370800, 1588311600, 1126638100 --- Emails: ","United States","14","Houston, Tx, San Juan, Puerto Rico","Tampico, Port Bustamante","390390, 730210, 390310","Chemical Product Each Luran Ncm Country Mexico Procedence Country Mexico Acquisition Country Mexico Wooden Treated Certified Wood Cargo Securing Handling Treated According Ispm Standard Brazil Inoffensive Chemical Product, Chemical Product Big Bags Each Luran Ncm Inoffensive Chemical Product Country Mexico Procedence Country Mexico Acquisition Country Mexico Wooden Treated Certified Wood Cargo Securing Handling Treated According Ispm Standard, Chemical Product Big Each Luran Ncm Inoffensive Chemical Product Country Mexico Procedence Country Mexico Acquisition Country Mexico Wooden Treated Certified Wood Cargo Securing Handling Treated According Ispm Standard Chemical Product Big Each Luran Ncm Inoffensive Chemical Product Country Mexico Procedence Country Mexico Acquisition Country Mexico Wooden Treated Certified Wood Cargo Securing Handling Treated According Ispm Standard","49","534804","Comissaria Pibernat Ltda, Pbl Assessoria De Comercio Exterior Ltda, Pbl Assessoria De Comerico Exterior Ltda","Cnpj 57 108 730/0002-09 Rua Bras Cubas N 37 - 2 Andar 11013-161 Santos/Sp, Cnpj 92 102 433/0009-23 Rua Manoel Vieira Garcao No 120 88301-425 Itajai Brazil, R Alexandre Herculano 197 Cj 1901 Gonzaga 11050-031 Santos"
"The Chemours Chemical Shanghai Co Ltd","Room 526 5/F Building No 1 No 239 Gang Ao Road China Shanghai Pilot Free Trade Zone Shanghai Prc T 862126120836 Attn Zonghua Wang, Room 526 5/F Building No 1 No 239 Gang Ao Road China Shanghai Pilot Free Trade Zone Shanghai Prc Tel 862126120836 Fax 862126120862, Room 526 5/F Building No 1 No 239 Gang Ao Road China Shanghai Pilot Free Trade Zone Shanghai Prc T 862138622909 Attn Zonghua Wang","","Phone Numbers: 862126120836, 862126120862, 862138622909 --- Emails: ","United States","14","Houston, Tx","Tampico","320611","Titanium Dioxide That Tio Tipure Epht Multi Modal Board Rail Vessel Malleco Port Loading Altamira Mexico Wood Marked Ippc Vendor Frame Work Hapag Lloyd Tax, Titanium Dioxide That Tio Tipure Epht Multi Modal Board Rail Vessel Msc Barcelona Port Loading Altamira Mexico Wood Matrial Marked Ippc Vendor Frame Work Tax, Titanium Dioxide That Tio Tipure Epht Multi Modal Board Rail Vessel Santa Viola Port Loading Altamira Mexico Wood Marked Ippc Vendor Frame Work Tax","48","728700","The Chemours Chemical Shanghai Co Ltd","Room 526 5/F Building No 1 No 239 Gang Ao Road China Shanghai Pilot Free Trade Zone Shanghai Prc T 862126120836 Attn Zonghua Wang, Room 526 5/F Building No 1 No 239 Gang Ao Road China Shanghai Pilot Free Trade Zone Shanghai Prc Tel 862126120836 Fax 862126120862, Room 526 5/F Building No 1 No 239 Gang Ao Road China Shanghai Pilot Free Trade Zone Shanghai Prc T 862138622909 Attn Zonghua Wang"
"Bridgestone Do Brasil Industria E Comercio Ltda","Av Queiros Dos Santos 1717 Santo Andre-Sp-Brasil- Cep 09015-901 Ctc Ms Simone C So Uza Ph 5511 4433 1276, Av Queiroz Dos Santos 1717 Santo Andre-Sp-Brasil- Cep 09015-901 Ctc Ms Simone C So Uza Ph 5511 4433 1276, Av Queiros Dos Santos 1717 Santo Andre-Sp-Brasil Ctc Ms Simone C Souza Ph 5511 4433 1276","","Phone Numbers: 551144331276 --- Emails: ","United States","13","Houston, Tx, New Orleans, La, Norfolk, Va","Tampico","280300","Carbon Black Carbon Black Inspec Carbon Mineral Negro Humo Inspec Ncm Wood, Carbon Mineral Carbon Black Inspec Carbon Mineral Negro Humo Inspec Ncm Ncm Wood, Carbon Black Carbon Black Inspec Carbon Mineral Negro Humo Inspec Ncm Ncm Wood","125","1421298","Bridgestone Do Brasil Industria E Comercio Ltda, Bridgestone Do Brasil Industria E C Omercio Ltda","Av Jornalista Roberto Marinho 85 Tower Bridge Corporate - 18 Floor 04576-010-Sao Paulo-Sp-Brazil Atte Dept Comex, Av Jornalista Roberto Marinho 85 Tower Bridge Corporate - 18 Floor 04576- 010- Sao Paulo - Sp - Brazil, Av Jornalista Roberto Marinho 85 Tower Bridge Corporate- 18 Floor 04756 -010-Sao Paulo-Sp-Brazil Atte Dept Comex"
"Gkn Do Brasil Ltda","Rua Joaquim Silveira 577 Porto Alegre 58512310000175 Mercedes Carvalho, Rua Joaquim Silveira 577 Porto Alegre 58512310000175 Mercedes Carvalho 55 51 3349 9500, Rua Joaquim Silveira 577 Porto Alegre 55 51 3349 9500 58512310000175 Mercedes Carvalho","","Phone Numbers: 58512310000175, 555133499500, 12310000175 --- Emails: ","United States","13","Houston, Tx","Veracruz","940350, 401693, 440399","Automotive Wooden Processed Wood Ncm, Trisphere Automotive Use Wooden Processed Wood Ncm, Automotive Use Bundles Trisphere Automotive Use Wood Declaration Treated Certified Plastics Steel Drums Drxx Polyisocyanate Wood Declaration Treated Certified Ncm Ball Bearing Ball Bearing Wood Declaration Treated Certified Ncm Stainless Steel Sheet Stainless Steel Sheet Wood Declaration Treated Certified Ncm Fearlessly Cap Dream Fearlessly Cap Love Fearlessly Cap Live Fearlessly Cap Wood Declaration Treated Certified Automotive Use Bundles Trisphere Automotive Use Wood Declaration Treated Certified Polyisocyanate Steel Drums Drxx Polyisocyanate Wood Declaration Treated Certified Ball Bearing Ball Bearing Wood Declaration Treated Certified Stainless Steel Sheet Stainless Steel Sheet Wood Declaration Treated Certified Ncm Fearlessly Cap Dream Fearlessly Cap Love Fearlessly Cap Live Fearlessly Cap Wood Declaration Treated Certified Ncm Ncm Ncm Ncm","14","117573","Gkn Do Brasil Ltda","Rua Joaquim Silveira 577 Porto Alegre 58512310000175 Mercedes Carvalho, Rua Joaquim Silveira 577 Porto Alegre 58512310000175 Mercedes Carvalho 55 51 3349 9500, Rua Joaquim Silveira 577 Porto Alegre 55 51 3349 9500 58512310000175 Mercedes Carvalho"
"Hardwoods Specialty Products Us L","17618 Harvill Avenue Perris Ca 92570 Usa Tel: 951-653-9400, 17618 Harvill Avenue Perris Ca 92570 Usa Tel: 951-653-9400 Fax: 951-653-9444, 17618 Harvill Avenue Perris Ca 92570 Usa Tel: 951-653-9400 Fax: 951-653-9444 Attn: Noyna Mori","","Phone Numbers: 9516539400, 9516539444 --- Emails: ","United States","13","Los Angeles, Ca, Long Beach, Ca","Lazaro Cardenas","441232","Birc Plywood Composite Wood Prod Ucts Appearing Iden Tified Descriptions Ing Carb Tsca Must Comply Ith Evironmental Protectio Agencys Tsca Title Standa Rds Reduce Formaldehyde Emi Ssions From Composite Wood Pro Ducts Mrku Netto, Netto Birch Plywood Composite Ood Appearing Identified Descriptio Carb Tsc Must Comply Eviron Mental Protection Agency Tsc Title Andards Redu Formaldehyde Emissions From Composite Wood, Birc Plywood Composite Wood Prod Ucts Appearing Iden Tified Descriptions Ing Carb Tsca Must Comply Ith Evironmental Protectio Agencys Tsca Title Standa Rds Reduce Formaldehyde Emi Ssions From Composite Wood Pro Ducts Tllu Netto","26","351154","John M Brining Co Inc","202 Congress Street Mobile Al 3660 Tel: 251-432-9741 Fax: 251-432-202 Email: Imports@Jmbrining Com, 202 Congress Street Mobile Al 36603 Tel:251-432-9741 Fax:251-432-2029, 202 Congress Street Mobile Al 3660 Tel: 251-432-9741 Fax: 251-432-2029Attn: John Hearne Email: John@Jmbri"
"Rgc Coffee Inc","1330 Greene Avenue Westmount Quebec H3Z 2B1 Canada Tel 5148451200 Id 035301-00098 Logisticsrgccoffee Com, 1330 Greene Avenue Westmount Quebec H3Z 2B1 Canada Tel 5148451200 Id035301-00098 Logisticsrgccoffee Com, Id035301-00098 1330 Greene Avenue Westmount Quebec H3Z 2B1 Canada Tel 5148451200 Fax 5148451250","rgccoffee.com","Phone Numbers: 5148451200, 035301000981330, 0353010009 --- Emails: Queb Logistics@Rgccoffee Com T","United States","12","New York, Ny, Houston, Tx, New York/Newark Area, Newark, Nj","Cartagena, Veracruz, Puerto Manzanillo","090111, 210690","Coffee Beans Dry Clean Grade Bags Mexican Green Coffee Beans Roasted Decafeinated Hst Kilos Each Bags Bags Board Payable Basel Switzerland Commodity Supplies Routing Party Commod Service Contract Egc Fda Facility Rgc Fda Tpat Declared That Does Include Any Solid Wood Rgc Produc Has Been Processed Fully Control Biological Pathogens Physical Hazards Chemical Hazards Including Mycotoxins That Might Present Requires Further Processing Prior Consumtion Coffee Beans Dry Clean Grade Bags Mexican Green Coffee Beans Roasted Decafeinated Hst Kilos Each Bags Bags Board Payable Basel Switzerland Commodity Supplies Routing Party Commod Service Contract Egc Fda Facility Rgc Fda Tpat Declared That Does Include Any Solid Wood Rgc, Coffee Beans Dry Clean Grade Bags Mexican Green Coffee Beans Roasted Decafeinated Hst Kilos Each Bags Bags Payable Basel Switzerland Commodity Supplies Routing Party Commod Service Contract Egc Commod Fda Facility Rgc Fda Tpat Decalred That Doest Include Any Solid Wood Rgc Produc Has Been Processed Fully Control Biological Pathogens Physical Hazards Chemical Hazards Including Mycotoxins That Might Present Requires Further Processing Prior Consumtion, Coffee Beans Dry Clean Grade Bags Mexican Green Coffee Beans Roasted Decaffeinated Hst Kilos Each Bags Bags Board Payable Basel Csa Fda Facility Rgc Fda Ctpat Declared That Hipment Does Include Any Solid Wood Product Has Been Processed Fully Control Biological Pathogens Physical Hazards Chemical Hazards Including Mycotoxins That Might Present Requires Further Processing Prior Consumption","26","403683","Commodity Supplies A, Rgc Coffee Inc, Brauner Intl Corp","G Roosstrasse 53 Postfach 172 Ch-8832 Wollerau Switzerland Tel 01141448074444 Meylin Estradacommodity Ch, Id035301-00098 1330 Greene Avenue Westmount Quebec H3Z 2B1 Canada Tel 5148451200 Fax 5148451250, Id035301-0098 1330 Greene Avenue Westmount Quebec H3Z 2B1 Canada Tel 5148451200 Fax 8451250"
"Singla Timbers Private Limited","Survey Number 548/1 Mithirohar Gandhidham 370201 Gujarat In Iec: 3009017405 Pan: Aancs8285R Gst: 24Aancs8285R1Z7 /, Survey Number 548/1 Mithirohar Gandhidham- 370201 Gujarat India Gst:24Aancs8285R127 Iec:3009017405, Surve Gandhidham -370201 Gujarat India Iec -3009017405 Gstin - 24Aancs8285R1Z7 Pan- Aancs8285R Arpitgupta26@Gmail Com+919996861560","","Phone Numbers: 3009017405, +919996861560 --- Emails: Aancs8285R Arpitgupta26@Gmail Com, Email- Arpitgupta26@Gmail Com","United States","12","Baltimore, Md, Houston, Tx, Los Angeles, Ca","Port Bustamante, Veracruz","440342, 440349, 440110","Troza Madera Teca Rollo Teak Wood Round Logs Troza Madera Teca Rollo Teak Wood Round Logs Troza Madera Teca Rollo Teak Wood Round Logs Troza Madera Teca Rollo Teak Wood Round Logs, Teak Wood Round Logs Hoppus Teak Wood Round Logs Hoppus Hoppus Volumen Hoppus Equival Hubber Kavish Interglobe Pte Jalan Besar Sim Lim Tower Building Rochor Singapore Uen, Teak Wood Round Logs Hoppus Teak Wood Round Logs Hoppus Hoppus Volumen Hoppus Equival Hubber Kavish Interglobe Pte Jalan Besar Sim Lim Tower Building Rochor Singapore Uen Teak Wood Round Logs Hoppus","98","1321123","Singla Timbers Private Limited, Kavish Interglobe Pte Ltd","Survey Number 548/1 Mithirohar Gandhidham 370201 Gujarat In Iec: 3009017405 Pan: Aancs8285R Gst: 24Aancs8285R1Z7 /, 10 Jalan Besar 06-07 Sim Lim Tower Building Rochor Singapore, 10 Jalan Besar 06 07 Sim Lim Tower Singapore -208787"
